B2: Season 91/92 to date | C2: =C10 -> 291882000 | F2: =F10 -> 206782000 | G2: =C2-F2 -> 85100000 | H2: =SUM(G11:G334) -> 85100000 | I2: =G2-H2 -> 0
B3: Season 03/04 to date | C3: =C194+C175+C161+C142+C124+C116+C107+C94+C84+C74+C57+C44+C29 -> 220030000 | F3: =F194+F175+F161+F142+F124+F116+F107+F94+F84+F74+F57+F44+F29 -> 122725000 | G3: =C3-F3 -> 97305000 | H3: =SUM(G11:G194) -> 97305000 | I3: =G3-H3 -> 0
B4: last five seasons | C4: =C84+C74+C57+C44+C29 -> 120600000 | F4: =F84+F74+F57+F44+F29 -> 22000000 | G4: =C4-F4 -> 98600000 | H4: =SUM(G11:G84) -> 98600000 | I4: =G4-H4 -> 0
B5: Championship | C5: =C175+C161+C142+C124+C116+C107+C94+C84+C74+C57+C44+C29 -> 218445000 | F5: =F175+F161+F142+F124+F116+F107+F94+F84+F74+F57+F44+F29 -> 95125000 | G5: =C5-F5 -> 123320000 | H5: =SUM(G11:G175) -> 123320000 | I5: =G5-H5 -> 0
B6: Before Magnusson Buyout | C6: =SUM(C334+C325+C313+C303+C291+C275+C264+C253+C238+C226+C208+C194+C175+C161) -> 84012000 | F6: =SUM(F334+F325+F313+F303+F291+F275+F264+F253+F238+F226+F208+F194+F175+F161+F29) -> 127557000 | G6: =C6-F6 -> -43545000 | H6: =SUM(G161:G334) -> -32545000 | I6: =G6-H6 -> -11000000
B7: After Magnusson Buyout | C7: =C142+C124+C116+C107+C94+C84+C74+C57+C44+C29 -> 207870000 | F7: =F142+F124+F116+F107+F94+F84+F74+F57+F44+F29 -> 90225000 | G7: =C7-F7 -> 117645000 | H7: =SUM(G11:G142) -> 117645000 | I7: =G7-H7 -> 0
B9: West Ham
B10: Combined Totals | C10: =C334+C325+C313+C303+C291+C275+C264+C253+C238+C226+C208+C194+C175+C161+C142+C124+C116+C107+C94+C84+C74+C57+C44+C29 -> 291882000 | F10: =F334+F325+F313+F303+F291+F275+F264+F253+F238+F226+F208+F194+F175+F161+F142+F124+F116+F107+F94+F84+F74+F57+F44+F29 -> 206782000 | G10: =SUM(G11:G335) -> 85100000 | H10: =SUM(H11:H336) -> 1218
B11: Players Purchased | C11: Fee | E11: Players Sold | F11: Fee | G11: Net Total | H11: Points | I11: Position
B12: Season 15/16
B13: Dimitri Payet | C13: 10700000 | E13: Dan Potts | F13: Free
B14: Pedro Obiang | C14: 4300000 | E14: Carlton Cole | F14: Released
B15: Darren Randolph | C15: Free | E15: Jussi Jaaskelainen | F15: Released
B16: Stephen Hendrie | C16: 1000000 | E16: Guy Demel | F16: Released
B17: Angelo Ogbonna | C17: 10000000 | E17: Nene | F17: Released
B18: Nikica Jelavić | C18: 3000000 | E18: Paul McCallum | F18: Released
B19: George Dobson | C19: Free | E19: Stewart Downing | F19: 5500000
B20: Michail Antonio | C20: 7000000 | E20: Modibo Maïga | F20: Undisclosed
B21: Sam Byram | C21: 3700000 | E21: Kevin Nolan | F21: Released
E22: Matt Jarvis | F22: 2500000
E23: Mauro Zárate | F23: 3000000
H28: PTS | I28: POS
C29: =SUM(C13:C22) -> 39700000 | F29: =SUM(F13:F28) -> 11000000 | G29: =C29-F29 -> 28700000
B30: Season 14/15
B31: Cheikhou Kouyaté | C31: 7000000 | E31: Joe Cole | F31: Free
B32: Mauro Zárate | C32: Undisclosed | E32: Jack Collison | F32: Released
B33: Diego Poyet | C33: Compensation | E33: George Mc Carthy | F33: Released
B34: Enner Valencia | C34: 12000000 | E34: Callum Driver | F34: Released
B35: Diafra Sakho | C35: 4500000 | E35: Jordan Spence | F35: Released
B36: Morgan Amalfitano | C36: Undisclosed | E36: Mohamed Diamé | F36: 3500000
B37: Aaron Cresswell | C37: 3750000 | E37: Matt Taylor | F37: Undisclosed
B38: Doneil Henry | C38: 2000000 | E38: Ben Sheaf | F38: Undisclosed
B39: Carlton Cole | C39: Free | E39: Stephen Henderson | F39: Free
E40: Robert Girdlestone | F40: Undisclosed
E41: Alou Diarra | F41: Released
E42: Jamie Harney | F42: Free
E43: Ricardo Vaz Te | F43: Released | H43: PTS | I43: POS
C44: =SUM(C31:C42) -> 29250000 | F44: =SUM(F31:F43) -> 3500000 | G44: =C44-F44 -> 25750000 | H44: 47 | I44: 12
B45: Season 13/14
B46: Andrew Carrol | C46: 15500000 | E46: Robert Hall | F46: Free
B47: Danny Whitehead | C47: Undisclosed | E47: Jake Larkins | F47: free
B48: Adrián San Miguel del Castillo | C48: Free | E48: Carlton Cole, | F48: Released
B49: Razvan Dinca Rat | C49: Free | E49: Eoin Wearen.. | F49: Released
B50: Stewart Downing | C50: 6000000 | E50: Gary ONeil, | F50: Released
B51: Jaanai Gordon | C51: 3500000 | E51: Jack Powell, | F51: Released
B52: Abdul Razak | C52: Free | E52: Jami Rafati, | F52: Released
E53: Pelly Ruddock | F53: Undisclosed
H55: Prem
H56: PTS | I56: POS
B57: Total | C57: =SUM(C46:C56) -> 25000000 | F57: =SUM(F46:F56) -> 0 | G57: =C57-F57 -> 25000000 | H57: 40 | I57: 13
B58: Season 12/13
B59: Stephen Henderson | C59: Undisclosed | E59: Sam Cowler | F59: Free
B60: Mohamed Diame | C60: Free | E60: Frank Nouble | F60: Free
B61: George McCartney | C61: Undisclosed | E61: Jordan Brown | F61: Free
B62: Jussi Jaaskelainen | C62: Free | E62: Robert Green | F62: Free
B63: Modibo Maíga | C63: 5000000 | E63: Pablo Barrera | F63: Undisclosed
B64: Raphael Spiegel | C64: Undisclosed | E64: Oliver Lee | F64: Free
B65: James Collins | C65: 2000000 | E65: Fred Sears | F65: Free
B66: Alou Diarra | C66: 2000000 | E66: Marek Stech | F66: Free
B67: Matthew Jarvis | C67: 10750000 | E67: Abdoulaye Faye | F67: Free
B68: Sean Maguire | C68: Undisclosed | E68: Cristian Montano | F68: Undisclosed
B69: Joe Cole | C69: Free | E69: Sam Baldock | F69: 1500000
B70: Razvan Rat | C70: Free | E70: Nicky Maynard | F70: 2500000
E71: John Carew | F71: Free
E72: Julien Faubert | F72: Free | H72: Prem
E73: Papa Bouba Diop | F73: Free | H73: PTS | I73: POS
B74: Total | C74: =SUM(C59:C67) -> 19750000 | F74: =SUM(F59:F69) -> 1500000 | G74: =C74-F74 -> 18250000 | H74: 46 | I74: 10
B75: Season 11/12
B76: Kevin Nolan | C76: 3500000 | E76: Daniel Gabbidon | F76: free
B77: Abdoulaye Faye | C77: Free | E77: Demba Ba | F77: Free
B78: Matthew Taylor | C78: 2400000 | E78: Scott Parker | F78: 6000000
B79: Ravel Morrison | C79: 1000000
B80: Guy Demel | C80: Free
B81: Joey O Brien | C81: Free | H81: PTS | I81: POS
B82: Ricardo Vaz Te | C82: Undisclsoed
B83: Pelly Ruddock | C83: Undisclosed
B84: Total | C84: =SUM(C76:C83) -> 6900000 | F84: =SUM(F76:F81) -> 6000000 | G84: =C84-F84 -> 900000 | H84: 86 | I84: 3
B85: Season 10/11
B86: Thomas Hitzlsperger | C86: Free | E86: Bondz N'Gala | F86: Free
B87: Pablo Barrera | C87: 4000000 | E87: Guillermo Franco | F87: Released
B88: Thomas Hitzlsperger | C88: Free | E88: Allesandro Diamanti | F88: 1800000
B89: Frederic Piquionne | C89: 1200000 | E89: Fabio Daprela | F89: Free
B90: Winston Reid | C90: 3000000 | E90: Valon Behrami | F90: Undisclosed
B91: Demba Ba | C91: 6000000
B92: Gary O Neill | C92: Undisclosed | H92: Prem
B93: Paul McCallum | C93: Undisclosed | H93: PTS | I93: POS
B94: Total | C94: =SUM(C85:C91) -> 14200000 | F94: =SUM(F85:F90) -> 1800000 | G94: =C94-F94 -> 12400000 | H94: 33 | I94: 20
B95: Season 09/10
B96: Hérita Ilunga | C96: undisclosed | E96: Kyle Reid | F96: Free
B97: Terry Dixon | C97: Free | E97: Joe Widdowson | F97: Free
B98: Peter Kurucz | C98: undisclosed | E98: Lee Bower | F98: Free
B99: Jack Lampe | C99: Free | E99: Savio Nsereko | F99: Swap[1]
B100: Fank Nouble | C100: Undisclosed | E100: James Collins | F100: 5000000
B101: Fabio Daprela | C101: Undisclosed | E101: Jimmy Walker | F101: Free
B102: Radoslav Kovac | C102: 2000000 | E102: Lucas Neill | F102: Free
B103: Alessandro Diamanti | C103: 6000000 | E103: Nigel Quashie | F103: Free
B104: Manuel Da Costa | C104: Swap[2]
B105: Benedict Mc Carthy | C105: 2500000 | H105: Prem
B106: Aruajo Ilan | C106: Signed | H106: PTS | I106: POS
B107: Total | C107: =SUM(C96:C105) -> 10500000 | F107: =SUM(F96:F103) -> 5000000 | G107: =C107-F107 -> 5500000 | H107: 35 | I107: 17
B108: Season 08/09
B109: Savio Nsereko | C109: 9000000 | E109: Anton Ferdinand | F109: 8000000
E110: Ben Hunt | F110: Signed
E111: Nolberto Solano | F111: Free
E112: George Mc Carthy | F112: 4500000
E113: Matthew Etherington | F113: 2000000
E114: Craig Bellamy | F114: 14000000 | H114: Prem
E115: Hayden Mullins | F115: 2000000 | H115: PTS | I115: POS
B116: Total | C116: =SUM(C109:C115) -> 9000000 | F116: =SUM(F96:F115) -> 40500000 | G116: =C116-F116 -> -31500000 | H116: 51 | I116: 9
B118: Season 07/08
B119: Craig Bellamy | C119: 7500000 | E119: Yossi Benayoun | F119: 5000000
B120: Fredrik Ljungberg | C120: 3000000 | E120: Paul Konchesky | F120: 2000000
B121: Kieron Dyer | C121: 6000000 | E121: Marlon Harewood | F121: 4000000
B122: Nolberto Solano | C122: Free | E122: Carlos Tevez | F122: Signed | H122: Prem
E123: Hogan Ephraim | F123: 800000 | H123: PTS | I123: POS
B124: Total | C124: =SUM(C119:C123) -> 16500000 | F124: =SUM(F119:F123) -> 11800000 | G124: =C124-F124 -> 4700000 | H124: 49 | I124: 10
B126: Season 06/07
B127: Carlton Cole | C127: 3000000 | E127: Shaka Hislop | F127: Free
B128: Tyrone Mears | C128: 1000000 | E128: Carl Fletcher | F128: 400000
B129: John Pantsil | C129: 1000000 | E129: Trent McClenahan | F129: Free
B130: George McCartney | C130: Signed | E130: Clive Clarke | F130: Signed
B131: Rob Green | C131: 2000000 | E131: Stephen Bywater | F131: 225000
B132: Carlos Tevez | C132: Signed | E132: Javier Mascherano | F132: Signed
B133: Javier Mascherano | C133: Signed | E133: Tyrone Mears | F133: 1000000
B134: Luis Boa Morte | C134: 5000000 | E134: Teddy Sheringham | F134: Free
B135: Nigel Quashie | C135: 1500000 | E135: Nigel Reo-Coker | F135: 7500000
B136: Calum Davenport | C136: 3000000 | E136: Shaun Newton | F136: Free
B137: Lucas Neill | C137: 1500000 | E137: Roy Carroll | F137: Free
B138: Matthew Upson | C138: 6000000
B139: Scott Parker | C139: 7000000
B140: Julien Faubert | C140: 6070000 | H140: Prem
B141: Richard Wright | C141: Free | H141: PTS | I141: POS
B142: Total | C142: =SUM(C127:C141) -> 37070000 | F142: =SUM(F127:F141) -> 9125000 | G142: =C142-F142 -> 27945000 | H142: 41 | I142: 15
B144: Season 05/06
B145: Danny Gabbidon | C145: Signed | E145: Greg Pearson | F145: Free
B146: Paul Konchesky | C146: 1500000 | E146: Rufus Brevett | F146: Free
B147: James Collins | C147: Signed | E147: Chris Powell | F147: Free
B148: Shaka Hislop | C148: Free | E148: Don Hutchison | F148: Free
B149: Clive Clarke | C149: 275000 | E149: Malky Mackay | F149: Free
B150: Petr Mikolanda | C150: Signed | E150: Steve Lomas | F150: Free
B151: Sekou Baradji | C151: Signed | E151: Youssef Sofiane | F151: Signed
B152: Yaniv Katan | C152: 100000 | E152: Luke Chadwick | F152: 100000
B153: Dean Ashton | C153: 7250000 | E153: Gavin Williams | F153: 300000
B154: Lee Bowyer | C154: Signed | E154: Moses Ashikodi | F154: Free
B155: Jonathan Spector | C155: 500000 | E155: Tomas Repka | F155: Free
E156: Ishmael Welsh | F156: Free
E157: Darren Behcet | F157: Free
E158: Elliott Ward | F158: 1000000
E159: Chris Cohen | F159: Signed | H159: Prem
E160: Petr Mikolanda | F160: Free | H160: PTS | I160: POS
B161: Total | C161: =SUM(C145:C160) -> 9625000 | F161: =SUM(F145:F160) -> 1400000 | G161: =C161-F161 -> 8225000 | H161: 55 | I161: 9
B163: Season 04/05
B164: Teddy Sheringham | C164: Free | E164: Kevin Horlock | F164: Free
B165: Sergei Rebrov | C165: Free | E165: San Lee | F165: Free
B166: Luke Chadwick | C166: Free | E166: David Connolly | F166: 500000
B167: Moses Ashikodi | C167: Free | E167: Brian Deane | F167: Free
B168: Carl Fletcher | C168: 275000 | E168: Daryl McMahon | F168: Free
B169: Malky Mackay | C169: 300000 | E169: Jobi McAnuff | F169: Signed
B170: Mauricio Taricco | C170: Free | E170: Michael Carrick | F170: 2750000
B171: Gavin Williams | C171: 250000 | E171: Richard Garcia | F171: Nominal
B172: Chris Powell | C172: Free | E172: Adam Nowland | F172: 250000
B173: Shaun Newton | C173: 125000 | E173: Rob Lee | F173: Free
B174: Roy Carroll | C174: Free | E174: Sergei Rebrov | F174: Free | H174: PTS | I174: POS
B175: Total | C175: =SUM(C164:C174) -> 950000 | F175: =SUM(F164:F174) -> 3500000 | G175: =C175-F175 -> -2550000 | H175: 73 | I175: 6
B177: Season 03/04
B178: David Connolly | C178: 285000 | E178: Lee Bowyer | F178: Free
B179: Rob Lee | C179: Free | E179: Vladimir Labant | F179: Free
B180: Matthew Etherington | C180: Swap | E180: Les Ferdinand | F180: Free
B181: Kevin Horlock | C181: 300000 | E181: Glen Johnson | F181: 6000000
B182: Hayden Mullins | C182: Signed | E182: Trevor Sinclair | F182: 2500000
B183: Brian Deane | C183: Free | E183: Frederic Kanoute | F183: 3500000
B184: Marlon Harewood | C184: 500000 | E184: Gary Breen | F184: Free
B185: Andy Melville | C185: Free | E185: Joe Cole | F185: 6600000
B186: Nigel Reo-Coker | C186: 500000 | E186: Scott Minto | F186: Free
B187: Adam Nowland | C187: Signed | E187: Paolo Di Canio | F187: Free
B188: Bobby Zamora | C188: Swap | E188: Sebastien Schemmel | F188: Free
B189: Jobi McAnuff | C189: Signed | E189: Ezomo Iriekpen | F189: Free
B190: Pavel Srnicek | C190: Free | E190: Hayden Mullins | F190: Signed
B191: Jimmy Walker | C191: Free | E191: David James | F191: 2000000
E192: Ian Pearce | F192: Signed
E193: Jermain Defoe | F193: 7000000 | H193: PTS | I193: POS
B194: Total | C194: =SUM(C178:C193) -> 1585000 | F194: =SUM(F178:F193) -> 27600000 | G194: =C194-F194 -> -26015000 | H194: 74 | I194: 4
B196: Season 02/03
B197: Gary Breen | C197: Free | E197: Shaka Hislop | F197: Free
B198: Lee Bowyer | C198: 100000 | E198: Kieran Richardson | F198: Unknown
B199: Les Ferdinand | C199: Nominal | E199: Ragnvald Soma | F199: Signed
B200: Rufus Brevett | C200: Signed | E200: Omer Riza | F200: Free
B201: David Noble | C201: Signed | E201: Paul Kitson | F201: Free
E202: Steve Potts | F202: Free
E203: Louis Riddle | F203: Free
E204: Laurent Courtois | F204: Free
E205: Grant McCann | F205: 50000
E206: Billy Mehmet | F206: Free | H206: Prem
E207: Leon Britton | F207: Free | H207: PTS | I207: POS
B208: Total | C208: =SUM(C197:C207) -> 100000 | F208: =SUM(F197:F207) -> 50000 | G208: =C208-F208 -> 50000 | H208: 42 | I208: 18
B210: Season 01/02
B211: Sebastien Schemmel | C211: 465000 | E211: Stuart Pearce | F211: Free
B212: David James | C212: 3500000 | E212: Igor Stimac | F212: Free
B213: Laurent Courtois | C213: Free | E213: Amos Foyewa | F213: Free
B214: Don Hutchison | C214: 5000000 | E214: Stevland Angus | F214: Free
B215: Tomas Repka | C215: 5500000 | E215: Terrell Forbes | F215: Free
B216: Sven Andersson | C216: Free | E216: Berti Brayley | F216: Free
B217: Vladimir Labant | C217: 900000 | E217: Gavin Holligan | F217: Free
B218: David Forde | C218: 75000 | E218: Davor Suker | F218: Free
B219: Youssef Sofiane | C219: Free | E219: Steve Laurie | F219: Free
B220: Rai Van Der Gouw | C220: Free | E220: Steven Clark | F220: 12000
E221: Anwar Uddin | F221: Free
E222: Svetoslav Todorov | F222: 750000
E223: Adam Newton | F223: Free
E224: Hayden Foxe | F224: 400000 | H224: Prem
E225: Rigobert Song | F225: 1000000 | H225: PTS | I225: POS
B226: Total | C226: =SUM(C211:C225) -> 15440000 | F226: =SUM(F211:F225) -> 2162000 | G226: =C226-F226 -> 13278000 | H226: 53 | I226: 7
B228: Season 00/01
B229: Rigobert Song | C229: 2500000 | E229: Neil Ruddock | F229: Signed
B230: Titi Camara | C230: 2200000 | E230: Gary Alexander | F230: 200000
B231: Ragnvald Soma | C231: 800000 | E231: Paulo Wanchope | F231: 3650000
B232: Christian Dailly | C232: 1750000 | E232: Rio Ferdinand | F232: 18000000
B233: Svetoslav Todorov | C233: 500000 | E233: Daniel Sjolund | F233: 1000000
B234: Hayden Foxe | C234: Free | E234: Tom Williams | F234: Free
E235: Alex O'Reilly | F235: Monthly
E236: Jimmy Bullard | F236: Free | H236: Prem
E237: Frank Lampard | F237: 11000000 | H237: PTS | I237: POS
B238: Total | C238: =SUM(C229:C237) -> 7750000 | F238: =SUM(F229:F237) -> 33850000 | G238: =C238-F238 -> -26100000 | H238: 42 | I238: 17
B240: Season 99/00
B241: Jermain Defoe | C241: 1150000 | E241: Scott Mean | F241: Free
B242: Paulo Wanchope | C242: 3500000 | E242: Lee Hodges | F242: 130000
B243: Stuart Pearce | C243: Free | E243: Eyal Berkovic | F243: 5750000
B244: Igor Stimac | C244: 600000 | E244: Stan Lazaridis | F244: 1500000
B245: Gary Charles | C245: 1200000 | E245: Anthony Henry | F245: Free
B246: Daniel Sjolund | C246: 190000 | E246: Lee Boylan | F246: Free
B247: Omer Riza | C247: Nominal | E247: Ian Wright | F247: Free
B248: Ian Feuer | C248: Free | E248: Chris Coyne | F248: Free
B249: Frederic Kanoute | C249: 3700000 | E249: Marc-Vivien Foe | F249: 6000000
B250: Nigel Winterburn | C250: Signed | E250: Stephen Purches | F250: Free
B251: Davor Suker | C251: Free | E251: Ian Feuer | F251: Free | H251: Prem
E252: Manny Omoyinmi | F252: Free | H252: PTS | I252: POS
B253: Total | C253: =SUM(C241:C252) -> 10340000 | F253: =SUM(F241:F252) -> 13380000 | G253: =C253-F253 -> -3040000 | H253: 55 | I253: 9
B255: Season 98/99
B256: Ian Wright | C256: 500000 | E256: Lee Goodwin | F256: Free
B257: Neil Ruddock | C257: 100000 | E257: Andy Impey | F257: 1600000
B258: Javier Margas | C258: 1800000 | E258: Ludek Miklosko | F258: Nominal
B259: Gavin Holligan | C259: 100000 | E259: John Hartson | F259: 7500000
B260: Scott Minto | C260: 1000000 | E260: Tim Breacker | F260: Free
B261: Paolo Di Canio | C261: 1750000 | E261: David Partridge | F261: 40000
B262: Marc-Vivien Foe | C262: 4000000 | E262: Joe Keith | F262: Free | H262: Prem
B263: Jimmy Bullard | C263: 30000 | H263: PTS | I263: POS
B264: Total | C264: =SUM(C256:C263) -> 9280000 | F264: =SUM(F256:F263) -> 9140000 | G264: =C264-F264 -> 140000 | H264: 57 | I264: 5
B266: Season 97/98
B267: David Unsworth | C267: Swap | E267: Danny Williamson | F267: Swap
B268: Ian Pearce | C268: 2300000 | E268: Marc Rieper | F268: 1400000
B269: Andy Impey | C269: 1200000 | E269: Michael Hughes | F269: 1600000
B270: Samassi Abou | C270: 250000 | E270: Iain Dowie | F270: Swap
B271: Trevor Sinclair | C271: 2300000 | E271: Keith Rowland | F271: Swap
B272: Stephen Bywater | C272: 300000 | E272: Ian Bishop | F272: Free
B273: Marc Keller | C273: Free | E273: David Unsworth | F273: 3000000 | H273: Prem
B274: Shaka Hislop | C274: Free | H274: PTS | I274: POS
B275: Total | C275: =SUM(C267:C274) -> 6350000 | F275: =SUM(F267:F274) -> 6000000 | G275: =C275-F275 -> 350000 | H275: 56 | I275: 8
B277: Season 96/97
B278: Mark Bowen | C278: Free | E278: Scott Canham | F278: 25000
B279: Scott Mean | C279: 100000 | E279: Malcolm McPherson | F279: Free
B280: Les Sealey | C280: Free | E280: Robbie Slater | F280: 250000
B281: Paul Kitson | C281: 2300000 | E281: Tony Cottee | F281: 750000
B282: John Hartson | C282: 3300000 | E282: Adrian Whitbread | F282: 250000
B283: Steve Lomas | C283: 1600000 | E283: Peter Shilton | F283: Monthly
B284: Eyal Berkovic | C284: 1750000 | E284: Ilie Dumitrescu | F284: 800000
B285: David Terrier | C285: Free | E285: Florin Raducioiu | F285: 1600000
B286: Craig Forrest | C286: 500000 | E286: Kenny Brown | F286: 75000
E287: Steve Jones | F287: 400000
E288: Steve Mautone | F288: 250000
E289: Mark Bowen | F289: Free | H289: Prem
E290: Slaven Bilic | F290: 4500000 | H290: PTS | I290: POS
B291: Total | C291: =SUM(C278:C290) -> 9550000 | F291: =SUM(F278:F290) -> 8900000 | G291: =C291-F291 -> 650000 | H291: 42 | I291: 14
B293: Season 95/96
B294: Robbie Slater | C294: 600000 | E294: Matty Holmes | F294: 1200000
B295: Stan Lazaridis | C295: 300000 | E295: Matthew Rush | F295: 330000
B296: Peter Shilton | C296: Free | E296: Ian Feuer | F296: 580000
B297: Steve Mautone | E297: Don Hutchison | F297: 1200000
B298: Paulo Futre | C298: Free | E298: Darren Currie | F298: 70000
B299: Steve Jones | C299: 200000 | E299: Martin Allen | F299: 500000
B300: Michael Hughes | C300: Free | E300: Mark Watson | F300: 100000
B301: Florin Raducioiu | C301: 2400000 | E301: Les Sealey | F301: Free | H301: Prem
B302: Richard Hall | C302: 1400000 | H302: PTS | I302: POS
B303: Total | C303: =SUM(C294:C302) -> 4900000 | F303: =SUM(F294:F302) -> 3980000 | G303: =C303-F303 -> 920000 | H303: 51 | I303: 10
B305: Season 94/95
B306: Adrian Whitbread | C306: 500000 | E306: Joey Beauchamp | F306: 850000
B307: Don Hutchison | C307: 1500000 | E307: David Burrows | F307: Transfer
B308: Tony Cottee | C308: Transfer | E308: Peter Butler | F308: 350000
B309: Les Sealey | C309: Free | E309: Steve Jones | F309: 150000
B310: Mark Watson | C310: Signed | E310: Mike Marsh | F310: 450000
B311: Marc Rieper | C311: 1100000 | E311: Lee Chapman | F311: 70000 | H311: Prem
B312: Marco Boogers | C312: 1000000 | E312: Matt Holland | F312: Free | H312: PTS | I312: POS
B313: Total | C313: =SUM(C306:C312) -> 4100000 | F313: =SUM(F306:F312) -> 1870000 | G313: =C313-F313 -> 2230000 | H313: 50 | I313: 14
B315: Season 93/94
B316: Keith Rowland | C316: 110000 | E316: Dean Martin | F316: Free
B317: Lee Chapman | C317: 250000 | E317: Julian Dicks | F317: 1500000
B318: Mike Marsh | C318: Swap | E318: Mitchell Thomas | F318: Free
B319: David Burrows | C319: Transfer | E319: Mark Robson | F319: 125000
B320: Jeroen Boere | C320: 250000 | E320: Paul Marquis | F320: Free
B321: Paul Mitchell | C321: Signed | E321: Colin Foster | F321: 100000
B322: Ian Feuer | C322: 70000 | E322: Mike Basham | F322: Free
B323: Joey Beauchamp | C323: 1000000 | E323: Clive Allen | F323: 750000 | H323: Prem
B324: John Moncur | C324: 900000 | E324: Tony Gale | F324: Free | H324: PTS | I324: POS
B325: Total | C325: =SUM(C316:C324) -> 2580000 | F325: =SUM(F316:F324) -> 2475000 | G325: =C325-F325 -> 105000 | H325: 52 | I325: 13
B327: Season 92/93
B328: Peter Butler | C328: 125000 | E328: Stuart Slater | F328: 1500000
B329: Mark Robson | C329: Free | E329: Kevin Horlock | F329: Free
B330: Matty Holmes | C330: 40000 | E330: George Parris | F330: 150000
B331: Steve Jones | C331: 22000 | E331: Steve Banks | F331: Free
B332: Simon Webster | C332: 525000 | E332: Tony Richards | F332: Free
B333: Dale Gordon | C333: 750000 | E333: Kevin Keen | F333: 600000
B334: Total | C334: =SUM(C328:C333) -> 1462000 | F334: =SUM(F328:F333) -> 2250000 | G334: =C334-F334 -> -788000 | H334: PTS | I334: POS
H335: 88 | I335: 2