H1: checks
B2: Season 91/92 to date | C2: =C18 -> 1045980000 | F2: =F18 -> 313103000 | G2: =C2-F2 -> 732877000 | H2: =SUM(G19:G334) -> 732877000 | I2: =G2-H2 -> 0
B3: Season 03/04 to date | C3: =C201+C183+C172+C161+C148+C136+C122+C109+C95+C79+C65+C52+C37 -> 948020000 | F3: =F201+F183+F172+F161+F148+F136+F122+F109+F95+F79+F65+F52+F37 -> 281875000 | G3: =C3-F3 -> 666145000 | H3: =SUM(G19:G201) -> 666145000 | I3: =G3-H3 -> 0
B4: Championship 04/05 | C4: =C183+C172+C161+C148+C136+C122+C109+C95+C79+C65+C52+C37 -> 938220000 | F4: =F183+F172+F161+F148+F136+F122+F109+F95+F79+F65+F52+F37 -> 278950000 | G4: =C4-F4 -> 659270000 | H4: =SUM(G19:G183) -> 659270000 | I4: =G4-H4 -> 0
B5: last five seasons | C5: =C95+C79+C65+C52+C37 -> 472800000 | F5: =F95+F79+F65+F52+F37 -> 159300000 | G5: =C5-F5 -> 313500000 | H5: =SUM(G19:G95) -> 313500000 | I5: =G5-H5 -> 0
B7: Before Sinawatra Buyout | C7: =SUM(C161+C172+C183+C201+C213+C230+C245+C257+C269+C285+C296+C309+C317+C327+C333) -> 119910000 | F7: =SUM(F161+F172+F183+F201+F213+F230+F245+F257+F269+F285+F296+F309+F317+F327+F333) -> 67553000 | G7: =C7-F7 -> 52357000 | H7: =SUM(G161:G333) -> 52357000 | I7: =G7-H7 -> 0
B8: After Thaksin Buyout | C8: =SUM(C148+C136) -> 173520000 | F8: =SUM(F148+F136) -> 21500000 | G8: =C8-F8 -> 152020000 | H8: =SUM(G136:G148) -> 152020000 | I8: =G8-H8 -> 0
B9: After Abu dhabi Buyout | C9: =C122+C109+C95+C79+C65+C52+C37 -> 752550000 | F9: =F122+F109+F95+F79+F65+F52+F37 -> 224050000 | G9: =C9-F9 -> 528500000 | H9: =SUM(G19:G122) -> 528500000 | I9: =G9-H9 -> 0
B11: Stuart pearce 2 | C11: =SUM(C172+C161) -> 12150000 | F11: =SUM(F172+F161) -> 25800000 | G11: =C11-F11 -> -13650000 | H11: =SUM(G161:G172) -> -13650000 | I11: =G11-H11 -> 0
B12: Sven Goran Eriksson 1 | C12: =SUM(C148) -> 45820000 | F12: =SUM(F148) -> 6700000 | G12: =C12-F12 -> 39120000 | H12: =G148 -> 39120000 | I12: =G12-H12 -> 0
B13: Mark Hughes 1.5 | C13: =SUM(C122+C109-C121) -> 272750000 | F13: =SUM(F122+F109) -> 64750000 | G13: =C13-F13 -> 208000000 | H13: =G122+G109-C121 -> 208000000 | I13: =G13-H13 -> 0
B14: Roberto Mancini 1.5 | C14: =C121+C109+C95+C79 -> 291750000 | F14: =F79+F95+F109 -> 106500000 | G14: =C14-F14 -> 185250000 | H14: =C121+G109+G95+G79 -> 185250000 | I14: =G14-H14 -> 0
B15: Manuel Pellegrini | C15: =C65+C52+C37 -> 342800000 | F15: =F65+F52+F37 -> 91550000 | G15: =C15-F15 -> 251250000 | H15: =SUM(G19:G65) -> 251250000 | I15: =G15-H15 -> 0
B17: Manchester City
B18: Combined Totals | C18: =C333+C327+C317+C309+C296+C285+C269+C257+C245+C230+C213+C201+C183+C172+C161+C148+C136+C122+C109+C95+C79+C65+C52+C37 -> 1045980000 | F18: =F333+F327+F317+F309+F296+F285+F269+F257+F245+F230+F213+F201+F183+F172+F161+F148+F136+F122+F109+F95+F79+F65+F52+F37 -> 313103000 | G18: =SUM(G19:G334) -> 732877000 | H18: =SUM(H66:H334) -> 1151
B19: Players Purchased | C19: Fee | E19: Player Sold | F19: Fee | G19: Net Total | H19: Points | I19: Position
B20: Season 15/16
B21: Enes Ünal | C21: 2000000 | E21: Dedryck Boyata | F21: 1500000
B22: Raheem Sterling | C22: 44000000 | E22: Micah Richards | F22: Free
B23: Patrick Roberts | C23: 11000000 | E23: Scott Sinclair | F23: 2500000
B24: Fabian Delph | C24: 8000000 | E24: James Milner | F24: Free
B25: Nicolás Otamendi | C25: 32000000 | E25: Matija Nastasic | F25: 10000000
B26: Kevin De Bruyne | C26: 55000000 | E26: John Guidetti | F26: Released
B27: Anthony Cáceres | C27: 100000 | E27: Jordy Hiwula | F27: 150000
E28: Karim Rekik | F28: 3500000
E29: Álvaro Negredo | F29: 24000000
E30: Luke Brattan | F30: Free
E31: George Evans | F31: Free
E32: Rony Lopes | F32: 9000000
H36: PTS | I36: POS
C37: =SUM(C21:C30) -> 152100000 | F37: =SUM(F21:F36) -> 50650000 | G37: =C37-F37 -> 101450000
B38: Season 14/15
B39: Bacary Sagna | C39: Free | E39: Costel Pantilimon | F39: Free
B40: Fernando | C40: 12000000 | E40: Joleon Lescott | F40: Free
B41: Willy Caballero | C41: 6000000 | E41: Alex Henshall | F41: Free
B42: Bruno Zuculini | C42: 1500000 | E42: Gareth Barry | F42: 2000000
B43: Eliaquim Mangala | C43: 40000000 | E43: Alex nimely | F43: Released
B44: Wilfried Bony | C44: 28000000 | E44: Jack Rodwell | F44: 10000000
E45: Javia Garcia | F45: 13000000
E46: Emyr Huws | F46: 2500000
E47: Reece Wabara | F47: Released
E48: Thomas Agyiri | F48: Released
E49: Kieran Kennedy | F49: Released
E50: George Swan | F50: Released
H51: PTS | I51: POS
C52: =SUM(C39:C51) -> 87500000 | F52: =SUM(F39:F51) -> 27500000 | G52: =C52-F52 -> 60000000 | H52: 79 | I52: 2
B53: Season 13/14
B54: Jesus Navas | C54: 22900000 | E54: Ryan McGivern | F54: Free
B55: Fernandinho | C55: 30000000 | E55: Carlos Tevez | F55: 12000000
B56: Álvaro Negredo | C56: 20600000 | E56: Kolo Toure | F56: Free
B57: Stevan Jovetic | C57: 25800000 | E57: Wayne Bridge | F57: Free
B58: Zacharias Faour | C58: 400000 | E58: Omar Elabdellaoui | F58: Free
B59: Martín Demichelis | C59: 3500000 | E59: Roque Santa Cruz | F59: Released
E60: Jeremy Helan | F60: 400000
E61: Maicon | F61: Free
E62: Denis Suárez | F62: 1000000
E63: Abdul Razak | F63: Undisclosed | H63: Prem
E64: Harry Bunn | F64: Free | H64: PTS | I64: POS
B65: Total | C65: =SUM(C54:C64) -> 103200000 | F65: =SUM(F54:F64) -> 13400000 | G65: =C65-F65 -> 89800000 | H65: 86 | I65: 1
B66: Season 12/13
B67: Jack Rodwell | C67: 15000000 | E67: Greg Cunningham | F67: Undisclosed
B68: Scott Sinclair | C68: 8000000 | E68: Ahmed Benali | F68: Free
B69: Matija Nastasic | C69: 12000000 | E69: Vladimir Weiss | F69: 1500000
B70: Maicon | C70: 3000000 | E70: Emmanuel Adebayor | F70: 5000000
B71: Richard Wright | C71: Free | E71: Adam Johnson | F71: 10000000
B72: Jave Garcia | C72: 16000000 | E72: Stefan Savic | F72: 3000000
B73: Godsway Donyoh | C73: Free | E73: Nigel De Jong | F73: 3500000
E74: Owen Hargreaves | F74: Released
E75: Gai Assulin | F75: Free
E76: Andreas Mancini | F76: Free
E77: Joan Angel Roman | F77: Free | H77: Prem
E78: Mario Balotelli | F78: 17000000 | H78: Pts | I78: Pos
B79: Totals | C79: =SUM(C67:C74) -> 54000000 | F79: =SUM(F67:F78) -> 40000000 | G79: =C79-F79 -> 14000000 | H79: 78 | I79: 2
B80: Season 11/12 | E80: James Poole | F80: Free
B81: Stefan Savic | C81: 6000000 | E81: Andrew Tutte | F81: Free
B82: Gaël Clichy | C82: 7000000 | E82: Donald McDermott | F82: Free
B83: Sergio Agüero | C83: 38000000 | E83: Scott Kay | F83: Free
B84: Costel Pantilimon | C84: 3000000 | E84: Shaleum Logan | F84: Free
B85: Samir Nasri | C85: 22000000 | E85: Jerome Boateng | F85: 15000000
B86: Owen Hargreaves | C86: Free | E86: Shay Given | F86: 3500000
B87: Luca Scapuzzi | C87: Free | E87: Jô | F87: Undisclosed
E88: Craig Bellamy | F88: Free
E89: Shaun Wright-Phillips | F89: 6500000
E90: Chris Chantler | F90: Undisclosed
E91: Kieran Trippier | F91: Undisclosed
E92: Nedum Onuoha | F92: 2750000
E93: Ben Mee | F93: Undisclosed | H93: Prem
E94: Jason Gilchrist | F94: Free | H94: Pts | I94: Pos
B95: Total | C95: =SUM(C81:C90) -> 76000000 | F95: =SUM(F80:F94) -> 27750000 | G95: =C95-F95 -> 48250000 | H95: 89 | I95: 1
B96: Season 10/11
B97: Jerome Boateng | C97: 11000000 | E97: Andrew Mitchell | F97: Free
B98: Alex Henshall | C98: 250000 | E98: Benjani Mwaruwari | F98: Released
B99: Yaya Toure | C99: 24000000 | E99: Martin Petrov | F99: Free
B100: David Silva | C100: 25000000 | E100: Sylvinho | F100: Released
B101: Aleksandar Kolarov | C101: 17000000 | E101: Filip Mentel | F101: Free
B102: Mario Balotelli | C102: 24500000 | E102: Valeri Bonjinov | F102: 5000000
B103: James Milner | C103: 26000000 | E103: Javio Garrido | F103: 2750000
B104: Edin Dzeko | C104: 27000000 | E104: Stephen Ireland | F104: 8000000
E105: Adam Clayton | F105: Undisclosed
E106: Robinho | F106: 22000000 | H106: Prem
E107: David Ball | F107: Undisclosed | H107: Pts | I107: Pos
E108: Felip Caciedo | F108: 1000000
C109: =SUM(C97:C105) -> 154750000 | F109: =SUM(F97:F108) -> 38750000 | G109: =C109-F109 -> 116000000 | H109: 71 | I109: 3
B110: Season 09/10
B111: Gareth Barry | C111: 12000000 | E111: Daniel Sturridge | F111: 4000000
B112: Roque Santa Cruz | C112: 17500000 | E112: Ched Evans | F112: 3000000
B113: Gunnar Nielsen | C113: Free | E113: Blumer Elano | F113: 8000000
B114: Stuart Taylor | C114: Tribunal | E114: Fernandes Gelson | F114: 6000000
B115: Carlos Tevez | C115: 25500000 | E115: Adrian Cieslewicz | F115: Free
B116: Emmanuel Adebayor | C116: 25000000 | E116: Kasper Schmeichel | F116: Signed
B117: Kolo Toure | C117: 16000000 | E117: Ben-Haim | F117: Undisclosed
B118: Sylvinho | C118: Free | E118: Richard Dunne | F118: 5000000
B119: Joleon Lescott | C119: 22000000 | E119: Angelos Tsiaklis | F119: Free
B120: Patrick Viera | C120: Free | E120: Eddy Gnahore | F120: Undisclosed | H120: Prem
B121: Adam Johnson | C121: 7000000 | H121: Pts | I121: Pos
B122: Total | C122: =SUM(C111:C121) -> 125000000 | F122: =SUM(F111:F120) -> 26000000 | G122: =C122-F122 -> 99000000 | H122: 67 | I122: 5
B123: Season 08/09
B124: Jo | C124: 18000000 | E124: Andreas Isaksson | F124: Signed
B125: Tal Ben-Haim | C125: 5000000 | E125: Sun Jihai | F125: Free
B126: Vincent Kompany | C126: 6700000 | E126: Geovanni | F126: Free
B127: Shaun Wright Phillips | C127: 9000000 | E127: Georgios Samaras | F127: 1000000
B128: Leandro Glauber | C128: Undicslosed | E128: Matthew Mills | F128: 300000
B129: Pablo Zabaleta | C129: 6500000 | E129: Ashley Grimes | F129: Free
B130: Robinho | C130: 32500000 | E130: Paul Dikov | F130: Free
B131: Wayn Bridge | C131: 12000000 | E131: Rolando Bianchi | F131: 5000000
B132: Craig Bellamy | C132: 14000000 | E132: Vedran Corluka | F132: 8500000
B133: Nigel De Jong | C133: 16000000 | E133: Bernado Corradi | F133: Free
B134: Shay Given | C134: 8000000 | E134: Emile Mpenza | F134: Free | H134: Prem
E135: Sam Williamson | F135: Free | H135: Pts | I135: Pos
B136: Total | C136: =SUM(C124:C134) -> 127700000 | F136: =SUM(F124:F135) -> 14800000 | G136: =C136-F136 -> 112900000 | H136: 50 | I136: 10
B138: Season 07/08
B139: Benjani | C139: 3870000 | E139: Ishmael Miller | F139: 900000
B140: Felipe Caicedo | C140: 5200000 | E140: Ousmane Dabo | F140: Signed
B141: Valeri Bojinov | C141: 5750000 | E141: Marc Laird | F141: Free
B142: Elano | C142: 8000000 | E142: Nathan D'Laryea | F142: Signed
B143: Vedran Corluka | C143: 8000000 | E143: Stephen Jordan | F143: Free
B144: Javier Garrido | C144: 1500000 | E144: Trevor Sinclair | F144: Free
B145: Martin Petrov | C145: 4700000 | E145: Joey Barton | F145: 5800000
B146: Geovanni | C146: Free | H146: Prem
B147: Rolando Bianchi | C147: 8800000 | H147: Pts | I147: Pos
B148: Total | C148: =SUM(C139:C147) -> 45820000 | F148: =SUM(F139:F147) -> 6700000 | G148: =C148-F148 -> 39120000 | H148: 55 | I148: 9
B150: Season 06/07
B151: Michael Ball | C151: Nominal | E151: Nicky Weaver | F151: Free
B152: Andreas Isaksson | C152: 2000000
B153: Hatem Trabelsi | C153: Free | E153: Sylvain Distin | F153: Free
B154: Bernardo Corradi | C154: Signed | E154: Ben Thatcher | F154: 500000
B155: Dietmar Hamann | C155: 400000 | E155: Antoine Sibierski | F155: 2000000
E156: Andy Cole | F156: 500000
E157: David James | F157: 1200000
E158: Willo Flood | F158: Signed
E159: Lee Croft | F159: 600000 | H159: Prem
E160: Bradley Wright-Phillips | F160: Nominal | H160: Pts | I160: Pos
B161: Total | C161: =SUM(C151:C160) -> 2400000 | F161: =SUM(F151:F160) -> 4800000 | G161: =C161-F161 -> -2400000 | H161: 42 | I161: 14
B163: Season 05/06
B164: Ousmane Dabo | C164: Free | E164: Mikkel Bischoff | F164: Free
B165: Paul Dickov | C165: Free | E165: David Sommeil | F165: Free
B166: Joe Hart | C166: 1500000 | E166: Jonathan D'Laryea | F166: Nominal
B167: Matthew Mills | C167: 250000 | E167: Robbie Fowler | F167: Free
B168: Georgios Samaras | C168: 6000000 | E168: Danny Warrender | F168: Free
B169: Darius Vassell | C169: 2000000 | E169: Carlos Logan | F169: Free
B170: Andy Cole | C170: Free | E170: Shaun Wright-Phillips | F170: 21000000 | H170: Prem
E171: Christian Negouai | F171: Signed | H171: Pts | I171: Pos
B172: Total | C172: =SUM(C164:C171) -> 9750000 | F172: =SUM(F164:F171) -> 21000000 | G172: =C172-F172 -> -11250000 | H172: 43 | I172: 15
B174: Season 04/05
B175: Ronald Waterreus | C175: Free | E175: Jon Macken | F175: Signed
B176: Danny Mills | C176: Free | E176: Patrick McCarthy | F176: 100000
E177: Ronald Waterreus | F177: Signed
E178: Nicolas Anelka | F178: 7000000
E179: Paulo Wanchope | F179: 500000
E180: Kieran Westwood | F180: Free
E181: Craig Davies | F181: Free | H181: Prem
E182: Michael Tarnat | F182: Free | H182: Pts | I182: Pos
B183: Total | C183: =SUM(C175:C182) -> 0 | F183: =SUM(F175:F182) -> 7600000 | G183: =C183-F183 -> -7600000 | H183: 52 | I183: 8
B185: Season 03/04
B186: Geert De Vlieger | C186: Free | E186: Vicente Matias Vuoso | F186: Free
B187: Ben Thatcher | C187: 100000 | E187: Glenn Whelan | F187: Free
B188: David James | C188: 2000000 | E188: Danny Tiatto | F188: Free
B189: Steve McManaman | C189: Free | E189: Stephen Elliott | F189: 125000
B190: Claudio Reyna | C190: 2500000 | E190: Chris Shuker | F190: Nominal
B191: Antoine Sibierski | C191: 700000 | E191: Eyal Berkovic | F191: Free
B192: Paul Bosvelt | C192: 2000000 | E192: Darren Huckerby | F192: 750000
B193: Trevor Sinclair | C193: 2500000 | E193: Lucien Mettomo | F193: 500000
E194: Paul Ritchie | F194: Free
E195: Kevin Horlock | F195: 300000
E196: Carlo Nash | F196: Nominal
E197: Jeff Whitley | F197: Free
E198: Shaun Goater | F198: 500000
E199: Brian Murphy | F199: Free | H199: Prem
E200: Niclas Jensen | F200: 750000 | H200: Pts | I200: Pos
B201: Total | C201: =SUM(C186:C200) -> 9800000 | F201: =SUM(F186:F200) -> 2925000 | G201: =C201-F201 -> 6875000 | H201: 41 | I201: 16
B203: Season 02/03
B204: Michael Tarnat | C204: Free | E204: Steve Howey | F204: Signed
B205: David Seaman | C205: Free | E205: Tyrone Loran | F205: Signed
B206: Robbie Fowler | C206: 6000000 | E206: Rhys Day | F206: Free
B207: David Sommeil | C207: 3500000 | E207: Laurent Charvet | F207: Free
B208: Karim Kerkar | C208: Free | E208: Richard Edghill | F208: Free
B209: Peter Schmeichel | C209: Free | E209: Terry Dunfield | F209: Free
B210: Mikkel Bischoff | C210: 750000 | E210: Chris Killen | F210: 200000
E211: Terry Cooke | F211: Free | H211: Prem
E212: Tyrone Mears | F212: 200000 | H212: Pts | I212: Pos
B213: Total | C213: =SUM(C204:C212) -> 10250000 | F213: =SUM(F204:F212) -> 400000 | G213: =C213-F213 -> 9850000 | H213: 51 | I213: 9
B215: Season 01/02
B216: Nicolas Anelka | C216: 13000000 | E216: Alioune Toure | F216: Signed
B217: Vicente Matias Vuoso | C217: 3500000 | E217: Paul Dickov | F217: Nominal
B218: Sylvain Distin | C218: 4000000 | E218: Leon Mike | F218: 50000
B219: Sun Jihai | C219: 2000000 | E219: Dickson Etuhu | F219: 300000
B220: Jon Macken | C220: 5000000 | E220: Danny Granville | F220: 500000
B221: Niclas Jensen | C221: 700000 | E221: Nicky Summerbee | F221: Free
B222: Christian Negouai | C222: 1500000 | E222: Tony Grant | F222: 250000
B223: Lucien Mettomo | C223: 1500000 | E223: Stephen Hodgson | F223: Free
B224: Alioune Toure | C224: Free | E224: Jim Whitley | F224: Free
B225: Ali Benarbia | C225: Free | E225: Mark Kennedy | F225: 2000000
B226: Nicky Summerbee | C226: Free | E226: Shaun Holmes | F226: Free
B227: Eyal Berkovic | C227: 1500000 | E227: Richard McKinney | F227: Free
B228: Simon Colosimo | C228: Nominal | E228: Spencer Prior | F228: 700000 | H228: Champ
B229: Stuart Pearce | C229: Free | E229: Gareth Taylor | F229: Free | H229: Pts | I229: Pos
B230: Total | C230: =SUM(C216:C229) -> 32700000 | F230: =SUM(F216:F229) -> 3800000 | G230: =C230-F230 -> 28900000 | H230: 99 | I230: 1
B232: Season 00/01
B233: Carlo Nash | C233: 100000 | E233: Tommy Wright | F233: Free
B234: Darren Huckerby | C234: 3000000 | E234: Ian Bishop | F234: Free
B235: Laurent Charvet | C235: 1000000 | E235: Lee Crooks | F235: 190000
B236: Richard Dunne | C236: 3000000 | E236: Richard Jobson | F236: Free
B237: Paul Ritchie | C237: 500000 | E237: Danny Allsopp | F237: 300000
B238: Steve Howey | C238: 2000000 | E238: Gary Mason | F238: Free
B239: Paulo Wanchope | C239: 3650000 | E239: Nick Fenton | F239: 150000
B240: George Weah | C240: Free | E240: George Weah | F240: Free
E241: Rob Taylor | F241: 1550000
E242: Jamie Pollock | F242: 750000
E243: Lee Peacock | F243: 600000 | H243: Prem
E244: Craig Russell | F244: Free | H244: Pts | I244: Pos
B245: Total | C245: =SUM(C233:C244) -> 13250000 | F245: =SUM(F233:F244) -> 3540000 | G245: =C245-F245 -> 9710000 | H245: 34 | I245: 18
B247: Season 99/00
B248: Alf-Inge Haaland | C248: 2500000 | E248: Tony Vaughan | F248: 350000
B249: Spencer Prior | C249: 500000 | E249: Chris Greenacre | F249: Free
B250: Tony Grant | C250: 450000 | E250: Michael Brown | F250: 400000
B251: Rob Taylor | C251: 1500000 | E251: Alan Reilly | F251: Free
B252: Danny Granville | C252: 1000000 | E252: Mikhail Kavelashvili | F252: Free
B253: Lee Peacock | C253: 500000 | E253: Andy Porteous | F253: Free
B254: Mark Kennedy | C254: 1000000 | E254: Neil Heaney | F254: Free
E255: Alan Bailey | F255: Free
E256: Steve Rimmer | F256: Free | H256: Pts | I256: Pos
B257: Total | C257: =SUM(C248:C256) -> 7450000 | F257: =SUM(F248:F256) -> 750000 | G257: =C257-F257 -> 6700000 | H257: 81 | I257: 2
B259: Season 98/99
B260: Terry Cooke | C260: 1000000 | E260: Anthony Fenton | F260: Free
B261: Gareth Taylor | C261: 400000 | E261: Lee Bradbury | F261: 1500000
B262: Andy Morrison | C262: 80000 | E262: Ged Brannan | F262: 378000
E263: Nigel Clough | F263: Signed
E264: Barry Conlon | F264: Free
E265: David Morley | F265: Unknown
E266: Paul Beesley | F266: Free
E267: Martin Phillips | F267: 100000
E268: Scott Hiley | F268: Free | H268: Pts | I268: Pos
B269: Total | C269: =SUM(C260:C268) -> 1480000 | F269: =SUM(F260:F268) -> 1978000 | G269: =C269-F269 -> -498000 | H269: - | I269: -
B271: Season 97/98
B272: Ian Bishop | C272: Free | E272: Brian McGlinchey | F272: Free
B273: Shaun Goater | C273: 400000 | E273: Georgi Kinkladze | F273: 5000000
B274: Jamie Pollock | C274: 1000000 | E274: John Foster | F274: Signed
B275: Richard Jobson | C275: Free | E275: Jason Van Blerk | F275: 250000
B276: Andy Porteous | C276: Signed | E276: Alan Kernaghan | F276: Signed
B277: Kris Winters | C277: Non-contract | E277: Nicky Summerbee | F277: 1000000
B278: Craig Russell | C278: 1000000 | E278: Jim Bentley | F278: Signed
B279: Murtaz Shelia | C279: 400000 | E279: Chris Beech | F279: Free
B280: Barry Conlon | C280: Free
B281: Tony Scully | C281: 200000
B282: Lee Bradbury | C282: 3000000
B283: Tony Vaughan | C283: 1350000
B284: Kakhaber Tskhadadze | C284: 150000 | H284: Pts | I284: Pos
B285: Total | C285: =SUM(C272:C284) -> 7500000 | F285: =SUM(F272:F282) -> 6250000 | G285: =C285-F285 -> 1250000 | H285: 48 | I285: 22
B287: Season 96/97
B288: Nicky Weaver | C288: 200000 | E288: Peter Beagrie | F288: 200000
B289: Ged Brannan | C289: 750000 | E289: Steve Lomas | F289: 1600000
B290: Tommy Wright | C290: 450000 | E290: Andy Dibble | F290: Unknown
B291: Paul Beesley | C291: 500000 | E291: Michael Frontzeck | F291: 250000
B292: Kevin Horlock | C292: 1250000 | E292: Niall Quinn | F292: 1300000
B293: Neil Heaney | C293: 500000 | E293: John Sharpe | F293: Free
B294: Eddie McGoldrick | C294: 300000 | E294: Keith Curle | F294: 650000
B295: Paul Dickov | C295: 1000000 | E295: Stephen Rishworth | F295: Trainee | H295: Pts | I295: Pos
B296: Total | C296: =SUM(C288:C295) -> 4950000 | F296: =SUM(F288:F295) -> 4000000 | G296: =C296-F296 -> 950000 | H296: 61 | I296: 14
B298: Season 95/96
B299: Scott Hiley | C299: 250000 | E299: David Kerr | F299: 20000
B300: Mikhail Kavelashvili | C300: 1400000 | E300: Tony Coton | F300: 500000
B301: Nigel Clough | C301: 1500000 | E301: David Brightwell | F301: 30000
B302: Martin Phillips | C302: 500000 | E302: Paul Walsh | F302: 500000
B303: Gerry Creaney | C303: 1500000 | E303: Andy Hill | F303: 150000
B304: Georgi Kinkladze | C304: 2000000 | E304: Adie Mike | F304: 60000
B305: Kit Symons | C305: 1200000 | E305: Fitzroy Simpson | F305: 200000
B306: Eike Immel | C306: 400000 | E306: Carl Griffiths | F306: 200000
E307: John Burridge | F307: Free | H307: Prem
E308: Gary Flitcroft | F308: 3500000 | H308: Pts | I308: Pos
B309: Total | C309: =SUM(C299:C307) -> 8750000 | F309: =SUM(F299:F308) -> 5160000 | G309: =C309-F309 -> 3590000 | H309: 38 | I309: 18
B311: Season 94/95
B312: John Burridge | C312: Free | E312: Mike Quigley | F312: Free
B313: Ray Kelly | C313: 30000 | E313: Steve Finney | F313: Free
E314: Steve McMahon | F314: Free
E315: Mike Sheron | F315: 1000000 | H315: Prem
E316: David Rocastle | F316: 1250000 | H316: Pts | I316: Pos
B317: Total | C317: =SUM(C312:C316) -> 30000 | F317: =SUM(F312:F316) -> 2250000 | G317: =C317-F317 -> -2220000 | H317: 49 | I317: 17
B319: Season 93/94
B320: Nicky Summerbee | C320: 1500000 | E320: David White | F320: 2000000
B321: Peter Beagrie | C321: 1100000 | E321: Rick Holden | F321: 450000
B322: Paul Walsh | C322: 750000 | E322: Peter Reid | F322: Free
B323: Uwe Rosler | C323: 750000
B324: David Rocastle | C324: 2000000
B325: Carl Griffiths | C325: 500000 | H325: Prem
B326: Alan Kernaghan | C326: 1600000 | H326: Pts | I326: Pos
B327: Total | C327: =SUM(C320:C326) -> 8200000 | F327: =SUM(F320:F326) -> 2450000 | G327: =C327-F327 -> 5750000 | H327: 45 | I327: 16
B329: Season 92/93
B330: Steve Finney | C330: Free | E330: Mark Brennan | F330: 200000
B331: Terry Phelan | C331: 2500000 | E331: Mark Peters | F331: Free | H331: Prem
B332: Rick Holden | C332: 900000 | E332: Michael Hughes | F332: 450000 | H332: Pts | I332: Pos
B333: Total | C333: =SUM(C330:C332) -> 3400000 | F333: =SUM(F330:F332) -> 650000 | G333: =C333-F333 -> 2750000 | H333: 57 | I333: 9