B2: Season 91/92 to date | C2: =C15 -> 658700000 | F2: =F15 -> 516567500 | G2: =C2-F2 -> 142132500 | H2: =SUM(G16:G335) -> 142132500 | I2: =G2-H2 -> 0
B3: Season 03/04 to date | C3: =C212+C196+C180+C162+C148+C136+C121+C110+C103+C91+C75+C57+C37 -> 555050000 | F3: =F212+F196+F180+F162+F148+F136+F121+F110+F103+F91+F75+F57+F37 -> 478100000 | G3: =C3-F3 -> 76950000 | H3: =SUM(G16:G212) -> 76950000 | I3: =G3-H3 -> 0
B4: last five seasons | C4: =C103+C91+C75+C57+C37 -> 254650000 | F4: =F103+F91+F75+F57+F37 -> 308350000 | G4: =C4-F4 -> -53700000 | H4: =SUM(G16:G103) -> -53700000 | I4: =G4-H4 -> 0
B5: Championship | C5: =C196+C180+C162+C148+C136+C121+C110+C103+C91+C75+C57+C37 -> 540850000 | F5: =F196+F180+F162+F148+F136+F121+F110+F103+F91+F75+F57+F37 -> 478100000 | G5: =C5-F5 -> 62750000 | H5: =SUM(G16:G196) -> 62750000 | I5: =G5-H5 -> 0
B7: Martin Jol 3 | C7: =SUM(C196+C180+C162) -> 99800000 | F7: =SUM(F196+F180+F162) -> 53250000 | G7: =C7-F7 -> 46550000 | H7: =SUM(G162:G196) -> 46550000 | I7: =G7-H7 -> 0
B8: Juande Ramos | C8: =SUM(C148+C136) -> 135900000 | F8: =SUM(F148+F136) -> 82500000 | G8: =C8-F8 -> 53400000 | H8: =SUM(G136:G148) -> 53400000 | I8: =G8-H8 -> 0
B9: Harry Redknapp 3 | C9: =C136+C121+C110+C103+C91 -> 207200000 | F9: =F136+F121+F110+F103+F91 -> 199550000 | G9: =C9-F9 -> 7650000 | H9: =SUM(G76:G136) -> 7650000 | I9: =G9-H9 -> 0
B10: Andre Villa Boas | C10: =C91+C75 -> 165200000 | F10: =F91+F75 -> 182800000 | G10: =C10-F10 -> -17600000 | H10: =SUM(G58:G91) -> -17600000 | I10: =G10-H10 -> 0
B11: Tim Sherwood | C11: 0 | F11: =SUM(F72:F74) -> 6750000 | G11: =C11-F11 -> -6750000 | H11: =C11-F72-F73-F74 -> -6750000 | I11: =G11-H11 -> 0
B12: Mauricio Pochettino | C12: =C57+C37 -> 81450000 | F12: =F57+F37 -> 90550000 | G12: =C12-F12 -> -9100000 | H12: =SUM(G17:G57) -> -9100000 | I12: =G12-H12 -> 0
B14: Tottenham Hotspur
B15: Combined Totals | C15: =C335+C330+C311+C300+C291+C282+C269+C261+C247+C234+C224+C212+C196+C180+C162+C148+C136+C121+C110+C103+C91+C75+C57+C37 -> 658700000 | F15: =F335+F330+F311+F300+F291+F282+F269+F261+F247+F234+F224+F212+F196+F180+F162+F148+F136+F121+F110+F103+F91+F75+F57+F37 -> 516567500 | G15: =SUM(G16:G336) -> 142132500 | H15: =SUM(H16:H336) -> 1219
B16: Players Purchased | C16: Fee | E16: Players Sold | F16: Fee | G16: Net Total | H16: Points | I16: Position
B17: Season 15/16
B18: Kieran Trippier | C18: 3500000 | E18: Paulinho | F18: 9000000
B19: Kevin Wimmer | C19: 4300000 | E19: Lewis Holtby | F19: 4600000
B20: Toby Alderweireld | C20: 11500000 | E20: Brad Friedel | F20: Released
B21: Clinton N'Jie | C21: 12200000 | E21: Jordan Archer | F21: Released
B22: Son Heung-min | C22: 22000000 | E22: Cristian Ceballos | F22: Released
B23: Shilow Tracey | C23: Undisclosed | E23: Bongani Khumalo | F23: Released
E24: Alexander McQueen | F24: Released
E25: Étienne Capoue | F25: 7000000
E26: Younès Kaboul | F26: 3000000
E27: Benjamin Stambouli | F27: 6000000
E28: Ryan Fredericks | F28: 250000
E29: Grant Hall | F29: Undisclosed
E30: Vlad Chriches | F30: 4500000
E31: Roberto Soldado | F31: 10000000
E32: Aaron Lennon | F32: 4500000
E33: Kenny McEvoy | F33: Free
E34: Shaquile Coulthirst | F34: Undisclosed
E35: Andros Townsend | F35: 12000000 | H35: PTS | I35: POS
E36: Milos Veljkovic | F36: 500000
C37: =SUM(C18:C27) -> 53500000 | F37: =SUM(F18:F36) -> 61350000 | G37: =C37-F37 -> -7850000
B38: Season 14/15
B39: Ben Davies | C39: Swap | E39: Heurelho Gomes | F39: Free
B40: Michel Vorm | C40: 3500000 | E40: Jake Livermore | F40: 8000000
B41: Eric Dier | C41: 4000000 | E41: Cameron Lancaster | F41: Released
B42: DeAndre Yedlin | C42: 2750000 | E42: Gylfi Sigurðsson | F42: Swap
B43: Federico Fazio | C43: 8000000 | E43: Iago Falque | F43: 5000000
B44: Benjamin Stambouli | C44: 4700000 | E44: Michael Dawson | F44: 3500000
B45: Dele Alli | C45: 5000000 | E45: Cameron Lancaster | F45: Free
E46: Zeki Fryers | F46: 1500000
E47: Jonathan Obika | F47: 200000
E48: Sandro | F48: 6000000
E49: Lawrence Vigouroux | F49: Signed
E50: Kevin Stewart | F50: Signed
E51: Darren McQueen | F51: Signed
E52: Giancarlo Gallifuoco | F52: Released
E53: Roman Michael-Percil | F53: Released
E54: Jonathan Miles | F54: Released
E55: Kyle Naughton | F55: 5000000
E56: Benoit Assou Ekotto | F56: Released | H56: PTS | I56: POS
C57: =SUM(C39:C50) -> 27950000 | F57: =SUM(F39:F56) -> 29200000 | G57: =C57-F57 -> -1250000 | H57: 64 | I57: 5
B58: Season 13/14
B59: Paulinho | C59: 17000000 | E59: Nathan Byrne | F59: Free
B60: Nacer Chadli | C60: 7000000 | E60: Jack Barthram | F60: Released
B61: Roberto Soldado | C61: 25800000 | E61: David Bentley, | F61: Released
B62: Etienne Capoue | C62: 8600000 | E62: Jack Munns, | F62: Released
B63: Christian Eriksen | C63: 11000000 | E63: Jake Nicholson. | F63: Released
B64: Erik Lamela | C64: 25800000 | E64: John Bostock, | F64: Released
B65: Vlad Chiriches | C65: 8500000 | E65: William Gallas, | F65: Released
E66: Steven Caulker | F66: 8000000
E67: Tom Huddlestone | F67: 5250000
E68: Clint Dempsey | F68: 5800000
E69: Scott Parker | F69: 2000000
E70: Gareth Bale | F70: 91800000
E71: Massimo Luongo | F71: 400000
E72: Simon Dawkins | F72: 500000
E73: Adam Smith | F73: 250000 | H73: Prem
E74: Germain Defoe | F74: 6000000 | H74: PTS | I74: POS
B75: Total | C75: =SUM(C59:C69) -> 103700000 | F75: =SUM(F59:F74) -> 120000000 | G75: =C75-F75 -> -16300000 | H75: 69 | I75: 6
B76: Season 12/13
B77: Gylfi Sigurdsson | C77: 8000000 | E77: Niko Kranjcar | F77: 7000000
B78: Jan Vertonghen | C78: 10000000 | E78: Vedran Corluka | F78: 5500000
B79: Emmanuel Adebayor | C79: 5000000 | E79: Ryan Nelsen | F79: Free
B80: Moussa Dembele | C80: 15000000 | E80: Lee Angol | F80: Free
B81: Hugo Lloris | C81: 12000000 | E81: Ben Alnwick | F81: Free
B82: Clint Dempsey | C82: 7000000 | E82: Steven Pienaar | F82: 4500000
B83: Ezekiel Fryers | C83: 3000000 | E83: Sebastien Bassong | F83: 4000000 | H83: PTS | I83: POS
B84: Lewis Holtby | C84: 1500000 | E84: Luka Modric | F84: 30000000
E85: David Button | F85: 500000
E86: Rafael Van der Vaart | F86: 10300000
E87: Giovani Dos Santos | F87: 1000000
E88: Louis Saha | F88: Released
E89: Carlo Cudicini | F89: Free
E90: Jermaine Jenas | F90: Undisclosed
B91: Total | C91: =SUM(C77:C84) -> 61500000 | F91: =SUM(F77:F87) -> 62800000 | G91: =C91-F91 -> -1300000
B92: Season 11/12
B93: Brad Friedel | C93: Free | E93: Jamie O'Hara | F93: 5000000
B94: Cristian Ceballos | C94: Free | E94: Jonathan Woodgate | F94: Free
B95: Souleymane Coulibaly | C95: 2000000 | E95: Paul-José Mpoku | F95: Undisclosed
B96: Yago Falqué | C96: Undisclosed | E96: Robbie Keane | F96: ='\transferleague 2015-16\used\[team.xls]transfers summer 2011'!E72 -> £4,350,000
B97: Scott Parker | C97: 6000000 | E97: Alan Hutton | F97: 4000000
E98: Callum Tapping | F98: Nominal
E99: Peter Crouch | F99: 10000000
E100: Wilson Palacios | F100: 8000000
E101: Roman Pavlyuchenko | F101: 8000000
E102: Nouha Dicko | F102: Free | H102: PTS | I102: POS
B103: Total | C103: =SUM(C93:C100) -> 8000000 | F103: =SUM(F93:F102) -> 35000000 | G103: =C103-F103 -> -27000000 | H103: 69 | I103: 4
B104: Season 10/11
B105: Sandro Raniere | C105: 6000000 | E105: Lee Butcher | F105: Free
B106: William Gallas | C106: Free | E106: Sam Cox | F106: Free
B107: Rafael Van Der Vaart | C107: 8000000 | E107: Adel Taarabt | F107: 1000000
B108: Bongani Khumalo | C108: 1500000 | E108: Dorian Dervite | F108: Free
B109: Steven Pienaar | C109: 3000000 | H109: PTS | I109: POS
B110: Total | C110: =SUM(C105:C109) -> 18500000 | F110: =SUM(F105:F108) -> 1000000 | G110: =C110-F110 -> 17500000 | H110: 62 | I110: 5
B111: Season 09/10
B112: Kyle Naughton | C112: 5000000 | E112: David Hutton | F112: Undisclosed
B113: Kyle Walker | C113: 3000000 | E113: Danny Hutchins | F113: Free
B114: Peter Crouch | C114: 9000000 | E114: Didier Zokora | F114: 7750000
B115: Sebastien Bassong | C115: 8000000 | E115: Chris Gunter | F115: 1750000
B116: Niko Kranjcar | C116: 2000000 | E116: Darren Bent | F116: 16500000
B117: Jimmy Walker | C117: Free | E117: Pascal Chimbonda | F117: 3000000
B118: Younes Kaboul | C118: 5000000 | E118: Kevin-Prince Boateng | F118: 4000000
E119: Tomas Pekhart | F119: Free
E120: Troy Henville | F120: Undisclosed | H120: PTS | I120: POS
B121: Total | C121: =SUM(C112:C120) -> 32000000 | F121: =SUM(F112:F118) -> 33000000 | G121: =C121-F121 -> -1000000 | H121: 70 | I121: 4
B122: Season 08/09
B123: Vedran Corluka | C123: 8500000 | E123: Paul Robinson | F123: 3500000
B124: Heurelho Gomes | C124: 10000000 | E124: Pascal Chimbonda | F124: Undisclosed
B125: Robbie Keane | C125: 12000000 | E125: Robbie Keane | F125: 19000000
B126: Cesar Sanchez | C126: Undisclosed | E126: Anthony Gardener | F126: 2500000
B127: Jermain Defoe | C127: 15000000 | E127: Steed Malbranque | F127: 7000000
B128: Wilson Palacios | C128: 12000000 | E128: Younes Kaboul | F128: 5000000
B129: Carlo Cudicini | C129: Free | E129: Young Pyo Lee | F129: Undisclosed
B130: Pascal Chimbonda | C130: Signed | E130: Dimitar Berbatov | F130: 30750000
B131: Roman Pavlyuchenko | C131: 14000000 | E131: Andy Barcham | F131: Free
B132: David Bentley | C132: 15000000 | E132: Charlie Daniels | F132: Free
B133: John Bostock | C133: 700000 | E133: Hossam Ghaly | F133: Free
E134: Cesar Sanchez | F134: Signed
E135: Teemu Tainio | F135: Undisclosed | H135: PTS | I135: POS
B136: Total | C136: =SUM(C123:C135) -> 87200000 | F136: =SUM(F123:F135) -> 67750000 | G136: =C136-F136 -> 19450000 | H136: 51 | I136: 8
B138: Season 07/08
B139: Giovani | C139: 4700000 | E139: Radek Cerny | F139: Free
B140: Luka Modric | C140: 16600000 | E140: Jermain Defoe | F140: 7500000
B141: Gilberto | C141: 2000000 | E141: Wayne Routledge | F141: 1250000
B142: Alan Hutton | C142: 9000000 | E142: Lee Barnard | F142: Free
B143: Jonathan Woodgate | C143: 8000000 | E143: Philip Ifil | F143: Signed
B144: Chris Gunter | C144: 2000000 | E144: Danny Murphy | F144: Signed
B145: Kevin Boateng | C145: 5400000 | E145: Ahmed Mido | F145: 6000000
B146: Danny Rose | C146: 1000000 | E146: Charlie Daniels | F146: Signed
E147: Emil Hallfredsson | F147: Nominal | H147: PTS | I147: POS
B148: Total | C148: =SUM(C139:C147) -> 48700000 | F148: =SUM(F139:F147) -> 14750000 | G148: =C148-F148 -> 33950000 | H148: 46 | I148: 11
B150: Season 06/07
B151: Younes Kaboul | C151: Signed | E151: Mark Yeates | F151: Signed
B152: Darren Bent | C152: 16500000 | E152: Reto Ziegler | F152: Signed
B153: Adel Taarabt | C153: 3000000 | E153: Rob Burch | F153: Free
B154: Gareth Bale | C154: 6000000 | E154: Charlie Lee | F154: Free
B155: Ricardo Rocha | C155: 3300000 | E155: Stuart Lewis | F155: Signed
B156: Ben Alnwick | C156: 900000 | E156: Edgar Davids | F156: Free
B157: Pascal Chimbonda | C157: 4500000 | E157: Calum Davenport | F157: 3000000
B158: Sted Malbranque | C158: 2000000 | E158: Marton Fulop | F158: 500000
B159: Ahmed Mido | C159: 4500000 | E159: Andy Reid | F159: 3000000
B160: Didier Zokora | C160: 8200000 | E160: Michael Carrick | F160: 18600000
E161: Dean Marney | F161: Signed | H161: PTS | I161: POS
B162: Total | C162: =SUM(C151:C161) -> 48900000 | F162: =SUM(F151:F161) -> 25100000 | G162: =C162-F162 -> 23800000 | H162: 60 | I162: 5
B164: Season 05/06
B165: Dorian Dervitte | C165: Signed | E165: Stephen Kelly | F165: 750000
B166: Dimitar Berbatov | C166: 10900000 | E166: Claude Seanla | F166: Free
B167: Benoit Assou-Ekotto | C167: 3500000 | E167: Johnnie Jackson | F167: Free
B168: Danny Murphy | C168: 2000000 | E168: Mounir El Hamdaoui | F168: Signed
B169: Hossam Ghaly | C169: 3000000 | E169: Grzegorz Rasiak | F169: 2000000
B170: Young-Pyo Lee | C170: Signed | E170: Michael Brown | F170: 2000000
B171: Grzegorz Rasiak | C171: 2000000 | E171: Noe Pamarot | F171: 2500000
B172: Jermaine Jenas | C172: 7000000 | E172: Sean Davis | F172: 2500000
B173: Edgar Davids | C173: Free | E173: Pedro Mendes | F173: 2500000
B174: Radek Cerny | C174: Signed | E174: Erik Edman | F174: Signed
B175: Mounir El Hamdaoui | C175: Free | E175: Frederic Kanoute | F175: 4400000
B176: Teemu Tainio | C176: Free | E176: Mark Wright | F176: Free
B177: Aaron Lennon | C177: 1000000 | E177: Thimothee Atouba | F177: Signed
B178: Tom Huddlestone | C178: 2500000 | E178: Nicky Eyre | F178: Free
B179: Wayne Routledge | C179: 2500000 | E179: Mark Hughes | F179: Free | H179: PTS | I179: POS
B180: Total | C180: =SUM(C165:C179) -> 34400000 | F180: =SUM(F165:F179) -> 16650000 | G180: =C180-F180 -> 17750000 | H180: 65 | I180: 5
B182: Season 04/05
B183: Paul Stalteri | C183: Free | E183: Simon Davies | F183: 3500000
B184: Andy Reid | C184: 4000000 | E184: Rohan Ricketts | F184: Free
B185: Michael Dawson | C185: 4000000 | E185: Jamie Slabber | F185: Free
B186: Emil Hallfredsson | C186: Signed | E186: Kasey Keller | F186: 500000
B187: Reto Ziegler | C187: Signed | E187: Jamie Redknapp | F187: Free
B188: Calum Davenport | C188: 1300000 | E188: Mauricio Taricco | F188: Free
B189: Noe Pamarot | C189: 1750000 | E189: Gary Doherty | F189: 500000
B190: Michael Carrick | C190: 2750000 | E190: Stephen Carr | F190: 2000000
B191: Thimothee Atouba | C191: Free | E191: Darren Anderton | F191: Free
B192: Edson Silva Sousa | C192: Free | E192: Lars Hirschfeld | F192: Signed
B193: Noureddine Naybet | C193: 700000 | E193: Sergei Rebrov | F193: Free
B194: Erik Edman | C194: Signed | E194: Milenko Acimovic | F194: Free
B195: Pedro Mendes | C195: 2000000 | E195: Helder Postiga | F195: 5000000 | H195: PTS | I195: POS
B196: Total | C196: =SUM(C183:C195) -> 16500000 | F196: =SUM(F183:F195) -> 11500000 | G196: =C196-F196 -> 5000000 | H196: 52 | I196: 9
B198: Season 03/04
B199: Marton Fulop | C199: 200000 | E199: Christian Ziege | F199: Free
B200: Sean Davis | C200: Signed | E200: Shwan Jalal | F200: Free
B201: Paul Robinson | C201: 1500000 | E201: David Hicks | F201: Free
B202: Jermain Defoe | C202: 7000000 | E202: Bobby Zamora | F202: Swap
B203: Michael Brown | C203: 500000 | E203: Jonathan Blondel | F203: Signed
B204: Mbulelo Mabizela | C204: Signed | E204: Chris Perry | F204: Nominal
B205: Frederic Kanoute | C205: 3500000 | E205: Neil Sullivan | F205: Free
B206: Bobby Zamora | C206: 1500000 | E206: Matthew Etherington | F206: Swap
E207: Steffen Iversen | F207: Free
E208: Steffen Freund | F208: Free
E209: John Sutton | F209: Free
E210: Ben Thatcher | F210: Free
E211: Teddy Sheringham | F211: Free | H211: PTS | I211: POS
B212: Total | C212: =SUM(C199:C211) -> 14200000 | F212: =SUM(F199:F211) -> 0 | G212: =C212-F212 -> 14200000 | H212: 45 | I212: 14
B214: Season 02/03
B215: Helder Postiga | C215: 6250000 | E215: Alton Thelwell | F215: Free
B216: Robbie Keane | C216: 7000000 | E216: Mario Noto | F216: Free
B217: Rohan Ricketts | C217: Free | E217: Tim Sherwood | F217: Signed
B218: Jonathan Blondel | C218: Signed | E218: Les Ferdinand | F218: Nominal
B219: Jamie Redknapp | C219: Free | E219: Stephen Clemence | F219: 250000
B220: Milenko Acimovic | C220: Free | E220: John Piercy | F220: Free
E221: Oyvind Leonhardsen | F221: Free
E222: Chris Armstrong | F222: Free
E223: Yannick Kamanan | F223: Signed | H223: PTS | I223: POS
B224: Total | C224: =SUM(C215:C223) -> 13250000 | F224: =SUM(F215:F223) -> 250000 | G224: =C224-F224 -> 13000000 | H224: 50 | I224: 10
B226: Season 01/02
B227: Dave Beasant | C227: Free | E227: Ciaran Toner | F227: Free
B228: Dean Richards | C228: 8100000 | E228: Dave Beasant | F228: Free
B229: Kasey Keller | C229: Free | E229: Luke Young | F229: 3000000
B230: Christian Ziege | C230: 4000000 | E230: Dave McEwen | F230: Free
B231: Goran Bunjevcevic | C231: 1400000 | E231: Ian Walker | F231: 2500000
E232: Sol Campbell | F232: Free
E233: Ramon Vega | F233: Free | H233: PTS | I233: POS
B234: Total | C234: =SUM(C227:C233) -> 13500000 | F234: =SUM(F227:F233) -> 5500000 | G234: =C234-F234 -> 8000000 | H234: 50 | I234: 9
B236: Season 00/01
B237: Gustavo Poyet | C237: Signed | E237: Neale Fenn | F237: Free
B238: Teddy Sheringham | C238: Free | E238: Mark Gower | F238: 32500
B239: Stevie Ferguson | C239: Signed | E239: Jose Dominguez | F239: Signed
B240: Ben Thatcher | C240: 5000000 | E240: Ruel Fox | F240: 200000
E241: David Lee | F241: Free
E242: Allan Nielsen | F242: 2250000
E243: Espen Baardsen | F243: 1250000
E244: David Ginola | F244: 3000000
E245: Peter Crouch | F245: 60000
E246: John Scales | F246: Free | H246: PTS | I246: POS
B247: Total | C247: =SUM(C237:C246) -> 5000000 | F247: =SUM(F237:F246) -> 6792500 | G247: =C247-F247 -> -1792500 | H247: 49 | I247: 12
B249: Season 99/00
B250: Sergei Rebrov | C250: 11000000 | E250: Paul McVeigh | F250: Nominal
B251: Neil Sullivan | C251: Free | E251: Justin Edinburgh | F251: 175000
B252: Gary Doherty | C252: 1000000 | E252: Paolo Tramezzani | F252: Free
B253: Jon Jonssen | C253: 250000 | E253: Moussa Saib | F253: 640000
B254: Anthony Gardner | C254: 1000000 | E254: Simon Webb | F254: Signed
B255: Dave McEwen | C255: Free | E255: Alan Marriott | F255: Free
B256: Simon Davies | C256: 700000 | E256: Clive Wilson | F256: Free
B257: Matthew Etherington | C257: 500000 | E257: Simon Brown | F257: Free
B258: Oyvind Leonhardsen | C258: 3000000 | E258: Rory Allen | F258: 1000000
B259: Yannick Kamanan | C259: Trainee | E259: Andy Sinton | F259: Free
B260: Chris Perry | C260: 4000000 | E260: Roger Nilsen | F260: Free | H260: PTS | I260: POS
B261: Total | C261: =SUM(C250:C260) -> 21450000 | F261: =SUM(F250:F260) -> 1815000 | G261: =C261-F261 -> 19635000 | H261: 53 | I261: 10
B263: Season 98/99
B264: Willem Korsten | C264: 1500000 | E264: Ross Fitzsimon | F264: Free
B265: Roger Nilsen | C265: Free | E265: Peter Gain | F265: 15000
B266: Tim Sherwood | C266: 4000000 | E266: Colin Calderwood | F266: 225000
B267: Steffen Freund | C267: 750000 | E267: Nicola Berti | F267: Free
B268: Mauricio Taricco | C268: 1775000 | E268: Mark Arber | F268: 75000 | H268: PTS | I268: POS
B269: Total | C269: =SUM(C264:C268) -> 8025000 | F269: =SUM(F264:F268) -> 315000 | G269: =C269-F269 -> 7710000 | H269: 47 | I269: 11
B271: Season 97/98
B272: Paolo Tramezzani | C272: 1350000 | E272: Garry Brady | F272: Free
B273: Moussa Saib | C273: 2300000 | E273: Dean Austin | F273: Free
B274: Frode Grodas | C274: 250000 | E274: Danny Hill | F274: Free
B275: Nicola Berti | C275: Free | E275: David Howells | F275: Free
B276: Jose Dominguez | C276: 1600000 | E276: Paul Mahorn | F276: Non-contract
B277: Les Ferdinand | C277: 6000000 | E277: Jamie Clapham | F277: 300000
B278: David Ginola | C278: 2000000 | E278: Kevin Maher | F278: Free
E279: Leon Townley | F279: 55000
E280: Ronny Rosenthal | F280: Free
E281: Simon Wormull | F281: Free | H281: PTS | I281: POS
B282: Total | C282: =SUM(C272:C281) -> 13500000 | F282: =SUM(F272:F281) -> 355000 | G282: =C282-F282 -> 13145000 | H282: 44 | I282: 14
B284: Season 96/97
B285: Ramon Vega | C285: 3750000 | E285: Teddy Sheringham | F285: 3500000
B286: Kevin Watson | C286: Free | E286: Kevin Scott | F286: 250000
B287: John Scales | C287: 2600000 | E287: Jason Cundy | F287: 200000
B288: Steve Slade | C288: 350000 | E288: Gerry McMahon | F288: 450000
B289: Steffen Iversen | C289: 2500000 | E289: Andy Turner | F289: 250000
B290: Chris Day | C290: 225000 | H290: PTS | I290: POS
B291: Total | C291: =SUM(C285:C290) -> 9425000 | F291: =SUM(F285:F290) -> 4650000 | G291: =C291-F291 -> 4775000 | H291: 46 | I291: 10
B293: Season 95/96
B294: Espen Baardsen | C294: free | E294: Kevin Watson | F294: Free
B295: Darren Caskey | C295: 700000 | E295: Steve Slade | F295: 350000
B296: Nick Barmby | C296: free | E296: Chris Day | F296: 225000
E297: Darren Caskey | F297: 700000
E298: Nick Barmby | F298: 5250000
E299: Jurgen Klinnsmann | F299: 1400000 | H299: PTS | I299: POS
B300: Total | C300: =SUM(C294:C298) -> 700000 | F300: =SUM(F294:F299) -> 7925000 | G300: =C300-F300 -> -7225000 | H300: 61 | I300: 8
B302: Season 94/95
B303: Chris Armstrong | C303: 4500000 | E303: John Hendry | F303: 200000
B304: Clive Wilson | C304: Free | E304: Gica Popescu | F304: 2800000
B305: Gica Popescu | C305: 2900000 | E305: Gudni Bergsson | F305: 65000
B306: Ilie Dumitrescu | C306: 2600000 | E306: Steve Robinson | F306: Free
B307: Jurgen Klinsmann | C307: 2000000 | E307: Neil Young | F307: Free
E308: Peter Beadle | F308: Signed
E309: Ijah Anderson | F309: Free
E310: Vinny Samways | F310: 2200000 | H310: PTS | I310: POS
B311: Total | C311: =SUM(C303:C310) -> 12000000 | F311: =SUM(F303:F310) -> 5265000 | G311: =C311-F311 -> 6735000 | H311: 62 | I311: 7
B313: Season 93/94
B314: Owen Coll | C314: Signed | E314: Jeff Minton | F314: Free
B315: Kevin Scott | C315: 850000 | E315: Neil Le Bihan | F315: Free
B316: Ronny Rosenthal | C316: 250000 | E316: Glynn Hurst | F316: Free
B317: David Kerslake | C317: 450000 | E317: Andy Quy | F317: Free
B318: Jason Dozzell | C318: 1900000 | E318: Steve Sedgley | F318: 1000000
E319: Andy Gray | F319: Signed
E320: Lee Hodges | F320: Free
E321: Junior McDougald | F321: Signed
E322: Gordon Durie | F322: 1200000
E323: Kevin Dearden | F323: Free
E324: Paul Allen | F324: 500000
E325: Pat Van Den Hauwe | F325: Free
E326: David McDonald | F326: Free
E327: Scott Houghton | F327: Free
E328: Ian Hendon | F328: 50000
E329: David Tuttle | F329: 350000 | H329: PTS | I329: POS
B330: Total | C330: =SUM(C314:C329) -> 3450000 | F330: =SUM(F314:F329) -> 3100000 | G330: =C330-F330 -> 350000 | H330: 45 | I330: 15
B332: Season 92/93
B333: Colin Calderwood | C333: 1250000 | E333: Neil Ruddock | F333: 2500000
B334: Teddy Sheringham | C334: 2100000 | E334: Mark Robson | F334: Free | H334: PTS | I334: POS
B335: Season Total | C335: =SUM(C333:C334) -> 3350000 | F335: =SUM(F333:F334) -> 2500000 | G335: =C335-F335 -> 850000 | H335: 59 | I335: 8