B2: Season 91/92 to date | C2: =C15 -> 862950000 | F2: =F15 -> 435490000 | G2: =C2-F2 -> 427460000 | H2: =SUM(G17:G320) -> 427460000 | I2: =G2-H2 -> 0
B3: Season 03/04 to date | C3: =C194+C179+C166+C148+C137+C123+C116+C106+C95+C83+C70+C57+C35 -> 697050000 | F3: =F194+F179+F166+F148+F137+F123+F116+F106+F95+F83+F70+F57 -> 284150000 | G3: =C3-F3 -> 412900000 | H3: =SUM(G17:G194) -> 337450000 | I3: =G3-H3 -> 75450000
B4: Championship 04/05 | C4: =C179+C166+C148+C137+C123+C116+C106+C95+C83+C70+C57+C35 -> 643700000 | F4: =F179+F166+F148+F137+F123+F116+F106+F95+F83+F70+F57 -> 244150000 | G4: =C4-F4 -> 399550000 | H4: =SUM(G17:G179) -> 324100000 | I4: =G4-H4 -> 75450000
B5: Last five seasons | C5: =C95+C83+C70+C57+C35 -> 432700000 | F5: =F95+F83+F70+F57+F35 -> 144400000 | G5: =C5-F5 -> 288300000 | H5: =SUM(G17:G95) -> 288300000 | I5: =G5-H5 -> 0
B6: Before Glazer Buyout | C6: =SUM(C179+C194+C205+C222+C236+C247+C255+C270+C275+C285+C300+C311+C320) -> 246450000 | F6: =SUM(F179+F194+F205+F222+F236+F247+F255+F270+F275+F285+F300+F311+F320) -> 121740000 | G6: =C6-F6 -> 124710000 | H6: =SUM(G179:G321) -> 124710000 | I6: =G6-H6 -> 0
B7: After Glazer Buyout | C7: =C166+C148+C137+C123+C116+C106+C95+C83+C70+C57+C35 -> 616500000 | F7: =F166+F148+F137+F123+F116+F106+F95+F83+F70+F57+F35 -> 313750000 | G7: =C7-F7 -> 302750000 | H7: =SUM(G17:G166) -> 302750000 | I7: =G7-H7 -> 0
B8: Championship 04 /05 | C8: =C179+C166+C148+C137+C123+C116+C106+C95+C83+C70+C57+C35 -> 643700000 | F8: =F179+F166+F148+F137+F123+F116+F106+F95+F83+F70+F57+F35 -> 319600000 | G8: =C8-F8 -> 324100000 | H8: =SUM(G17:G179) -> 324100000 | I8: =G8-H8 -> 0
B10: Ales Ferguson | C10: =C320+C311+C300+C285+C275+C270+C255+C247+C236+C222+C205+C194+C179+C166+C148+C137+C123+C116+C106+C95+C83 -> 546150000 | F10: =F320+F311+F300+F285+F275+F270+F255+F247+F236+F222+F205+F194+F179+F166+F148+F137+F123+F116+F106+F95+F83 -> 317740000 | G10: =C10-F10 -> 228410000 | H10: =SUM(G83:G320) -> 228410000 | I10: =G10-H10 -> 0
B11: David Moyes | C11: =C70 -> 67700000 | F11: =F70 -> 1000000 | G11: =C11-F11 -> 66700000 | H11: =SUM(G58:G70) -> 66700000 | I11: =G11-H11 -> 0
B12: Louis Van Gaal | C12: =C57+C35 -> 249100000 | F12: =F57+F35 -> 116750000 | G12: =C12-F12 -> 132350000 | H12: =SUM(G18:G57) -> 132350000 | I12: =G12-H12 -> 0
B14: Manchester United
B15: Combined Totals | C15: =C320+C311+C300+C285+C275+C270+C255+C247+C236+C222+C205+C194+C179+C166+C148+C137+C123+C116+C106+C95+C83+C70+C57+C35 -> 862950000 | F15: =F320+F311+F300+F285+F275+F270+F255+F247+F236+F222+F205+F194+F179+F166+F148+F137+F123+F116+F106+F95+F83+F70+F57+F35 -> 435490000 | G15: =SUM(G17:G321) -> 427460000 | H15: =SUM(H71:H321) -> 1752
B17: Players Purchased | C17: Fee | E17: Players Sold | F17: Fee | G17: Net Total | H17: Points | I17: Poition
B18: Season 15/16
B19: Memphis Depay | C19: 25000000 | E19: Tom Cleverly | F19: Free
B20: Matteo Darmian | C20: 12700000 | E20: Ben Amos | F20: Released
B21: Morgan Schneiderlin | C21: 24000000 | E21: Tom Thorpe | F21: Released
B22: Bastian Schweinsteiger | C22: 6500000 | E22: Nani | F22: 4250000
B23: Sergio Romero | C23: Free | E23: Robin van Persie | F23: 4200000
B24: Anthony Martial | C24: 35000000 | E24: Angel Di Maria | F24: 44300000
B25: Regan Poole | C25: 400000 | E25: Rafael | F25: 2500000
E26: Jonny Evans | F26: 8000000
E27: Javier Hernández | F27: 12000000
E28: Saidy Janko | F28: Compensation
E29: Reece James | F29: 200000
E30: Anders Lindegaard | F30: Free
E31: Liam Grimshaw | F31: Undisclosed
H34: PTS | I34: POS
C35: =SUM(C19:C28) -> 103600000 | F35: =SUM(F19:F34) -> 75450000 | G35: =C35-F35 -> 28150000
B36: Season 14/15
B37: Vanja Milinković | C37: Undisclosed | E37: Federico Macheda | F37: Free
B38: Ander Herrera | C38: 29000000 | E38: Alexander Büttner | F38: 4400000
B39: Luke Shaw | C39: 27000000 | E39: Jack Barmby | F39: Free
B40: Marcos Rojo | C40: 16000000 | E40: Rio Ferdinand | F40: Released
B41: Ángel Di María | C41: 59700000 | E41: Nemanja Vidic | F41: Released
B42: Daley Blind | C42: 13800000 | E42: Ryan Giggs | F42: Released
B43: Victor Valdez | C43: Free | E43: Louis Rowley | F43: Free
B44: Sadiq El Fitouri | C44: Free | E44: Patrice Evra | F44: 1500000
E45: Bebé | F45: 2400000
E46: Shinji Kagawa | F46: 7000000
E47: Danny Welbeck | F47: 16000000
E48: Tom Lawrence | F48: 1000000
E49: Charni Ekangamene | F49: Undisclosed
E50: Sam Byrne | F50: Released
E51: Jack Rudge | F51: Released
E52: Michael Keane | F52: 3000000
E53: Darren Fletcher | F53: free
E54: Marnick Vermijl | F54: Undisclosed
E55: Wilfried Zaha | F55: 6000000
E56: Anderson | F56: Free | H56: PTS | I56: POS
C57: =SUM(C37:C47) -> 145500000 | F57: =SUM(F37:F56) -> 41300000 | G57: =C57-F57 -> 104200000 | H57: 70 | I57: 4
B58: Season 13/14
B59: Guillermo Varela | C59: 2400000 | E59: Freddie Veseli. | F59: Released
B60: Marouane Fellaini | C60: 27500000 | E60: Gyliano Van Velzen, | F60: Released
B61: Saidy Janko | C61: 700000 | E61: John Cofie, | F61: Released
B62: Juan Mata | C62: 37100000 | E62: Luke Giverin, | F62: Released
E63: Luke Hendrie, | F63: Released
E64: Luke McCullough, | F64: Released
E65: Michele Fornasier, | F65: Released
E66: Reece Brown, | F66: Released
E67: Paul Scholes | F67: Retired
E68: Scott Wootton | F68: 1000000 | H68: Prem
E69: Fabio | F69: Minimal | H69: PTS | I69: POS
B70: Total | C70: =SUM(C59:C69) -> 67700000 | F70: =SUM(F59:F69) -> 1000000 | G70: =C70-F70 -> 66700000 | H70: 64 | I70: 7
B71: Season 12/13
B72: Nick Powell | C72: 6000000 | E72: Matthew James | F72: 1000000
B73: Shinji Kagawa | C73: 12000000 | E73: Ritchie De Laet | F73: 1000000
B74: Sean Goss | C74: 100000 | E74: Oliver Norwood | F74: 400000
B75: Robin Van Persie | C75: 22000000 | E75: Tomasz Kuszczak | F75: Free
B76: Angelo Henrique | C76: 4000000 | E76: Park Ji-Sung | F76: 2500000
B77: Alexander Büttner | C77: 3900000 | E77: Paul Pogba | F77: Free
B78: Wilfred Zaha | C78: 15000000 | E78: Dimitar Berbatov | F78: 4000000
E79: Michael Owen | F79: released
E80: Joshua King | F80: 1000000
E81: Robbie Brady | F81: 2000000 | H81: Prem
E82: Ezekiel Fryers | F82: Free | H82: Pts | I82: Pos
B83: Total | C83: =SUM(C71:C78) -> 63000000 | F83: =SUM(F72:F81) -> 11900000 | G83: =C83-F83 -> 51100000 | H83: 89 | I83: 1
B84: Season 11/12
B85: Phil Jones | C85: 17000000 | E85: Corry Evans | F85: 500000
B86: David De Gea | C86: 18900000 | E86: Joe Dudgeon[1] | F86: 300000
B87: Ashley Young | C87: 17000000 | E87: John O'Shea | F87: 4500000
B88: Paul Scholes | C88: Free | E88: Wes Brown | F88: 1200000
E89: Nicholas Ajose | F89: undisclosed
E90: Gabriel Obertan | F90: 3000000
E91: Darron Gibson | F91: 2000000
E92: Daniel Drinkwater | F92: 750000
E93: Ravel Morrison | F93: 1000000 | H93: Prem
E94: Mame Biram Diouf | F94: 1500000 | H94: Pts | I94: Pos
B95: Total | C95: =SUM(C85:C90) -> 52900000 | F95: =SUM(F85:F94) -> 14750000 | G95: =C95-F95 -> 38150000 | H95: 89 | I95: 2
B96: Season 10/11
B97: Chris Smalling | C97: 10000000 | E97: Ben Foster | F97: 6000000
B98: Javier Hernandez | C98: 6000000 | E98: Zoran Tosic | F98: 7000000
B99: Marnick Vermijl | C99: 300000 | E99: Tom Heaton | F99: Free
B100: Bebe | C100: 7400000 | E100: Ron-Robert Zieler | F100: Free
B101: Anders Lindegaard | C101: 3500000 | E101: David Gray | F101: Free
E102: Craig Cathcart | F102: 350000
E103: James Chester | F103: 300000 | H103: Prem
E104: Cameron Stewart | F104: undisclosed | H104: Pts | I104: Pos
E105: Magnus Eikrem | F105: Undisclosed
B106: Total | C106: =SUM(C97:C102) -> 27200000 | F106: =SUM(F97:F104) -> 13650000 | G106: =C106-F106 -> 13550000 | H106: 80 | I106: 1
B107: Season 09/10
B108: Antonio Valencia | C108: 16000000 | E108: Cristiano Ronaldo | F108: 80000000
B109: Michael Owen | C109: Free | E109: Lee Martin | F109: 1500000
B110: Gabriel Obertan | C110: 3000000 | E110: Fraizer Campbell | F110: 3500000
B111: Mame Biram Diouf | C111: 2000000 | E111: Richard Eckersley | F111: Tribunal
B112: Paul Pogba | C112: Nominal | E112: Manucho | F112: undisclosed
E113: Danile Galbraith | F113: Free
E114: Carlos Tevez | F114: Free | H114: Prem
E115: Danny Simpson | F115: 500000 | H115: Pts | I115: Pos
B116: Total | C116: =SUM(C108:C115) -> 21000000 | F116: =SUM(F108:F115) -> 85500000 | G116: =C116-F116 -> -64500000 | H116: 85 | I116: 2
B117: Season 08/09
B118: Demitar Berbatov | C118: 30750000 | E118: Ritchie Jones | F118: Free
B119: Zoran Tosic | C119: 5000000 | E119: Chris Eagles | F119: 1250000
B120: Adem Ljajic | C120: Cancelled[7] | E120: Michael Lea | F120: Free
B121: Ritchie De Laet | C121: Undisclosed | E121: Mikael Sylvestre | F121: 750000 | H121: Prem
E122: Louis Saha | F122: Signed | H122: Pts | I122: Pos
B123: Total | C123: =SUM(C118:C122) -> 35750000 | F123: =SUM(F118:F122) -> 2000000 | G123: =C123-F123 -> 33750000 | H123: 90 | I123: 1
B125: Season 07/08
B126: Manucho | C126: Signed | E126: Gerard Pique | F126: 6000000
B127: Carlos Tevez | C127: 9000000 | E127: Kieran Lee | F127: Free
B128: Nani | C128: 13500000 | E128: Phil Bardsley | F128: 2000000
B129: Tomasz Kuszczak | C129: 2150000 | E129: Ryan Shawcross | F129: 1000000
B130: Anderson | C130: 15000000 | E130: Adam Eckersley | F130: Free
B131: Owen Hargreaves | C131: 17000000 | E131: Phil Marsh | F131: Free
B132: Rafael Da Silva | C132: 2500000 | E132: Gabriel Heinze | F132: 8000000
B133: Fabio Da Silva | C133: 2600000 | E133: Alan Smith | F133: 6000000
B134: Rodrigo Possebon | C134: Signed | E134: Daniel Rose | F134: Signed
E135: Giuseppe Rossi | F135: 6700000 | H135: Prem
E136: Kieran Richardson | F136: 5500000 | H136: Pts | I136: Pos
B137: Total | C137: =SUM(C126:C136) -> 61750000 | F137: =SUM(F126:F136) -> 35200000 | G137: =C137-F137 -> 26550000 | H137: 87 | I137: 1
B139: Season 06/07
B140: Michael Carrick | C140: 18600000 | E140: Tim Howard | F140: 3000000
E141: David Jones | F141: 1000000
E142: Liam Miller | F142: Free
E143: Paul McShane | F143: Free
E144: Luke Steele | F144: Signed
E145: Ruud van Nistelrooy | F145: 10300000
E146: Quinton Fortune | F146: Free | H146: Prem
E147: Sylvain Ebanks-Blake | F147: 200000 | H147: Pts | I147: Pos
B148: Total | C148: =SUM(C140:C147) -> 18600000 | F148: =SUM(F140:F147) -> 14500000 | G148: =C148-F148 -> 4100000 | H148: 89 | I148: 1
B150: Season 05/06
B151: Patrice Evra | C151: 5500000 | E151: John Mikel Obi | F151: 12000000
B152: Nemanja Vidic | C152: 7000000 | E152: Eddie Johnson | F152: Free
B153: Ben Foster | C153: 1000000 | E153: Jonathan Spector | F153: 500000
B154: Ji-Sung Park | C154: 4000000 | E154: Tommy Lee | F154: Free
B155: Edwin Van Der Sar | C155: 2000000 | E155: Phil Picken | F155: Free
E156: Colin Heath | F156: Signed
E157: Neil Wood | F157: Free
E158: David Fox | F158: Free
E159: Roy Keane | F159: Free
E160: Kleberson | F160: 2500000
E161: Phil Neville | F161: 3500000
E162: Michael Stewart | F162: Signed
E163: Paul Tierney | F163: Signed
E164: David Bellion | F164: Undisclosed | H164: Prem
E165: Daniel Nardiello | F165: Free | H165: Pts | I165: Pos
B166: Total | C166: =SUM(C151:C165) -> 19500000 | F166: =SUM(F151:F165) -> 18500000 | G166: =C166-F166 -> 1000000 | H166: 83 | I166: 2
B168: Season 04/05
B169: Florent N'Galula | C169: 0 | E169: Steven Hogg | F169: Free
B170: Wayne Rooney | C170: 27000000 | E170: Ricardo | F170: Free
B171: Giuseppe Rossi | C171: 200000 | E171: Roy Carroll | F171: Free
E172: David Poole | F172: Free
E173: Eric Djemba-Djemba | F173: 1350000
E174: Bojan Djordjic | F174: Free
E175: Diego Forlan | F175: 2000000
E176: Luke Chadwick | F176: Free
E177: Nicky Butt | F177: 2500000 | H177: Prem
E178: Mark Lynch | F178: Signed | H178: Pts | I178: Pos
B179: Total | C179: =SUM(C169:C178) -> 27200000 | F179: =SUM(F169:F178) -> 5850000 | G179: =C179-F179 -> 21350000 | H179: 77 | I179: 3
B181: Season 03/04
B182: Liam Miller | C182: Free | E182: Luke Daniels | F182: Free
B183: Gabriel Heinze | C183: 6900000 | E183: Ben Williams | F183: Free
B184: Alan Smith | C184: 7000000 | E184: Danny Pugh | F184: Swap
B185: Louis Saha | C185: 12820000 | E185: Fabien Barthez | F185: Free
B186: Dong | C186: 500000 | E186: Matt Williams | F186: Free
B187: Cristiano Ronaldo | C187: 12200000 | E187: Alan Tate | F187: Free
B188: Kleberson | C188: 5930000 | E188: David May | F188: Free
B189: Tim Howard | C189: 2300000 | E189: Juan Veron | F189: 15000000
B190: Eric Djemba-Djemba | C190: 3500000 | E190: Danny Webber | F190: Nominal
B191: David Bellion | C191: 2000000 | E191: David Beckham | F191: 25000000
B192: Lee Martin | C192: 200000 | E192: John Rankin | F192: 0 | H192: Prem
H193: Pts | I193: Pos
B194: Total | C194: =SUM(C182:C192) -> 53350000 | F194: =SUM(F182:F192) -> 40000000 | G194: =C194-F194 -> 13350000 | H194: 75 | I194: 3
B195: Season 02/03
B196: Ricardo | C196: 1500000 | E196: Lee Roche | F196: Free
B197: Rio Ferdinand | C197: 27550000 | E197: Kirk Hilton | F197: Free
B198: Kieran Richardson | C198: Unknown | E198: Ben Muirhead | F198: Free
E199: Ronny Johnsen | F199: Free
E200: Dwight Yorke | F200: 2000000
E201: Andy Taylor | F201: Free
E202: Denis Irwin | F202: Free
E203: Nick Culkin | F203: Free | H203: Prem
E204: Ronnie Wallwork | F204: Free | H204: Pts | I204: Pos
B205: Total | C205: =SUM(C196:C204) -> 29050000 | F205: =SUM(F196:F204) -> 2000000 | G205: =C205-F205 -> 27050000 | H205: 83 | I205: 1
B207: Season 01/02
B208: Luke Steele | C208: 500000 | E208: Rai Van Der Gouw | F208: Free
B209: Diego Forlan | C209: 6900000 | E209: Paul Rachubka | F209: 200000
B210: Laurent Blanc | C210: Free | E210: Michael Clegg | F210: Free
B211: Roy Carroll | C211: 2500000 | E211: Andy Cole | F211: 7500000
B212: Juan Veron | C212: 28100000 | E212: Jesper Blomqvist | F212: Free
B213: Ruud Van Nistelrooy | C213: 19000000 | E213: Michael Twiss | F213: Signed
E214: Jaap Stam | F214: 16500000
E215: George Clegg | F215: Free
E216: Jonathan Greening | F216: 2000000
E217: Mark Wilson | F217: 1500000
E218: Stephen Cosgrove | F218: Free
E219: Michael Rose | F219: Free
E220: Josh Walker | F220: Free | H220: Prem
E221: Marc Whiteman | F221: Free | H221: Pts | I221: Pos
B222: Total | C222: =SUM(C208:C221) -> 57000000 | F222: =SUM(F208:F221) -> 27700000 | G222: =C222-F222 -> 29300000 | H222: 77 | I222: 3
B224: Season 00/01
B225: None | E225: Teddy Sheringham | F225: Free
E226: Ashley Dodd | F226: Free
E227: Rhodri Jones | F227: Free
E228: Mark Bosnich | F228: Free
E229: David Healy | F229: 1800000
E230: Henning Berg | F230: 1750000
E231: Alex Notman | F231: 250000
E232: Steve Rose | F232: Free
E233: Jordi Cruyff | F233: Free
E234: Massimo Taibi | F234: 2500000 | H234: Prem
E235: Danny Higginbotham | F235: 2000000 | H235: Pts | I235: Pos
B236: Total | C236: =SUM(C225:C235) -> 0 | F236: =SUM(F225:F235) -> 8300000 | G236: =C236-F236 -> -8300000 | H236: 80 | I236: 1
B238: Season 99/00
B239: Fabien Barthez | C239: 7800000 | E239: Paul Wheatcroft | F239: Free
B240: Mikael Silvestre | C240: 4000000 | E240: John Curtis | F240: 1500000
B241: Massimo Taibi | C241: 4500000 | E241: Ritchie Wellens | F241: Nominal
B242: Quinton Fortune | C242: 1500000 | E242: Ian Fitzpatrick | F242: Free
B243: Mark Bosnich | C243: Free | E243: Ryan Ford | F243: Nominal
E244: Erik Nevland | F244: 250000
E245: Jamie Wood | F245: Free | H245: Prem
E246: Peter Schmeichel | F246: Free | H246: Pts | I246: Pos
B247: Total | C247: =SUM(C239:C246) -> 17800000 | F247: =SUM(F239:F246) -> 1750000 | G247: =C247-F247 -> 16050000 | H247: 91 | I247: 1
B249: Season 98/99
B250: Bojan Djordjic | C250: Signed | E250: Terry Cooke | F250: 1000000
B251: Dwight Yorke | C251: 12600000 | E251: Michael Ryan | F251: Free
B252: Jesper Blomqvist | C252: 4400000 | E252: Paul Gibson | F252: Free
B253: Jaap Stam | C253: 10750000 | E253: Phil Mulryne | F253: 500000 | H253: Prem
E254: Chris Casper | F254: 300000 | H254: Pts | I254: Pos
B255: Total | C255: =SUM(C250:C254) -> 27750000 | F255: =SUM(F250:F254) -> 1800000 | G255: =C255-F255 -> 25950000 | H255: 79 | I255: 1
B257: Season 97/98
B258: Jonathan Greening | C258: 1150000 | E258: Gary Pallister | F258: 2500000
B259: Henning Berg | C259: 5000000 | E259: Ben Thornley | F259: 175000
E260: Robert Trees | F260: Free
E261: Grant Brebner | F261: 300000
E262: Tommy Smith | F262: Signed
E263: John O'Kane | F263: 400000
E264: Karel Poborsky | F264: 3000000
E265: Pat McGibbon | F265: 250000
E266: Michael Appleton | F266: 500000
E267: Jon Macken | F267: 1300000
E268: Colin Murdock | F268: 100000 | H268: Prem
E269: Simon Davies | F269: 150000 | H269: Pts | I269: Pos
B270: Total | C270: =SUM(C258:C269) -> 6150000 | F270: =SUM(F258:F269) -> 8675000 | G270: =C270-F270 -> -2525000 | H270: 77 | I270: 2
B272: Season 96/97
B273: Erik Nevland | C273: 1500000 | E273: Lee Sharpe | F273: 4500000 | H273: Prem
B274: Teddy Sheringham | C274: 3500000 | H274: Pts | I274: Pos
B275: Total | C275: =SUM(C273:C274) -> 5000000 | F275: =SUM(F273:F274) -> 4500000 | G275: =C275-F275 -> 500000 | H275: 75 | I275: 1
B277: Season 95/96
B278: Jordi Cruyff | C278: 1300000 | E278: Tony Coton | F278: 600000
B279: Karel Poborsky | C279: 3500000 | E279: Steve Bruce | F279: Free
B280: Ole Solskjaer | C280: 1500000 | E280: Gary Twynham | F280: Free
B281: Ronny Johnsen | C281: 1200000 | E281: Richard Flash | F281: Free
B282: Rai Van Der Gouw | C282: 500000 | E282: Andrei Kanchelskis | F282: 5000000
B283: Tony Coton | C283: 500000 | E283: Gary Walsh | F283: 250000 | H283: Prem
B284: Nick Culkin | C284: 250000 | H284: Pts | I284: Pos
B285: Total | C285: =SUM(C278:C284) -> 8750000 | F285: =SUM(F278:F284) -> 5850000 | G285: =C285-F285 -> 2900000 | H285: 82 | I285: 1
B287: Season 94/95
B288: Andy Cole | C288: 7000000 | E288: Ashley Westwood | F288: 40000
B289: David May | C289: 1250000 | E289: Richard Irving | F289: 75000
E290: David Johnson | F290: Free
E291: Mark Rawlinson | F291: Free
E292: Mark Hughes | F292: 1500000
E293: Paul Ince | F293: 7000000
E294: Keith Gillespie | F294: 1000000
E295: Dion Dublin | F295: 2000000
E296: Colin McKee | F296: 265000
E297: Neil Whitworth | F297: 350000
E298: David Pierce | F298: Free | H298: Prem
E299: Craig Lawton | F299: Free | H299: Pts | I299: Pos
B300: Total | C300: =SUM(C288:C299) -> 8250000 | F300: =SUM(F288:F299) -> 12230000 | G300: =C300-F300 -> -3980000 | H300: 88 | I300: 2
B302: Season 93/94
B303: Graeme Tomlinson | C303: 100000 | E303: Robbie Savage | F303: Free
B304: Roy Keane | C304: 3750000 | E304: Les Sealey | F304: Free
E305: Clayton Blackmore | F305: Free
E306: Mike Phelan | F306: Free
E307: Bryan Robson | F307: Free
E308: Lee Martin | F308: 350000
E309: Darren Ferguson | F309: 250000 | H309: Prem
E310: Danny Wallace | F310: 400000 | H310: Pts | I310: Pos
B311: Total | C311: =SUM(C303:C310) -> 3850000 | F311: =SUM(F303:F310) -> 1000000 | G311: =C311-F311 -> 2850000 | H311: 92 | I311: 1
B313: Season 92/93
B314: Les Sealey | C314: Free | E314: Brian Carey | F314: 250000
B315: Eric Cantona | C315: 1200000 | E315: Russell Beardsmore | F315: Free
B316: Dion Dublin | C316: 1000000 | E316: Neil Webb | F316: 800000
B317: Pat McGibbon | C317: 100000 | E317: Derek Brazil | F317: 85000
E318: Mark Robins | F318: 800000 | H318: Prem
E319: Mal Donaght | F319: 150000 | H319: Pts | I319: Pos
B320: Total | C320: =SUM(C314:C318) -> 2300000 | F320: =SUM(F314:F319) -> 2085000 | G320: =C320-F320 -> 215000 | H320: 84 | I320: 1