B1: Season 91/92 to date | C1: =C299+C293+C282+C271+C268+C255+C240+C226+C214+C207+C193+C185+C173+C162+C138+C127+C118+C107+C95+C83+C74++C46+C62 -> 212687500 | F1: =SUM(F299+F293+F282+F271+F268+F255+F240+F226+F214+F207+F193+F185+F173+F162+F138+F127+F118+F107+F95+F83+F74+F62++F46+F26) -> 223845000 | G1: =C1-F1 -> -11157500 | H1: =SUM(G8:G299) -> 28042500 | I1: =G1-H1 -> -39200000
B2: Season 03/04 to date | C2: =C185+C173+C162+C138+C127+C118+C107+C95+C83+C74+C62+C46+C26 -> 202765000 | F2: =F185+F173+F162+F138+F127+F118+F107+F95+F83+F74+F62+F46+F26 -> 191000000 | G2: =C2-F2 -> 11765000 | H2: =SUM(G8:G185) -> 11765000 | I2: =G2-H2 -> 0
B3: Last five seasons | C3: =C83+C74+C62+C46+C26 -> 179100000 | F3: =F83+F74+F62+F46+F26 -> 142850000 | G3: =C3-F3 -> 36250000 | H3: =SUM(G8:G83) -> 36250000 | I3: =G3-H3 -> 0
B4: Championship 04/05 | C4: =C173+C162+C138+C127+C118+C108+C107+C95+C83+C74+C62+C46+C26 -> 196740000 | F4: =SUM(F173+F162+F138+F127+F118+F107+F95+F83+F74+F62+F46+F26) -> 183750000 | G4: =C4-F4 -> 12990000 | H4: =SUM(G8:G173) -> 12990000 | I4: =G4-H4 -> 0
B6: Southampton
B7: Combined Totals | C7: =C299+C293+C282+C271+C268+C255+C240+C226+C214+C207+C193+C185+C173+C162+C138+C127+C118+C107+C95+C83+C74+C62+C46+C26 -> 251887500 | F7: =F299+F293+F282+F271+F268+F255+F240+F226+F207+F193+F185+F173+F162+F138+F127+F118+F107+F95+F83+F74+F62+F46+F26 -> 223835000 | G7: =SUM(G63:G299) -> 14292500 | H7: =SUM(H63:H300) -> 948
B8: Players Purchased | C8: Fee | E8: Players Sold | F8: Fee | G8: Net Total | H8: Points | I8: Position
B9: Season 15/16
B10: Cédric Soares | C10: 4700000 | E10: Artur Boruc | F10: Free
B11: Juanmi | C11: 5000000 | E11: Nathaniel Clyne | F11: 12500000
B12: Cuco Martina | C12: 1000000 | E12: Jos Hooiveld | F12: Released
B13: Jordy Clasie | C13: 8000000 | E13: Omar Rowe | F13: Released
B14: Oriol Romeu | C14: 5000000 | E14: Jake Sinclair | F14: Released
B15: Virgil van Dijk | C15: 11500000 | E15: Cody Cropper | F15: Released
B16: Charlie Austin | C16: 4000000 | E16: Dani Osvaldo | F16: Released
E17: Morgan Schneiderlin | F17: 24000000
E18: Emmanuel Mayuka | F18: Undisclosed
H25: PTS | I25: POS
C26: =SUM(C10:C19) -> 39200000 | F26: =SUM(F10:F25) -> 36500000 | G26: =C26-F26 -> 2700000
B27: Season 14/15
B28: Duan Tadić | C28: 10900000 | E28: Tom Leggett | F28: Free
B29: Graziano Pellè | C29: 9000000 | E29: Isaac Nehemie | F29: Free
B30: Fraser Forster | C30: 10000000 | E30: Andy Robinson | F30: Free
B31: Shane Long | C31: 12000000 | E31: Rickie Lambert | F31: 4000000
B32: Sadio Mané | C32: 10000000 | E32: Danny Fox | F32: Free
B33: Florin Gardos | C33: 6000000 | E33: Luke Shaw | F33: 27000000
B34: Saphir Taider | C34: Swap | E34: Guly do Prado | F34: Released
B35: Ryan Bertrand | C35: 10000000 | E35: Lee Barnard | F35: Released
E36: Jonathan Forte | F36: Released
E37: Adam Lallana | F37: 25000000
E38: Dejan Lovren | F38: 20000000
E39: Calum Chambers | F39: 16000000
E40: Billy Sharp | F40: 600000
E41: Matt Young | F41: Released
E42: Jonathan Forte | F42: Released
E43: Dani Osvaldo | F43: Swap
E44: Jack Cork | F44: 3000000
H45: PTS | I45: POS
C46: =SUM(C28:C38) -> 67900000 | F46: =SUM(F28:F40) -> 92600000 | G46: =C46-F46 -> -24700000 | H46: 60 | I46: 7
B47: Season 13/14
B48: Dejan Lovren | C48: 10000000 | E48: Sam Hoskins | F48: Free
B49: Victor Wanyama | C49: 12500000 | E49: Alberto Seidi. | F49: Released
B50: Pablo Daniel Osvaldo | C50: 15000000 | E50: Ben Reeves, | F50: Released
E51: Dan Seabourne, | F51: Released
E52: Danny Butterfield, | F52: Released
E53: Frazer Richardson, | F53: Released
E54: Ryan Dickson, | F54: Released
E55: Tommy Forecast, | F55: Released
E56: Richard Chaplow | F56: Released
E57: Vegard Forren | F57: Undisclosed
E58: Dean Hammond | F58: Undisclosed
E59: Steve De Ridder | F59: Signed | H59: Prem
E60: Jason Puncheon | F60: 1750000
E61: Jay Fulton | F61: 200000 | H61: PTS | I61: POS
B62: Total | C62: =SUM(C48:C60) -> 37500000 | F62: =SUM(F48:F60) -> 1750000 | G62: =C62-F62 -> 35750000 | H62: 56 | I62: 8
B63: Season 12/13
B64: Jay Rodriguez | C64: 6500000 | E64: Harlee Dean | F64: Free
B65: Steve Davis | C65: Free | E65: Bartosz Bialkowski | F65: Free
B66: Nathaniel Clyne | C66: 2500000 | E66: Ryan Doble | F66: Free
B67: Paulo Gazzaniga | C67: 2500000 | E67: Daniel Harding | F67: Undisclosed
B68: Emmanuel Mayuka | C68: 3000000 | E68: David Connolly | F68: Released
B69: Gaston Ramirez | C69: 12000000 | E69: Radhi Jaidi | F69: Released
B70: Maya Yoshida | C70: 2000000 | E70: Lee Holmes | F70: Free
B71: Vegard Forren | C71: 4200000
H73: PTS | I73: POS
B74: Total | C74: =SUM(C64:C71) -> 32700000 | F74: =SUM(F63:F68) -> 0 | G74: =C74-F74 -> 32700000 | H74: 41 | I74: 14
B75: Season 2011/12
B76: Jack Cork | C76: Signed | E76: Kayne McLaggon | F76: Free
B77: Steve De Ridder | C77: Signed | E77: Anthony Pulis | F77: Free
B78: Daniel Fox | C78: Signed | E78: Alex Oxlade-Chamberlain | F78: 12000000
B79: Jos Hooiveld | C79: Signed | E79: Joseph Mills | F79: Signed
B80: Tadanari Lee | C80: Free | E80: Callum McNish | F80: Free
B81: Billy Sharp | C81: 1800000 | E81: Oscar Gobern | F81: Free | H81: PTS | I81: POS
B82: Artur Boruc | C82: Free
B83: Total | C83: =SUM(C76:C82) -> 1800000 | F83: =SUM(F76:F81) -> 12000000 | G83: =C83-F83 -> -10200000 | H83: 88 | I83: 2
B84: Season 2010/11
B85: Danny Butterfield | C85: Free | E85: Simon Gillett | F85: Free
B86: Jonathan Forte | C86: Signed | E86: Lloyd James | F86: Free
B87: Richard Chaplow | C87: Signed | E87: Garyn Preen | F87: Free
B88: Jack Stephens | C88: 150000 | E88: Michael Poke | F88: Free
B89: Ryan Dickson | C89: 200000 | E89: Jon Otsemobor | F89: Free
B90: Frazer Richardson | C90: Signed | E90: Wayne Thomas | F90: Free
B91: Guly Do Prado | C91: Undisclosed | E91: Paul Wotton | F91: Free
E92: Richard Chaplow | F92: Signed
E93: Jake Thomson | F93: Free | H93: PTS | I93: POS
B95: Total | C95: =SUM(C85:C93) -> 350000 | F95: =SUM(F85:F93) -> 0 | G95: =C95-F95 -> 350000 | H95: - | I95: -
B96: Season 2009/10
B97: Daniel Harding | C97: Free | E97: David McGoldrick | F97: 1000000
B98: Rickie Lambert | C98: 1000000 | E98: Nathan Dyer | F98: 400000
B99: Dean Hammond | C99: Signed | E99: Andrew Surman | F99: 1200000
B100: Radhi Jaidi | C100: Free | E100: Bradley Wright-Phillips | F100: Free
B101: Jose Fonte | C101: 800000 | E101: Jason Euell | F101: Free
B102: Danny Seaborne | C102: Free | E102: Stern John | F102: Free
B103: Jon Otsemobor | C103: Free | E103: Grzegorz Rasiak | F103: Signed
B104: Lee Barnard | C104: Signed | E104: Matthew Paterson | F104: Signed
B105: Jason Puncheon | C105: Signed | H105: PTS | I105: POS
B106: Aaron Martin | C106: Signed
B107: Total | C107: =SUM(C97:C106) -> 1800000 | F107: =SUM(F97:F105) -> 2600000 | G107: =C107-F107 -> -800000 | H107: - | I107: -
B108: Season 2008/9
B109: Tommy Forecast | C109: Signed | E109: Youssef Safri | F109: Free
B110: Anthony Pulis | C110: Free | E110: Jermaine Wright | F110: Free
B111: Lee Molyneux | C111: Free | E111: Andrew Davies | F111: Signed
B112: Ryan Smith | C112: Free | E112: Darren Powell | F112: Free
B113: Lee Holmes | C113: Free
B114: Chris Perry | C114: Free
B115: Paul Wotton | C115: Free
B116: Morgan Schneiderlin | C116: 1200000 | H116: PTS | I116: POS
B117: Aaron Martin | C117: Undisclosed
B118: Total | C118: =SUM(C109:C117) -> 1200000 | F118: =SUM(F109:F116) -> 0 | G118: =C118-F118 -> 1200000 | H118: 45 | I118: 23
B119: Season 2007/08
B120: Youssef Safri | C120: Signed | E120: Chris Baird | F120: 3025000
B121: Wayne Thomas | C121: 1000000 | E121: Pele | F121: Signed
B122: Jason Euell | C122: Free | E122: David Prutton | F122: Free
B123: Stern John | C123: Signed | E123: Kenwyne Jones | F123: 6000000
B124: Andrew Davies | C124: 1000000 | E124: Gareth Bale | F124: 5000000
B125: Marek Saganowski | C125: Signed | E125: Martin Cranie | F125: Free
E126: Leon Best | F126: 650000 | H126: PTS | I126: POS
B127: Total | C127: =SUM(C120:C126) -> 2000000 | F127: =SUM(F120:F126) -> 14675000 | G127: =C127-F127 -> -12675000 | H127: 54 | I127: 20
B128: Season 2006/07
B129: Bradley Wright-Phillips | C129: Nominal | E129: Paul Smith | F129: 500000
B130: Jermaine Wright | C130: Free | E130: Yoann Folly | F130: Signed
B131: Pele | C131: Signed | E131: Matt Oakley | F131: Free
B132: Kelvin Davis | C132: 2000000 | E132: Danny Higginbotham | F132: 225000
B133: Rudi Skacel | C133: 1600000 | E133: Dexter Blackstock | F133: Signed
B134: Jhon Viafara | C134: Signed | E134: Ricardo Fuller | F134: 500000
B135: Chris Makin | C135: Free | E135: Kyle Critchell | F135: Free
B136: Inigo Idiakez | C136: 250000 | E136: Darren Kenton | F136: Free
B137: Grzegorz Rasiak | C137: 2000000 | E137: Jelle van Damme | F137: Signed | H137: PTS | I137: POS
B138: Total | C138: =SUM(C129:C137) -> 5850000 | F138: =SUM(F129:F137) -> 1225000 | G138: =C138-F138 -> 4625000 | H138: 75 | I138: 6
B139: Season 2005/06
B140: Dennis Wise | C140: Free | E140: Jo Tessem | F140: Signed
B141: Darren Powell | C141: Free | E141: Anders Svensson | F141: Free
B142: Ricardo Fuller | C142: 90000 | E142: Kevin Phillips | F142: 1000000
B143: Tomasz Hajto | C143: Free | E143: Alledine Yahia | F143: Signed
B144: Djamel Belmadi | C144: Free | E144: Jason Dodd | F144: Free
B145: Bartosz Bialkowski | C145: Nominal | E145: Peter Crouch | F145: 7000000
B146: Jim Brennan | C146: Free | E146: Paul Telfer | F146: 200000
B147: Alexander Ostlund | C147: Signed | E147: Mikael Nilsson | F147: Signed
E148: Olivier Bernard | F148: Signed
E149: Fabrice Fernandes | F149: Free
E150: Alan Blayney | F150: 50000
E151: Antti Niemi | F151: Signed
E152: Neil McCann | F152: Free
E153: Dennis Wise | F153: Free
E154: Theo Walcott | F154: 5000000
E155: Brett Ormerod | F155: Free
E156: Tomasz Hajto | F156: Free
E157: Nigel Quashie | F157: 1200000
E158: Rory Delap | F158: Free
E159: Matthew Mills | F159: 250000
E160: Andrew McNeil | F160: Signed
E161: Mike Williamson | F161: Free | H161: PTS | I161: POS
B162: Total | C162: =SUM(C140:C161) -> 90000 | F162: =SUM(F140:F161) -> 14700000 | G162: =C162-F162 -> -14610000 | H162: 58 | I162: 12
B163: Season 2004/05
B164: Peter Crouch | C164: 2000000 | E164: Stephen Hunt | F164: Free
B165: Mikael Nilsson | C165: 500000 | E165: Jamie Gleeson | F165: Free
B166: Alledine Yahia | C166: 350000 | E166: Stephen Crainey | F166: 200000
B167: Andreas Jakobsson | C167: 1000000 | E167: Fitz Hall | F167: 1500000
B168: Jamie Redknapp | C168: Free | E168: Arron Davies | F168: Free
B169: Nigel Quashie | C169: 2100000 | E169: Stuart Anderson | F169: Signed
B170: Olivier Bernard | C170: 400000 | E170: James Beattie | F170: 6000000
B171: Jelle van Damme | C171: Signed | E171: Agustin Delgado | F171: Free | H171: Prem
B172: Kenwyne Jones | C172: Nominal | H172: PTS | I172: POS
B173: Total | C173: =SUM(C164:C172) -> 6350000 | F173: =SUM(F164:F172) -> 7700000 | G173: =C173-F173 -> -1350000 | H173: 32 | I173: 20
B174: Season 2003/4
B175: Leandre Griffit | C175: Free | E175: Brian Howard | F175: Free
B176: Fitz Hall | C176: 250000 | E176: Wayne Bridge | F176: 7000000
B177: Graeme Le Saux | C177: Swap | E177: Kevin Davies | F177: Free
B178: Yoann Folly | C178: 250000 | E178: Paul Williams | F178: Free
B179: Neil McCann | C179: 1500000 | E179: Paul Jones | F179: 250000
B180: Kevin Phillips | C180: 3250000 | E180: Chris Marsden | F180: Free
B181: Paul Smith | C181: 500000 | E181: Gary Monk | F181: Free
B182: Stephen Crainey | C182: Signed | E182: Scott Bevan | F182: Signed
B183: Darren Kenton | C183: Free | E183: Michael Green | F183: Free | H183: Prem
B184: Dexter Blackstock | C184: 275000 | E184: Matt Crowell | F184: Free | H184: PTS | I184: POS
B185: Total | C185: =SUM(C175:C184) -> 6025000 | F185: =SUM(F175:F184) -> 7250000 | G185: =C185-F185 -> -1225000 | H185: 47 | I185: 12
B186: Season 2002/03
B187: Antti Niemi | C187: 2000000 | E187: Dani Rodrigues | F187: Free
B188: Marcus Hall | C188: Free | E188: Imants Bleidelis
B189: Andrei Kanchelskis | C189: Free | E189: Neil Moss | F189: Free
B190: Danny Higginbotham | C190: 1500000 | E190: Andrei Kanchelskis | F190: Free
B191: David Prutton | C191: 2500000 | H191: Prem
B192: Michael Svensson | C192: 2000000 | H192: PTS | I192: POS
B193: Total | C193: =SUM(C187:C192) -> 8000000 | F193: =SUM(F187:F192) -> 0 | G193: =C193-F193 -> 8000000 | H193: 52 | I193: 8
B194: Season 2001/02
B195: Rory Delap | C195: 4000000 | E195: Hassan Kachloul | F195: Free
B196: Jacinta Ela Eyene | C196: Free | E196: John Beresford | F196: Free
B197: Paul Murray | C197: Free | E197: Paul Hughes | F197: Free
B198: Paul Williams | C198: Free | E198: Dean Richards | F198: 8100000
B199: Paul Telfer | C199: Free | E199: Paul Murray | F199: Free
B200: Agustin Delgado | C200: 3500000 | E200: Mark Peters | F200: Free
B201: Cleber Chala | C201: 1000000 | E201: Adrian Caceres | F201: Free
B202: Mike Williamson | C202: 100000 | E202: Adam Wallace | F202: Free
B203: Brett Ormerod | C203: 1750000 | E203: Ryan Ashford | F203: Free
B204: Fabrice Fernandes | C204: 1100000 | E204: Kevin Gibbens | F204: Free
B205: Anders Svensson | C205: 500000 | E205: Phil Warner | F205: Free | H205: Prem
E206: Luis Boa Morte | F206: 1700000 | H206: PTS | I206: POS
B207: Total | C207: =SUM(C195:C206) -> 11950000 | F207: =SUM(F195:F206) -> 9800000 | G207: =C207-F207 -> 2150000 | H207: 45 | I207: 11
B208: Season 2000/01
B209: Uwe Rosler | C209: Free | E209: Shayne Bradley | F209: Signed
B210: Mark Draper | C210: 1250000 | E210: Danny Webb | F210: 10000
B211: Adrian Caceres | C211: 25000 | E211: Richard Dryden | F211: Free
B212: Jonathon Mills | C212: Signed | E212: Matthew Davies | F212: Free | H212: Prem
B213: Dan Petrescu | C213: Nominal | E213: Trond-Egil Soltvedt | F213: Nominal | H213: PTS | I213: POS
B214: Total | C214: =SUM(C209:C213) -> 1275000 | F214: =SUM(F209:F213) -> 10000 | G214: =C214-F214 -> 1265000 | H214: 52 | I214: 10
B215: Season 1999/00
B216: Bruno Leal | C216: Free | E216: Stephen Jenkins | F216: Free
B217: Dean Richards | C217: Free | E217: Steve Basham | F217: Nominal
B218: Trond-Egil Soltvedt | C218: 300000 | E218: Michael Stensgaard | F218: Free
B219: Kevin Davies | C219: 1200000 | E219: Ken Monkou | F219: Free
B220: Luis Boa Morte | C220: 500000 | E220: Egil Ostenstad | F220: Swap
B221: Jo Tessem | C221: 600000 | E221: Andrew Williams | F221: 65000
B222: Imants Bleidelis | C222: 600000 | E222: Scott Marshall | F222: 250000
B223: Taher El Khalej | C223: 350000 | E223: Scott Hiley | F223: 200000
B224: Paul Hughes | C224: Free | E224: Chris Collins | H224: Prem
E225: Mark Hughes | F225: Free | H225: PTS | I225: POS
B226: Total | C226: =SUM(C216:C225) -> 3550000 | F226: =SUM(F216:F225) -> 515000 | G226: =C226-F226 -> 3035000 | H226: 44 | I226: 15
B227: Season 1998/99
B228: Scott Hiley | C228: Free | E228: Kevin Richardson | F228: Signed
B229: Hassan Kachloul | C229: 250000 | E229: Lee Todd | F229: 250000
B230: Michael Stensgaard | C230: Free | E230: Stig Johansen (mer) | F230: 250000
B231: Patrick Colleter | C231: 100000 | E231: Carlton Palmer | F231: 1100000
B232: Chris Marsden | C232: 800000 | E232: Cosimo Sarli | F232: Signed
B233: Marian Pahars | C233: 800000 | E233: Kevin Davies | F233: 7500000
B234: Dani Rodrigues | C234: 170000 | E234: Duncan Spedding | F234: Signed
B235: David Howells | C235: Free
B236: Stuart Ripley | C236: 1500000
B237: Mark Paul | C237: Unknown
B238: James Beattie | C238: 1000000 | H238: Prem
B239: Mark Hughes | C239: 650000 | H239: PTS | I239: POS
B240: Total | C240: =SUM(C228:C239) -> 5270000 | F240: =SUM(F228:F239) -> 9100000 | G240: =C240-F240 -> -3830000 | H240: 41 | I240: 17
B241: Season 1997/98
B242: Stig Johansen (mer) | C242: 600000 | E242: Andrew Sullivan | F242: Free
B243: Kevin Richardson | C243: Transfer | E243: Ulrich van Gobbel | F243: 800000
B244: Carlton Palmer | C244: 1000000 | E244: Jim Magilton | F244: 1600000
B245: David Hirst | C245: 2000000 | E245: Chris Warren | F245: 50000
B246: Bjorn Johansen | C246: 200000 | E246: Micky Evans | F246: 750000
B247: John Beresford | C247: 1500000 | E247: Neil Maddison | F247: 250000
B248: Kevin Davies | C248: 750000 | E248: Dave Beasant | F248: Free
B249: Paul Jones | C249: 900000 | E249: Maik Taylor | F249: 700000
B250: Lee Todd | C250: 850000 | E250: Alan Neilson | F250: 250000
E251: Simon Charlton | F251: 200000
E252: David Piper | F252: Signed
E253: Matt Robinson | F253: 50000 | H253: Prem
E254: Robbie Slater | F254: Signed | H254: PTS | I254: POS
B255: Total | C255: =SUM(C242:C254) -> 7800000 | F255: =SUM(F242:F254) -> 4650000 | G255: =C255-F255 -> 3150000 | H255: 48 | I255: 12
B256: Season 1996/97
B257: Richard Dryden | C257: 150000 | E257: Bruce Grobbelaar | F257: Free
B258: Russell Watkinson | C258: Free | E258: Neil Shipperley | F258: 1000000
B259: Claus Lundekvam | C259: 400000 | E259: Neil Heaney | F259: 500000
B260: Robbie Slater | C260: 250000 | E260: Frankie Bennett | F260: 15000
B261: Egil Ostenstad | C261: 800000 | E261: Sam Stockley | F261: Free
B262: Ulrich van Gobbel | C262: 1300000 | E262: Gordon Watson | F262: 550000
B263: Maik Taylor | C263: 500000 | E263: Graham Potter | F263: 300000
B264: Micky Evans | C264: 750000 | E264: Nathan Blamey | F264: Free
B265: Gary Monk | C265: Signed | E265: Richard Hall | F265: 1400000
B266: Graham Potter | C266: 250000 | E266: Mark Walters | F266: Free | H266: Prem
H267: PTS | I267: POS
B268: Total | C268: =SUM(C257:C267) -> 4400000 | F268: =SUM(F257:F267) -> 3765000 | G268: =C268-F268 -> 635000 | H268: 41 | I268: 16
B269: Season 1995/96 | H269: Prem
B270: Alan Neilson | C270: 750000 | E270: John Hooks | F270: Trainee | H270: PTS | I270: POS
B271: Total | C271: =SUM(C269:C270) -> 750000 | F271: =SUM(F270) -> 0 | G271: =C271-F271 -> 750000 | H271: 38 | I271: 17
B272: Season 1994/95
B273: Peter Whiston | C273: 30000 | E273: Colin Cramb | F273: Signed
B274: Bruce Grobbelaar | C274: Free | E274: Ian Andrews | F274: 20000
B275: Ronnie Ekelund | C275: 500000 | E275: Matt Bound | F275: 100000
B276: Neil Shipperley | C276: 1250000 | E276: Nicky Banger | F276: 250000
B277: Gordon Watson | C277: 1200000 | E277: Rory Hamill | F277: Free
B278: Chris Warren | C278: 40000 | E278: Iain Dowie | F278: 400000
E279: Jeff Kenna | F279: 1500000
E280: Steve Wood | F280: Free | H280: Prem
E281: Kevin Moore | F281: Free | H281: PTS | I281: POS
B282: Total | C282: =SUM(C273:C281) -> 3020000 | F282: =SUM(F273:F281) -> 2270000 | G282: =C282-F282 -> 750000 | H282: 54 | I282: 10
B283: Season 1993/94
B284: Paul Allen | C284: 500000 | E284: Tim Flowers | F284: 2400000
B285: Peter Reid | C285: Free | E285: Glenn Cockerill | F285: Free
B286: Dave Beasant | C286: 300000 | E286: Peter Reid | F286: Free
B287: Craig Maskell | C287: 250000 | E287: Paul Moody | F287: 60000
B288: Jim Magilton | C288: 600000 | E288: Martin Thomas | F288: Free
B289: Neil Heaney | C289: 300000 | E289: Micky Adams | F289: Free
B290: Simon Charlton | C290: 250000
B291: Paul McDonald | C291: 75000 | H291: Prem
B292: Colin Cramb | C292: Transfer | H292: PTS | I292: POS
B293: Total | C293: =SUM(C284:C292) -> 2275000 | F293: =SUM(F284:F292) -> 2460000 | G293: =C293-F293 -> -185000 | H293: 43 | I293: 18
B294: Season 1992/93
B295: Ken Monkou | C295: 750000 | E295: David Lee | F295: 275000
B296: Paul Sheerin | C296: Signed | E296: Kerry Dixon | F296: Free
B297: Frankie Bennett | C297: 7500 | H297: Prem
B298: Derek Allan | C298: 75000 | H298: PTS | I298: POS
B299: Total | C299: =SUM(C295:C298) -> 832500 | F299: =SUM(F295:F298) -> 275000 | G299: =C299-F299 -> 557500 | H299: 50 | I299: 18