B1: Season 91/92 to date | C1: =C19 -> 1132899000 | F1: =F19 -> 484125000 | G1: =C1-F1 -> 648774000 | H1: =SUM(G20:G326) -> 648774000 | I1: =G1-H1 -> 0
B2: Season 03/04 to date | C2: =C208+C188+C173+C157+C148+C139+C128+C119+C108+C96+C86+C62+C38 -> 995959000 | F2: =F208+F188+F173+F157+F148+F139+F128+F119+F108+F96+F86+F62+F38 -> 415650000 | G2: =C2-F2 -> 580309000 | H2: =SUM(G20:G208) -> 580309000 | I2: =G2-H2 -> 0
B3: Championship 04/05 | C3: =C188+C173+C157+C148+C139+C128+C119+C108+C96+C86+C62+C38 -> 842509000 | F3: =F188+F173+F157+F148+F139+F128+F119+F108+F96+F86+F62+F38 -> 415550000 | G3: =C3-F3 -> 426959000 | H3: =SUM(G20:G188) -> 426959000 | I3: =G3-H3 -> 0
B4: Last five seasons | C4: =C108+C96+C86+C62+C38 -> 475959000 | F4: =F108+F96+F86+F62+F38 -> 277250000 | G4: =C4-F4 -> 198709000 | H4: =SUM(G20:G108) -> 198709000 | I4: =G4-H4 -> 0
I5: =G5-H5 -> 0
B6: Before Abramovich Buyout | C6: =C216+C227+C241+C256+C263+C275+C285+C297+C303+C311+C325 -> 136940000 | F6: =F216+F227+F241+F256+F263+F275+F285+F297+F303+F311+F325 -> 68475000 | G6: =C6-F6 -> 68465000 | H6: =SUM(G216:G325) -> 68465000 | I6: =G6-H6 -> 0
B7: After Abramovich Buyout | C7: =C208+C188+C173+C157+C148+C139+C128+C119+C108+C96+C86+C62+C38 -> 995959000 | F7: =F208+F188+F173+F157+F148+F139+F128+F119+F108+F96+F86+F62+F38 -> 415650000 | G7: =C7-F7 -> 580309000 | H7: =SUM(G20:G208) -> 580309000 | I7: =G7-H7 -> 0
B8: Claudio Raineri 4 | C8: =SUM(C241+C227+C216+C208) -> 195650000 | F8: =SUM(F241+F227+F216+F208) -> 37020000 | G8: =C8-F8 -> 158630000 | H8: =SUM(G208:G241) -> 158630000 | I8: =G8-H8 -> 0
B9: Jose Mourinho 3 | C9: =C188+C173+C157 -> 183750000 | F9: =SUM(F188+F173+F157) -> 52300000 | G9: =C9-F9 -> 131450000 | H9: =SUM(G157:G188) -> 131450000 | I9: =G9-H9 -> 0
B10: Avram Grant 1 | C10: =C148 -> 40500000 | F10: =F148 -> 33000000 | G10: =C10-F10 -> 7500000 | H10: =G148 -> 7500000 | I10: =G10-H10 -> 0
B11: Philip Scolari 1 | C11: =C139 -> 24200000 | F11: =F139 -> 35000000 | G11: =C11-F11 -> -10800000 | H11: =G139 -> -10800000 | I11: =G11-H11 -> 0
B12: Carlos Ancelotti 2 | C12: =SUM(C128+C119) -> 118100000 | F12: =F128+F119 -> 18000000 | G12: =C12-F12 -> 100100000 | H12: =G119+G128 -> 100100000 | I12: =G12-H12 -> 0
B13: Andre Villas Boas | C13: =C108 -> 87800000 | F13: =F108 -> 24600000 | G13: =C13-F13 -> 63200000 | H13: =SUM(G108) -> 63200000 | I13: =G13-H13 -> 0
B14: Roberto Di Matteo | C14: =C96 -> 92000000 | F14: =F96 -> 20000000 | G14: =C14-F14 -> 72000000 | H14: =G96 -> 72000000 | I14: =G14-H14 -> 0
B15: Jose Mourinho 2013 on | C15: =C86+C62+C38 -> 296159000 | F15: =F86+C62+F38 -> 237750000 | G15: =C15-F15 -> 58409000 | H15: =G86 -> 49309000 | I15: =G15-H15 -> 9100000
B16: Gus Hiddink | C16: =C32+C33+C34+C35+C36+C37 -> #VALUE! | F16: =F32+F33+F34+F35+F36+F37 -> 25000000
B18: Chelsea
B19: Combined Totals | C19: =C325+C311+C303+C297+C285+C275+C263+C256+C241+C227+C216+C208+C188+C173+C157+C148+C139+C128+C119+C108+C96+C86+C62+C38 -> 1132899000 | F19: =F325+F311+F303+F297+F285+F275+F263+F256+F241+F227+F216+F208+F188+F173+F157+F148+F139+F128+F119+F108+F96+F86+F62+F38 -> 484125000 | G19: =SUM(G20:G326) -> 648774000 | H19: =SUM(H20:H326) -> 1646
B20: Players Purchased | C20: Fee | E20: Players Sold | F20: Fee | G20: Net Total | H20: points | I20: Position
B21: Season 15/16
B22: Nathan | C22: 4500000 | E22: Gaël Kakuta | F22: 5200000
B23: Asmir Begović | C23: 8000000 | E23: Petr Čech | F23: 10000000
B24: Baba Rahman | C24: 17600000 | E24: Didier Drogba | F24: Released
B25: Pedro | C25: 21400000 | E25: Josh McEachran | F25: 750000
B26: Kenedy | C26: 6300000 | E26: Filipe Luís | F26: 11100000
B27: Papy Djilobodji | C27: 4000000 | E27: Oriol Romeu | F27: 5000000
B28: Michael Hector | C28: 5400000 | E28: Thorgan Hazard | F28: 5800000
B29: Danilo Pantic | C29: 1250000
B30: Marco Amelia | C30: Free
B31: Manager Change | E31: Manager Change
B32: Hubert Adamczyk | C32: Free | E32: Ulises Dávila | F32: 0
B33: Matt Miazga | C33: 3500000 | E33: Ramires | F33: 25000000
H37: PTS | I37: POS
C38: =SUM(C22:C37) -> 71950000 | F38: =SUM(F22:F37) -> 62850000 | G38: =C38-F38 -> 9100000
B39: Season 14/15
B40: Cesc Fàbregas | C40: 30000000 | E40: David Luiz | F40: 40000000
B41: Diego Costa | C41: 32000000 | E41: Samuel Eto | F41: Released
B42: Mario Pašalić | C42: 3000000 | E42: Ashley Cole | F42: Released
B43: Filipe Luís | C43: 15800000 | E43: Frank Lampard | F43: Released
B44: Didier Drogba | C44: Free | E44: Mark Schwartzer | F44: Released
B45: Loïc Rémy | C45: 10500000 | E45: Henrique Hilario | F45: Released
B46: Juan Cuadrado | C46: 27000000 | E46: Sam Hutchinson | F46: Released
E47: Demba Ba | F47: 4700000
E48: Patrick van Aanholt | F48: 1500000
E49: Romelu Lukaku | F49: 28000000
E50: George Saville | F50: 1000000
E51: George Cole | F51: Released
E52: Daniel pappoe | F52: Released
E53: Billy Clifford | F53: Released
E54: Milan Lallkovic | F54: Released
E55: Adam Nditi | F55: Released
E56: John Pirez | F56: Released
E57: Mark Schwarzer | F57: Free
E58: Fernando Torres | F58: Free
E59: Ryan Bertrand | F59: 10000000
E60: André Schürrle | F60: 22000000
E61: Thorgan Hazzard | F61: 6000000 | H61: PTS | I61: POS
C62: =SUM(C40:C60) -> 118300000 | F62: =SUM(F40:F61) -> 113200000 | G62: =C62-F62 -> 5100000 | H62: 87 | I62: 1
B63: Season 13/14
B64: Andre Schurrle | C64: 18000000 | E64: Adam Phillip | F64: Released
B65: Marco van Ginkel | C65: 8000000 | E65: Amine Aflane | F65: Released
B66: Mark Schwarzer | C66: Free | E66: Archange Nkumu | F66: Released
B67: Cristian Cuevas | C67: 1700000 | E67: Aziz Deen-Conteh | F67: Released
B68: Samuel Eto'o | C68: Free | E68: Ben Gordon | F68: Released
B69: Willian | C69: 30000000 | E69: Benayoun | F69: Released
B70: Christian Atsu | C70: 3500000 | E70: Conor Clifford | F70: Released
B71: Isaiah Brown | C71: 209000 | E71: Florent Malouda | F71: Released
B72: Stipe Perica | C72: Undisclosed | E72: Hilario | F72: Released
B73: Bertrand Traore | C73: Free | E73: James Ashton | F73: Released
B74: Nemanja Matic | C74: 21000000 | E74: Nortei | F74: Released
B75: Mohamed Salah | C75: 11000000 | E75: Paulo Ferreira | F75: Released
B76: Kurt Zouma | C76: 12500000 | E76: Rohan Ince | F76: Released
E77: Ross Turnbull. | F77: Released
E78: Samuel Bangura | F78: Released
E79: Tom Howard | F79: Released | H79: Prem
E80: Yossi | F80: Released
E81: Jeffrey Bruma | F81: 2500000 | H81: PTS | I81: POS
E82: Kevin De Bruyne | F82: 17000000
E83: Juan Mata | F83: 37100000
E84: Sam Walker | F84: Undisclosed
E85: Michael Essien | F85: Free
B86: Total | C86: =SUM(C64:C81) -> 105909000 | F86: =SUM(F64:F83) -> 56600000 | G86: =C86-F86 -> 49309000 | H86: 82 | I86: 3
B87: Season 12/13
B88: Marko Marin | C88: 6500000 | E88: Jacob Mellis | F88: Free
B89: Eden Hazard | C89: 32000000 | E89: Didier Drogba | F89: Free
B90: Thorgan Hazard | C90: Undisclosed | E90: Salomon Kalou | F90: Free
B91: Júnior Oscar Dos Santos Emboaba | C91: 25000000 | E91: Jose Bosingwa | F91: Free
B92: César Azpilicueta | C92: 7000000 | E92: Rhys Taylor | F92: Free
B93: Victor Moses | C93: 9000000 | E93: Daniel Sturridge | F93: 12000000
B94: Demba Ba | C94: 7500000 | E94: Raul Meireles | F94: 8000000 | H94: Prem
B95: Wallace | C95: 5000000 | H95: PTS | I95: POS
B96: Total | C96: =SUM(C88:C95) -> 92000000 | F96: =SUM(F88:F95) -> 20000000 | G96: =C96-F96 -> 72000000 | H96: 75 | I96: 3
B97: Season 11/12
B98: Thibaut Courtois | C98: 6000000 | E98: Gokhan Tore | F98: 1000000
B99: Oriol Romeu | C99: 4350000 | E99: Jacopo Sala | F99: Undisclosed
B100: Romelu Lukaku | C100: 20000000 | E100: Michael Mancienne | F100: 3000000
B101: Ulises Dávila Plascencia | C101: 1750000 | E101: Jack Cork | F101: 1200000
B102: Juan Mata | C102: 23500000 | E102: Danny Philliskirk | F102: Free
B103: Raul Meireles | C103: 12000000 | E103: Yuri Zhirkov | F103: 13200000
B104: Gary Cahil | C104: 7000000 | E104: Slobodan Rajkovic | F104: 2000000
B105: Kevin De Bruyne | C105: 6700000 | E105: Philipp Prosenik | F105: undisclosed
B106: Patrick Bamford | C106: 1500000 | E106: Alex | F106: 4200000 | H106: Prem
B107: Lucas | C107: 5000000 | E107: Nemanja Matic | F107: Undisclosed | H107: PTS | I107: POS
B108: Total | C108: =SUM(C98:C107) -> 87800000 | F108: =SUM(F98:F107) -> 24600000 | G108: =C108-F108 -> 63200000 | H108: 64 | I108: 6
B109: Season 10/11
B110: Yossi Benayoun | C110: 5000000 | E110: Michael Ballack | F110: Released
B111: Ramires | C111: 18300000 | E111: Juliano Belletti | F111: Released
B112: Fernando Torres | C112: 50000000 | E112: Joe Cole | F112: Released
B113: David Luiz | C113: 21300000 | E113: Seth Ofori-Twumasi | F113: Free
B114: Matej Delac | C114: Free | E114: Miroslav Stoch | F114: 2500000
E115: Deco | F115: Free
E116: Scott Sinclair | F116: 500000
E117: Ricardo Carvalho | F117: 7000000 | H117: Prem
E118: Franco Di Santo | F118: 2000000 | H118: PTS | I118: POS
B119: Total | C119: =SUM(C109:C113) -> 94600000 | F119: =SUM(F110:F118) -> 12000000 | G119: =C119-F119 -> 82600000 | H119: 71 | I119: 2
B120: Season 09/10
B121: Daniel Sturridge | C121: 4000000 | E121: Ben Sahar | F121: 1000000
B122: Ross Turnbull | C122: Free | E122: Jimmy Smith | F122: Free
B123: Yuri Zhirkov | C123: 18000000 | E123: Frank Nouble | F123: Undisclsoed
B124: Nemanja Matic | C124: 1500000 | E124: Sergio Tejera | F124: Undisclsoed
E125: Claudio Pizarro | F125: 5000000
E126: Andrei Shevchenko | F126: Free | H126: Prem
E127: Tom Taiwo | F127: Undisclosed | H127: PTS | I127: POS
B128: Total | C128: =SUM(C121:C125) -> 23500000 | F128: =SUM(F121:F127) -> 6000000 | G128: =C128-F128 -> 17500000 | H128: 86 | I128: 1
B129: Season 08/09
B130: Deco | C130: 8000000 | E130: Steven Sidwell | F130: 5000000
B131: Carlos De Silva Minerio | C131: Free | E131: Claude Makelele | F131: Free
B132: Carlo Quaresma | C132: Loan | E132: Tal Ben-Haim | F132: 5000000
B133: Jose Bosingwa | C133: 16200000 | E133: Andrei Shevchenko | F133: Signed
E134: Shaun Wright Phillips | F134: 9000000
E135: Khalid Boulahrouz | F135: 4000000
E136: Hernan Crespo | F136: Free[2]
E137: Wayne Bridge | F137: 12000000 | H137: Prem
E138: Carlo Cudicini | F138: Free | H138: PTS | I138: POS
B139: Total | C139: =SUM(C130:C138) -> 24200000 | F139: =SUM(F130:F137) -> 35000000 | G139: =C139-F139 -> -10800000 | H139: 83 | I139: 3
B141: Season 07/08
B142: Franco Di Santo | C142: 3000000 | E142: Lassana Diarra | F142: 4000000
B143: Branislav Ivanovic | C143: 9000000 | E143: Glen Johnson | F143: 4000000
B144: Nicolas Anelka | C144: 15000000 | E144: Arjen Robben | F144: 25000000
B145: Juliano Belletti | C145: Signed
B146: Florent Malouda | C146: 13500000 | H146: Prem
H147: PTS | I147: POS
B148: Total | C148: =SUM(C142:C147) -> 40500000 | F148: =SUM(F142:F147) -> 33000000 | G148: =C148-F148 -> 7500000 | H148: 85 | I148: 2
B150: Season 06/07
B151: Claudio Pizarro | C151: Free | E151: Robert Huth | F151: 6000000
B152: Steven Sidwell | C152: Free | E152: William Gallas | F152: Swap
B153: Ashley Cole | C153: 5000000 | E153: Asier Del Horno | F153: 4800000
B154: Khalid Boulahrouz | C154: 7000000 | E154: Damien Duff | F154: 5000000
B155: Henrique Hilario | C155: Free | E155: Carlton Cole | F155: 3000000 | H155: Prem
E156: Geremi | F156: Free | H156: PTS | I156: POS
B157: Total | C157: =SUM(C151:C155) -> 12000000 | F157: =SUM(F151:F155) -> 18800000 | G157: =C157-F157 -> -6800000 | H157: 83 | I157: 2
B159: Season 05/06
B160: John Obi Mikel | C160: 16000000 | E160: Danny Hollands | F160: Free
B161: Ben Sahar | C161: 3200000 | E161: Filipe Morais | F161: Free
B162: Andrei Shevchenko | C162: 30000000 | E162: Jiri Jarosik | F162: Signed
B163: Salomon Kalou | C163: 8000000 | E163: Dean Smith | F163: Free
B164: Michael Ballack | C164: Free | E164: Eidur Gudjohnsen | F164: 8000000
B165: Michael Essien | C165: 24400000 | E165: Leonard Pidgeley | F165: Free
B166: Shaun Wright-Phillips | C166: 21000000 | E166: Dean Furman | F166: Free
B167: Lassana Diarra | C167: 1000000 | E167: Alexei Smertin | F167: 1000000
B168: Scott Sinclair | C168: 300000 | E168: Steven Watt | F168: Free
B169: Asier Del Horno | C169: 8000000 | E169: Tiago | F169: 6500000
E170: Sam Tillen | F170: Free
E171: Mateja Kezman | F171: 5300000 | H171: Prem
E172: Juan Veron | F172: Signed | H172: PTS | I172: POS
B173: Total | C173: =SUM(C160:C172) -> 111900000 | F173: =SUM(F160:F172) -> 20800000 | G173: =C173-F173 -> 91100000 | H173: 91 | I173: 1
B175: Season 04/05
B176: Jiri Jarosik | C176: 3000000 | E176: Scott Parker | F176: 6500000
B177: Ricardo Carvalho | C177: 19850000 | E177: Mikael Forssell | F177: 3000000
B178: Didier Drogba | C178: 24000000 | E178: Craig Rocastle | F178: Free
B179: Tiago | C179: 8000000 | E179: Adrian Mutu | F179: Free
B180: Mateja Kezman | C180: 5000000 | E180: Marco Ambrosio | F180: Free
E181: Celestine Babayaro | F181: 1000000
E182: Alexis Nicolas | F182: Free
E183: Neil Sullivan | F183: Free
E184: Boudewijn Zenden | F184: Free
E185: Jesper Gronkjaer | F185: 2200000
E186: Mario Melchiot | F186: Free | H186: Prem
E187: Jimmy-Floyd Hasselbaink | F187: Free | H187: PTS | I187: POS
B188: Total | C188: =SUM(C176:C187) -> 59850000 | F188: =SUM(F176:F187) -> 12700000 | G188: =C188-F188 -> 47150000 | H188: 95 | I188: 1
B190: Season 03/04
B191: Paulo Ferreira | C191: 13200000 | E191: Leon Knight | F191: 100000
B192: Arjen Robben | C192: 12000000 | E192: Ed de Goey | F192: Free
B193: Peter Cech | C193: 7000000 | E193: Jean-Yves Anis | F193: Free
B194: Scott Parker | C194: 10000000 | E194: Graeme Le Saux | F194: Swap
B195: Neil Sullivan | C195: Free | E195: Rhys Evans | F195: Free
B196: Claude Makelele | C196: 16600000 | E196: Jody Morris | F196: Free
B197: Hernan Crespo | C197: 16800000 | E197: Gianfranco Zola | F197: Free
B198: Alexei Smertin | C198: 3450000 | E198: Enrique De Lucas | F198: Free
B199: Adrian Mutu | C199: 15800000 | E199: Rob Wolleaston | F199: Free
B200: Joe Cole | C200: 6600000 | E200: Andy Ross | F200: Free
B201: Juan Veron | C201: 15000000
B202: Wayne Bridge | C202: 7000000
B203: Damien Duff | C203: 17000000
B204: Geremi | C204: 7000000
B205: Glen Johnson | C205: 6000000
B206: Craig Rocastle | C206: Signed | H206: Prem
B207: Yves Makaba-Makalamby | C207: Free | H207: PTS | I207: POS
B208: Total | C208: =SUM(C191:C207) -> 153450000 | F208: =SUM(F191:F207) -> 100000 | G208: =C208-F208 -> 153350000 | H208: 79 | I208: 2
B210: Season 02/03
B211: Jurgen Macho | C211: Free | E211: Warren Cummings | F211: Free
B212: Marco Ambrosio | C212: Free | E212: Ian Pulman | F212: Free
B213: Filipe Oliveira | C213: 500000 | E213: Pat Baldwin | F213: Free
B214: Enrique De Lucas | C214: Free | E214: Sam Parkin | F214: Signed | H214: Prem
E215: Samuele Dalla Bona | F215: 1000000 | H215: PTS | I215: POS
B216: Total | C216: =SUM(C211:C215) -> 500000 | F216: =SUM(F211:F215) -> 1000000 | G216: =C216-F216 -> -500000 | H216: 67 | I216: 4
B218: Season 01/02
B219: Boudewijn Zenden | C219: 7500000 | E219: Ryan Stevenson | F219: Free
B220: Emmanuel Petit | C220: 7500000 | E220: Jon Harley | F220: 3500000
E221: Frank Leboeuf | F221: 1200000
E222: Stuart Reddington | F222: 20000
E223: Bernard Lambourde | F223: 300000
E224: Jay Richardson | F224: Free
E225: Neil Barrett | F225: Free | H225: Prem
E226: Dennis Wise | F226: 1600000 | H226: PTS | I226: POS
B227: Total | C227: =SUM(C219:C226) -> 15000000 | F227: =SUM(F219:F226) -> 6620000 | G227: =C227-F227 -> 8380000 | H227: 64 | I227: 6
B229: Season 00/01
B230: Frank Lampard | C230: 11000000 | E230: Courtney Pitt | F230: Free
B231: William Gallas | C231: 6200000 | E231: Gustavo Poyet | F231: Signed
B232: Mark Bosnich | C232: Free | E232: Stephen Broad | F232: Free
B233: Jesper Gronkjaer | C233: 7800000 | E233: Tore-Andre Flo | F233: 14000000
B234: Slavisa Jokanovic | C234: 1700000 | E234: Luca Percassi | F234: Signed
B235: Winston Bogarde | C235: Free | E235: Emerson Thome | F235: 4500000
B236: Carlo Cudicini | C236: Signed | E236: Nick Crittenden | F236: Free
E237: Dan Petrescu | F237: 1000000
E238: Didier Deschamps | F238: 3700000
E239: Chris Sutton | F239: 6000000 | H239: Prem
E240: Neil Clement | F240: 100000 | H240: PTS | I240: POS
B241: Total | C241: =SUM(C230:C240) -> 26700000 | F241: =SUM(F230:F240) -> 29300000 | G241: =C241-F241 -> -2600000 | H241: 61 | I241: 6
B243: Season 99/00
B244: Sebastien Kneissl | C244: Free | E244: Paul Hughes | F244: Free
B245: Mario Stanic | C245: 5600000 | E245: Joe Sheerin | F245: Free
B246: Eidur Gudjohnsen | C246: 5000000 | E246: Bjarne Goldbaek | F246: 650000
B247: Jimmy-Floyd Hasselbaink | C247: 15000000 | E247: Steve Hampshire | F247: Signed
B248: Rati Aleksidze | C248: Signed | E248: Michael Duberry | F248: 4500000
B249: Emerson Thome | C249: 2700000 | E249: Andy Myers | F249: 800000
B250: Stuart Reddington | C250: Unknown | E250: Eddie Newton | F250: Free
B251: Gabriele Ambrosetti | C251: 3500000 | E251: Dmitri Kharin | F251: Free
B252: Jes Hogh | C252: 300000 | E252: Brian Laudrup | F252: 2000000
B253: Chris Sutton | C253: 10000000
B254: Didier Deschamps | C254: 3000000 | H254: Prem
B255: Mario Melchiot | C255: Free | H255: PTS | I255: POS
B256: Total | C256: =SUM(C244:C255) -> 45100000 | F256: =SUM(F244:F255) -> 7950000 | G256: =C256-F256 -> 37150000 | H256: 65 | I256: 5
B258: Season 98/99
B259: Bjarne Goldbaek | C259: 330000 | E259: David Lee | F259: Free
B260: Samuele Dalla Bona | C260: Unknown | E260: Brian Laudrup | F260: Unknown
B261: Luca Percassi | C261: Signed | E261: Frank Sinclair | F261: 2000000 | H261: Prem
B262: Mikael Forssell | C262: Free | H262: PTS | I262: POS
B263: Total | C263: =SUM(C259:C262) -> 330000 | F263: =SUM(F259:F262) -> 2000000 | G263: =C263-F263 -> -1670000 | H263: 75 | I263: 3
B265: Season 97/98
B266: Albert Ferrer | C266: 2200000 | E266: Mark Hughes | F266: 650000
B267: Brian Laudrup | C267: Free | E267: Mark Stein | F267: Free
B268: Pierluigi Casiraghi | C268: 5400000 | E268: Nick Colgan | F268: Free
B269: Graeme Le Saux | C269: 7000000 | E269: Danny Granville | F269: 1600000
B270: Tore-Andre Flo | C270: 300000 | E270: Joe Dolan | F270: Free
E271: Frode Grodas | F271: 250000
E272: Danny Potter | F272: Free
E273: Jimmy Aggrey | F273: Free | H273: Prem
E274: Craig Burley | F274: 2500000 | H274: PTS | I274: POS
B275: Total | C275: =SUM(C266:C274) -> 14900000 | F275: =SUM(F266:F274) -> 5000000 | G275: =C275-F275 -> 9900000 | H275: 63 | I275: 4
B277: Season 96/97
B278: Gustavo Poyet | C278: Free | E278: Scott Minto | F278: Free
B279: Bernard Lambourde | C279: 1500000 | E279: Terry Phelan | F279: 850000
B280: Ed de Goey | C280: 2250000 | E280: Gavin Peacock | F280: 800000
B281: Celestine Babayaro | C281: 2250000 | E281: John Spencer | F281: 2500000
B282: Danny Granville | C282: 300000 | E282: Russell Kelly | F282: Free
B283: Gianfranco Zola | C283: 4500000 | E283: Anthony Barness | F283: 165000 | H283: Prem
B284: Frode Grodas | C284: Free | H284: PTS | I284: POS
B285: Total | C285: =SUM(C278:C284) -> 10800000 | F285: =SUM(F278:F284) -> 4315000 | G285: =C285-F285 -> 6485000 | H285: 59 | I285: 6
B287: Season 95/96
B288: Frank Leboeuf | C288: 2500000 | E288: Paul Furlong | F288: 1500000
B289: Roberto Di Matteo | C289: 4900000 | E289: Ritchie Hanlon | F289: Free
B290: Gianluca Vialli | C290: Free | E290: Muzzy Izzet | F290: 650000
B291: Dan Petrescu | C291: 2300000 | E291: Zeke Rowe | F291: Free
E292: Junior Mendes
E293: Terry Skiverton | F293: Free
E294: Darren Barnard | F294: 750000
E295: Robert Fleck | F295: 650000 | H295: Prem
E296: Andy Dow | F296: 125000 | H296: PTS | I296: POS
B297: Total | C297: =SUM(C288:C295) -> 9700000 | F297: =SUM(F288:F296) -> 3675000 | G297: =C297-F297 -> 6025000 | H297: 50 | I297: 11
B299: Season 94/95
B300: Mark Hughes | C300: 1500000 | E300: David Hopkin | F300: 850000
B301: Ruud Gullit | C301: Free | E301: Neil Shipperley | F301: 1250000 | H301: Prem
B302: David Rocastle | C302: 1250000 | H302: PTS | I302: POS
B303: Total | C303: =SUM(C300:C302) -> 2750000 | F303: =SUM(F300:F302) -> 2100000 | G303: =C303-F303 -> 650000 | H303: 54 | I303: 11
B305: Season 93/94
B306: Scott Minto | C306: 775000 | E306: Damian Matthew | F306: 150000
B307: Paul Furlong | C307: 2300000 | E307: Dave Beasant | F307: 300000
B308: Mark Stein | C308: 1500000 | E308: Steve Livingstone | F308: 140000
B309: Gavin Peacock | C309: 1250000 | E309: Ian Pearce | F309: 300000 | H309: Prem
B310: Jakob Kjeldberg | C310: 400000 | E310: Graham Stuart | F310: 850000 | H310: PTS | I310: POS
B311: Total | C311: =SUM(C306:C310) -> 6225000 | F311: =SUM(F306:F310) -> 1740000 | G311: =C311-F311 -> 4485000 | H311: 51 | I311: 14
B313: Season 92/93
B314: Andy Dow | C314: 250000 | E314: Andy Townsend | F314: 2100000
B315: Steve Livingstone | C315: 350000 | E315: Graeme Le Saux | F315: 700000
B316: Dmitri Kharin | C316: 200000 | E316: Mick Harford | F316: 250000
B317: David Hopkin | C317: 300000 | E317: Joe Allon | F317: 275000
B318: Nigel Spackman | C318: 485000 | E318: Vinny Jones | F318: 700000
B319: Anthony Barness | C319: 350000 | E319: Ken Monkou | F319: 750000
B320: Mick Harford | C320: 300000
B321: Robert Fleck | C321: 2100000
B322: John Spencer | C322: 450000
B323: Nick Colgan | C323: Signed | H323: Prem
B324: Mai Donaghy | C324: 150000 | H324: PTS | I324: POS
B325: Season Total | C325: =SUM(C314:C324) -> 4935000 | F325: =SUM(F314:F323) -> 4775000 | G325: =C325-F325 -> 160000 | H325: 56 | I325: 11