B1: Season 91/92 to date | C1: =C20 -> 546565000 | F1: =F20 -> 405174000 | G1: =C1-F1 -> 141391000 | H1: =G20 -> 141391000 | I1: =G1-H1 -> 0
B2: Season 03/04 to date | C2: =C217+C201+C184+C166+C147+C137+C130+C123+C113+C100+C86+C57+C39 -> 405675000 | F2: =F217+F201+F184+F166+F147+F137+F130+F123+F113+F100+F86+F57+F39 -> 309770000 | G2: =C2-F2 -> 95905000 | H2: =SUM(G21:G217) -> 95905000 | I2: =G2-H2 -> 0
B3: Championship | C3: =C201+C184+C166+C147+C137+C130+C123+C113+C100+C86+C57+C39 -> 385175000 | F3: =F201+F184+F166+F147+F137+F130+F123+F113+F100+F86+F57+F39 -> 305920000 | G3: =C3-F3 -> 79255000 | H3: =SUM(G21:G201) -> 79255000 | I3: =G3-H3 -> 0
B4: Last Five Years | C4: =C113+C100+C86+C57+C39 -> 258625000 | F4: =F113+F100+F86+F57+F30 -> 154600000 | G4: =C4-F4 -> 104025000 | H4: =SUM(G39:G113) -> 102225000 | I4: =G4-H4 -> 1800000
B5: Highbury | C5: =SUM(C338+C331+C324+C317+C310+C294+C283+C272+C256+C243+C234+C217+C201+C184) -> 202790000 | F5: =SUM(F338+F331+F324+F317+F310+F294+F283+F272+F256+F243+F234+F217+F201+F184) -> 132274000 | G5: =C5-F5 -> 70516000 | H5: =SUM(G184:G338) -> 70516000 | I5: =G5-H5 -> 0
B6: Emirates (06/07) | C6: =C166+C147+C137+C130+C123+C113+C100+C86+C57+C39 -> 343775000 | F6: =F166+F147+F137+F130+F123+F113+F100+F86+F57+F39 -> 272900000 | G6: =C6-F6 -> 70875000 | H6: =SUM(G21:G166) -> 70875000 | I6: =G6-H6 -> 0
B7: Arsen Wenger 16 | C7: =SUM(C310+C294+C283+C272+C256+C243+C234+C217+C201+C184+C166+C147+C137+C130+C123+C113+C100+C86+C57+C39) -> 520225000 | F7: =SUM(F310+F294+F283+F272+F256+F243+F234+F217+F201+F184+F166+F147+F137+F130+F123+F113+F100+F86+F57+F39) -> 396224000 | G7: =C7-F7 -> 124001000 | H7: =SUM(G22:G310) -> 124001000 | I7: =G7-H7 -> 0
B8: Bruce Rioch | C8: =C317 -> 12250000 | F8: =F317 -> 1750000 | G8: =C8-F8 -> 10500000 | H8: =G317 -> 10500000 | I8: =G8-H8 -> 0
B9: George Graham | C9: =C324+C331+C338 -> 14090000 | F9: =F324+F331+F338 -> 7200000 | G9: =C9-F9 -> 6890000 | H9: =SUM(G324:G338) -> 6890000 | I9: =G9-H9 -> 0
B11: points tables 20 to 12/13
B12: total per season | C12: =H20 -> 1601
B13: season 03/04(10) | C13: =H217+H201+H184+H166+H147+H137+H130+H123+H113+H100 -> 749
B14: last five years(6) | C14: =H137+H130+H123+H113+H100 -> 358
B15: championship04/05 (9) | C15: =H201+H184+H166+H147+H137+H130+H123+H113+H100+H86 -> 738
B16: season in championship | C16: 0
B17: season in premiership | C17: 21
B19: Arsenal
B20: Combined Totals | C20: =SUM(C338+C331+C324+C317+C310+C294+C283+C272+C256+C243+C234+C217+C201+C184+C166+C147+C137+C130+C123+C113+C100+C86+C57+C39) -> 546565000 | F20: =F338+F331+F324+F317+F310+F294+F283+F272+F256+F243+F234+F217+F201+F184+F166+F147+F137+F130+F123+F113+F100+F86+F57+F39 -> 405174000 | G20: =SUM(G22:G338) -> 141391000 | H20: =SUM(H58:H338) -> 1601
B21: Players Purchased | C21: Fee | E21: Players Sold | F21: Fee | G21: Net Total | H21: PTS | I21: POS
B22: Season 15/16
B23: Petr Čech | C23: 10000000 | E23: Ryo Miyaichi | F23: Free
B24: Mohamed Elneny | C24: 5000000 | E24: Abou Diaby | F24: Released
E25: Semi Ajayi | F25: Free
E26: Lukas Podolski | F26: 1800000
E27: Josh Vickers | F27: Free
E28: George Dobson | F28: Free
H38: PTS | I38: POS
C39: =SUM(C23:C32) -> 15000000 | F39: =SUM(F23:F37) -> 1800000 | G39: =C39-F39 -> 13200000
B40: Season 14/15
B41: Mathieu Debuchy | C41: 12000000 | E41: Łukasz Fabiański | F41: Free
B42: Alexis Sánchez | C42: 35000000 | E42: Zak Ansah | F42: Free
B43: David Ospina | C43: 3000000 | E43: Bacary Sagna | F43: Free
B44: Calum Chambers | C44: 16000000 | E44: Nicklas Bendtner | F44: Released
B45: Danny Welbeck | C45: 16000000 | E45: Park Chu Young | F45: Released
B46: Elias Chatzitheodoridis | C46: Signed | E46: Chuks Aneke | F46: Released
B47: Hugo Keto | C47: Signed | E47: Daniel Boateng | F47: Released
B48: Ben Sheaf | C48: Signed | E48: Carlos Vela | F48: 8800000
B49: Krystian Bielik | C49: 2400000 | E49: Thomas Eisfeld | F49: 400000
B50: Gabriel Paulista | C50: 11200000 | E50: Thomas Vermaelen | F50: 15000000
E51: Ignasi Miquel | F51: 1500000
E52: Johan Djourou | F52: 2500000
E53: Zachari Fagan | F53: Undisclosed
E54: Leander Siemann | F54: Released
E55: Benik Afobe | F55: 2000000
H56: PTS | I56: POS
C57: =SUM(C41:C50) -> 95600000 | F57: =SUM(F41:F55) -> 30200000 | G57: =C57-F57 -> 65400000 | H57: 75 | I57: 3
B58: Season 13/14
B59: Yaya Sanogo | C59: Free | E59: Jordan Wynter | F59: Free
B60: Mathieu Flamini | C60: Free | E60: Elton Monteiro | F60: Free
B61: Mesut Ozil | C61: 42500000 | E61: Craig Eastmond | F61: Free
E62: Martin Angha | F62: Free
E63: Kyle Ebecilio | F63: Free
E64: Sanchez Watt | F64: Released
E65: Denilson | F65: Released
E66: Andrei Arshavin | F66: Released
E67: Conor Henderson | F67: Released
E68: Daniel Boateng | F68: Released
E69: James Shea | F69: Released
E70: Jernade Meade | F70: Released
E71: Josh Rees | F71: Released
E72: Nigel Neita | F72: Released
E73: Philip Roberts | F73: Released
E74: Reice Charles-Cox | F74: Released
E75: Samir Bihmoutinel | F75: Released
E76: Sead Harjovic | F76: Released
E77: Sebastian Squillaci | F77: Released
E78: Zach Fagan | F78: Released
E79: Vito Mannone | F79: 2000000
E80: André Santos | F80: Free
E81: Marouane Chamakh | F81: Signed
E82: Gervinho | F82: 8000000
E83: Anthony Jeffrey | F83: Free
E84: Nicholas Yennaris | F84: Undisclosed | H84: Prem
E85: Emmanuel Frimpong | F85: Undisclosed | H85: PTS | I85: POS
C86: =SUM(C59:C78) -> 42500000 | F86: =SUM(F59:F85) -> 10000000 | G86: =C86-F86 -> 32500000 | H86: 79 | I86: 4
B87: Season 12/13
B88: Lukas Podolski | C88: 11000000 | E88: Tom Cruise | F88: Free
B89: Olivier Giroud | C89: 13000000 | E89: Jeffrey Monakana | F89: Free
B90: Santi Cazorla | C90: 20000000 | E90: Oğuzhan Özyakup | F90: 500000
B91: Nacho Monreal | C91: 8300000 | E91: Pedro Botelho | F91: Nominal
B92: Dejan Iliev | C92: Undisclosed | E92: Carlos Vela | F92: 4200000
E93: Robin Van Persie | F93: 22000000
E94: Kyle Bartley | F94: 1000000
E95: Alex Song | F95: 15000000
E96: Henri Lansbury | F96: 1000000
E97: Rhys Murphy | F97: Free
E98: Gavin Hoyte | F98: Free | H98: Prem
E99: Manuel Almunia | F99: Free | H99: PTS | I99: POS
C100: =SUM(C87:C91) -> 52300000 | F100: =SUM(F89:F96) -> 43700000 | G100: =C100-F100 -> 8600000 | H100: 73 | I100: 4
B101: Season 11/12
B102: Carl Jenkinson | C102: Free | E102: Gaël Clichy | F102: 7000000
B103: Gervinho | C103: 10600000 | E103: Mark Randall | F103: Free
B104: Alex Oxlade-Chamberlain | C104: 12000000 | E104: Jay E-Thomas | F104: 1500000
B105: Joel Campbell | C105: 950000 | E105: Cesc Fábregas | F105: 35000000
B106: Park Chu-Young | C106: 3000000 | E106: Emmanuel Eboué | F106: 4000000
B107: André Santos | C107: 6200000 | E107: Jamie Edge | F107: Free
B108: Mikel Arteta | C108: 10000000 | E108: Samir Nasri | F108: 22000000
B109: Per Mertesacker | C109: 10000000 | E109: Armand Traore | F109: 1200000
B110: Thomas Eisfeld | C110: 475000 | E110: Gilles Sunu | F110: Free
E111: Luke Freeman | F111: Undisclosed | H111: Prem
H112: PTS | I112: POS
B113: Total | C113: =SUM(C102:C112) -> 53225000 | F113: =SUM(F102:F112) -> 70700000 | G113: =C113-F113 -> -17475000 | H113: 70 | I113: 3
B114: Season 10/11
B115: Marouane Chamakh | C115: Free | E115: Fran Merida | F115: Free
B116: Kyle Ebecillo | C116: 500000 | E116: Philippe Senderos | F116: Free
B117: Laurent Koscielny | C117: 10000000 | E117: Luke Ayling | F117: Free
B118: Sebastien Squillaci | C118: 4000000 | E118: Eduardo | F118: 6000000
B119: Ryo Miyaichi | C119: Undisclosed | E119: Sol Campbell | F119: Signed
E120: Jay Simpson | F120: 1200000
E121: Havard Nordtveit | F121: 500000 | H121: Prem
E122: Nacer Barazite | F122: Free | H122: PTS | I122: POS
B123: Total | C123: =SUM(C115:C120) -> 14500000 | F123: =SUM(F115:F121) -> 7700000 | G123: =C123-F123 -> 6800000 | H123: 68 | I123: 4
B124: Season 09/10
B125: Thomas Vermaelen | C125: 10000000 | E125: Abu Ogogo | F125: Free
B126: Samuel Galindo | C126: Undisclosed | E126: Emmanuel Adebayor | F126: 25000000
B127: Sol Campbell | C127: Free | E127: Kolo Toure | F127: 16000000
E128: James Dunne | F128: Signed | H128: Prem
E129: Rene Steer | F129: Signed | H129: PTS | I129: POS
B130: Total | C130: =SUM(C125:C129) -> 10000000 | F130: =SUM(F125:F129) -> 41000000 | G130: =C130-F130 -> -31000000 | H130: 75 | I130: 3
B131: Season 08/09
B132: Amaury Bischoff | C132: Undisclosed | E132: Mathieu Flamini | F132: Free
B133: Mikael Sylvestre | C133: 750000 | E133: Alexander Hleb | F133: 11800000
B134: Andrei Arshavin | C134: 15000000 | E134: Gilberto Silva | F134: 1000000
E135: Justin Hoyte | F135: 3000000 | H135: Prem
E136: Lassana Diarra | F136: 3500000 | G136: Sell on fee | H136: PTS | I136: POS
B137: Total | C137: =SUM(C132:C135) -> 15750000 | F137: =SUM(F132:F136) -> 19300000 | G137: =C137-F137 -> -3550000 | H137: 72 | I137: 4
B139: Season 07/08
B140: Samir Nasri | C140: 15800000 | E140: Jens Lehmann | F140: Free
B141: Aaron Ramsey | C141: 5000000 | E141: Lassana Diarra | F141: 5500000
B142: Luke Freeman | C142: 200000 | E142: Matthew Connolly | F142: 1000000
B143: Lassana Diarra | C143: 4000000 | E143: Joe O'Cearuill | F143: Free
B144: Bakari Sagna | C144: 6000000 | E144: Ryan Garry | F144: Free
E145: Jose Reyes | F145: 8100000 | H145: Prem
E146: Fredrik Ljungberg | F146: 3000000 | H146: PTS | I146: POS
B147: Total | C147: =SUM(C140:C146) -> 31000000 | F147: =SUM(F140:F146) -> 17600000 | G147: =C147-F147 -> 13400000 | H147: 83 | I147: 3
B149: Season 06/07
B150: Eduardo | C150: 7500000 | E150: Peggy Lokando | F150: Free
B151: Nacer Barazite | C151: Signed | E151: Arturo Lupoli | F151: Free
B152: Lukasz Fabianski | C152: 2000000 | E152: Thierry Henry | F152: 16100000
B153: Denilson | C153: 3400000 | E153: Jeremie Aliadiere | F153: 2000000
B154: William Gallas | C154: Swap | E154: Mart Poom | F154: Signed
B155: Alexandre Song Billong | C155: 1000000 | E155: Fabrice Muamba | F155: 2000000
B156: Fran Merida Perez | C156: Free | E156: Sebastian Larsson | F156: 1000000
B157: Joe O'Cearuill | C157: Free | E157: Bisan Lauren | F157: 500000
E158: Anthony Stokes | F158: 2000000
E159: Ashley Cole | F159: 5000000
E160: Pascal Cygan | F160: 2000000
E161: Sol Campbell | F161: Free
E162: Ryan Smith | F162: 300000
E163: Graham Stack | F163: Signed
E164: Michael Jordan | F164: Free | H164: Prem
B165: (*Moved to Emirates) | H165: PTS | I165: POS
B166: Total | C166: =SUM(C150:C164) -> 13900000 | F166: =SUM(F150:F164) -> 30900000 | G166: =C166-F166 -> -17000000 | H166: 68 | I166: 4
B168: Season 05/06
B169: Tomas Rosicky | C169: 6800000 | E169: Robert Pires | F169: Free
B170: Mart Poom | C170: Signed | E170: Mark Howard | F170: Free
B171: Theo Walcott | C171: 9100000 | E171: Quincy Owusu-Abeyie | F171: 1500000
B172: Emmanuel Adebayor | C172: 7000000 | E172: David Bentley | F172: 10000000
B173: Vassiriki Diaby | C173: 2000000 | E173: Patrick Cregg | F173: Free
B174: Aleksandr Hleb | C174: 11200000 | E174: Frankie Simek | F174: Free
B175: Armand Traore | C175: 250000 | E175: Sebastian Svard | F175: Free
B176: Vito Mannone | C176: 350000 | E176: Patrick Vieira | F176: 13700000
B177: Nicklas Bendtner | C177: 200000 | E177: Jermaine Pennant | F177: 4670000
E178: Stephen O'Donnell | F178: Free
E179: Daniel Karbassiyoon | F179: Free
E180: Stuart Taylor | F180: 250000
E181: Dean McDonald | F181: Free
E182: Adam Birchall | F182: Free | H182: Prem
E183: Olafur Ingi Skulason | F183: Free | H183: PTS | I183: POS
B184: Total | C184: =SUM(C169:C183) -> 36900000 | F184: =SUM(F169:F183) -> 30120000 | G184: =C184-F184 -> 6780000 | H184: 67 | I184: 4
B186: Season 04/05
B187: Emmanuel Eboue | C187: 1000000 | E187: Chris Wright | F187: Free
B188: Mathieu Flamini | C188: 1000000 | E188: Edu | F188: Free
B189: Manuel Almunia | C189: 2500000 | E189: Dominic Shimmin | F189: 300000
E190: Matthew Hislop | F190: Free
E191: Rami Shaaban | F191: Free
E192: John Spicer | F192: Signed
E193: Tomas Danilevicius | F193: Signed
E194: Stephen Bradley
E195: Sylvain Wiltord | F195: Free
E196: Francis Jeffers | F196: 2600000
E197: Igor Stepanovs | F197: Signed
E198: Nwankwo Kanu | F198: Free
E199: Ray Parlour | F199: Free | H199: Prem
E200: Martin Keown | F200: Free | H200: PTS | I200: POS
B201: Total | C201: =SUM(C187:C200) -> 4500000 | F201: =SUM(F187:F200) -> 2900000 | G201: =C201-F201 -> 1600000 | H201: 83 | I201: 2
B203: Season 03/04
B204: Arturo Lupoli | C204: Signed | E204: Dean Shiels | F204: Free
B205: Robin Van Persie | C205: 2750000 | E205: Giovanni Van Bronckhorst | F205: 3000000
B206: Jose Reyes | C206: 13000000 | E206: Alex Bailey | F206: Free
B207: Gael Clichy | C207: 250000 | E207: Efstathios Tavlaridis | F207: 250000
B208: Johan Djourou | C208: 0 | E208: Craig Holloway | F208: Free
B209: Jens Lehmann | C209: 2000000 | E209: Ashley Probets | F209: Free
B210: Philippe Senderos | C210: 2500000 | E210: Liam Chilvers | F210: Free
B211: Cesc Fabregas | C211: Free | E211: Nicky Nicolau | F211: Free
E212: Jerome Thomas | F212: 100000
E213: Moritz Volz | F213: 500000
E214: John Halls | F214: Nominal
E215: Guillaume Warmuz | F215: Free | H215: Prem
E216: Oleg Luzhny | F216: Free | H216: PTS | I216: POS
B217: Total | C217: =SUM(C204:C216) -> 20500000 | F217: =SUM(F204:F216) -> 3850000 | G217: =C217-F217 -> 16650000 | H217: 90 | I217: 1
B219: Season 02/03
B220: Guillaume Warmuz | C220: Signed | E220: David Seaman | F220: Free
B221: Rami Shaaban | C221: Signed | E221: Graham Barrett | F221: Free
B222: Gilberto Silva | C222: 4500000 | E222: Ben Chorley | F222: Free
B223: Pascal Cygan | C223: 2100000 | E223: Michael Gordon | F223: Free
E224: Carlin Itonga | F224: Free
E225: Matthew Rouse | F225: Signed
E226: David Noble | F226: Signed
E227: David Grondin | F227: Free
E228: Matthew Upson | F228: 1000000
E229: Steven Sidwell | F229: 250000
E230: Jo Kuffour | F230: Free
E231: Richard Wright | F231: 3500000
E232: Rohan Ricketts | F232: Free | H232: Prem
E233: Alex Manninger | F233: 960000 | H233: PTS | I233: POS
B234: Total | C234: =SUM(C220:C233) -> 6600000 | F234: =SUM(F220:F233) -> 5710000 | G234: =C234-F234 -> 890000 | H234: 78 | I234: 2
B236: Season 01/02
B237: Kolo Toure | C237: 150000 | E237: Greg Lincoln | F237: Signed
B238: Efstathios Tavlaridis | C238: 600000 | E238: Sylvinho | F238: 3500000
B239: Richard Wright | C239: 6000000 | E239: Guillaume Norbert | F239: Free
B240: Sol Campbell | C240: Free | E240: Guy Demel | F240: 194000 | H240: Prem
B241: Giovanni Van Bronckhorst | C241: 8500000 | E241: Stefan Malz | F241: 580000 | H241: PTS | I241: POS
E242: Nelson Vivas | F242: Free
B243: Total | C243: =SUM(C237:C241) -> 15250000 | F243: =SUM(F237:F241) -> 4274000 | G243: =C243-F243 -> 10976000 | H243: 87 | I243: 1
B245: Season 00/01
B246: Francis Jeffers | C246: 8000000 | E246: Nelson Vivas | F246: Free
B247: Juan | C247: Signed | E247: James Harper | F247: Signed
B248: Edu | C248: 6000000 | E248: Christopher Wreh | F248: Signed
B249: Tomas Danilevicius | C249: 1000000 | E249: Paolo Vernazza | F249: 350000
B250: Igor Stepanovs | C250: 1000000 | E250: Rhys Weston | F250: 300000
B251: Sylvain Wiltord | C251: 13000000 | E251: Brian McGovern | F251: 50000
B252: Guy Demel | C252: Free | E252: Emmanuel Petit | F252: 5000000
B253: Moritz Volz | C253: Signed | E253: Marc Overmars | F253: 25000000
B254: Sebastian Svard | C254: Nominal | E254: Jay Bothroyd | F254: 1000000 | H254: Prem
B255: Robert Pires | C255: 6000000 | H255: PTS | I255: POS
B256: Total | C256: =SUM(C246:C255) -> 35000000 | F256: =SUM(F246:F255) -> 31700000 | G256: =C256-F256 -> 3300000 | H256: 70 | I256: 2
B258: Season 99/00
B259: Lauren | C259: 7200000 | E259: Julian Gray | F259: 500000
B260: Niccolo Galli | C260: 0 | E260: Tommy Black | F260: 500000
B261: Thierry Henry | C261: 10500000 | E261: Davor Suker | F261: Free
B262: Davor Suker | C262: 500000 | E262: Nigel Winterburn | F262: Signed
B263: Sylvinho | C263: 4000000 | E263: Narada Bernard | F263: Free
B264: Stefan Malz | C264: 650000 | E264: Stephen Hughes | F264: 3000000
E265: Omer Riza | F265: Nominal
E266: Luis Boa Morte | F266: 500000
E267: Dave Livermore | F267: 30000
E268: Nicolas Anelka | F268: 23000000
E269: Michael Black | F269: Free
E270: Jason Crowe | F270: 1000000 | H270: Prem
E271: Steve Bould | F271: 500000 | H271: PTS | I271: POS
B272: Total | C272: =SUM(C259:C271) -> 22850000 | F272: =SUM(F259:F271) -> 29030000 | G272: =C272-F272 -> -6180000 | H272: 73 | I272: 2
B274: Season 98/99
B275: Oleg Luzhny | C275: 1800000 | E275: Kaba Diawara | F275: 3000000
B276: Kaba Diawara | C276: 2500000 | E276: William Huck | F276: 50000
B277: Nwankwo Kanu | C277: 4500000 | E277: Jamie Day | F277: 20000
B278: Jermaine Pennant | C278: 2000000 | E278: Isaiah Rankin | F278: 1300000
B279: William Huck | C279: Free | E279: Ian Wright | F279: 500000
B280: Eric Chukwunyelu Obinna | C280: Signed | H280: Prem
B281: Fredrik Ljungberg | C281: 3000000 | H281: PTS | I281: POS
B282: Nelson Vivas | C282: Free
B283: Total | C283: =SUM(C275:C281) -> 13800000 | F283: =SUM(F275:F281) -> 4870000 | G283: =C283-F283 -> 8930000 | H283: 78 | I283: 2
B285: Season 97/98
B286: David Grondin | C286: 500000 | E286: Richard Hughes | F286: Free
B287: Christopher Wreh | C287: 300000 | E287: Peter Clark | F287: Free
E288: Vince Bartram | F288: Signed
E289: Valur Gislason | F289: Unknown
E290: Jehad Muntasser | F290: Free
E291: Glenn Helder | F291: Nominal
E292: Ian Selley | F292: 500000 | H292: Prem
E293: Paul Shaw | F293: 250000 | H293: PTS | I293: POS
B294: Total | C294: =SUM(C286:C293) -> 800000 | F294: =SUM(F286:F293) -> 750000 | G294: =C294-F294 -> 50000 | H294: 78 | I294: 1
B296: Season 96/97
B297: Lee Canoville | C297: Signed | E297: Lee Harper | F297: 125000
B298: Marc Overmars | C298: 7000000 | E298: Paul Merson | F298: 4500000
B299: Alberto Mendez | C299: Unknown | E299: Matthew Rose | F299: 500000
B300: Luis Boa Morte | C300: 1750000 | E300: John Hartson | F300: 3300000
B301: Gilles Grimandi | C301: 2500000 | E301: Andy Linighan | F301: 110000
B302: Emmanuel Petit | C302: 2500000 | E302: Paul Read | F302: 35000
B303: Alex Manninger | C303: 500000 | E303: David Hillier | F303: 250000
B304: Matthew Upson | C304: 2000000 | E304: Eddie McGoldrick | F304: 300000
B305: Nicolas Anelka | C305: 500000 | E305: Paul Dickov | F305: 1000000
B306: Patrick Vieira | C306: 3500000 | E306: Roy O'Brien | F306: Signed
B307: Remi Garde | C307: Free | E307: Kevin Dennis | F307: Free
E308: Ben Smith | F308: Signed | H308: Prem
E309: Richard Goddard | F309: Free | H309: PTS | I309: POS
B310: Total | C310: =SUM(C297:C309) -> 20250000 | F310: =SUM(F297:F309) -> 10120000 | G310: =C310-F310 -> 10130000 | H310: 68 | I310: 3
B312: Season 95/96
B313: Valur Gislason | C313: 0 | E313: Stefan Schwarz | F313: 1750000 | H313: Prem
B314: John Lukic | C314: Free | H314: PTS | I314: POS
B315: David Platt | C315: 4750000
B316: Dennis Bergkamp | C316: 7500000
B317: Total | C317: =SUM(C313:C316) -> 12250000 | F317: =SUM(F313:F314) -> 1750000 | G317: =C317-F317 -> 10500000 | H317: 63 | I317: 5
B319: Season 94/95
B320: Glenn Helder | C320: 2300000 | E320: Jimmy Carter | F320: Free
B321: John Hartson | C321: 2500000 | E321: Kevin Campbell | F321: 2800000
B322: Chris Kiwomya | C322: 1500000 | E322: Alan Miller | F322: 500000 | H322: Prem
B323: Vince Bartram | C323: 40000 | H323: PTS | I323: POS
B324: Total | C324: =SUM(C320:C323) -> 6340000 | F324: =SUM(F320:F323) -> 3300000 | G324: =C324-F324 -> 3040000 | H324: 51 | I324: 12
B326: Season 93/94
B327: Lee Harper | C327: 150000 | E327: Ryan Kirby | F327: Free
B328: Stefan Schwarz | C328: 3500000 | E328: Anders Limpar | F328: 1600000
E329: Neil Heaney | F329: 300000 | H329: Prem
E330: Paul Harford | F330: Free | H330: PTS | I330: POS
B331: Total | C331: =SUM(C327:C330) -> 3650000 | F331: =SUM(F327:F330) -> 1900000 | G331: =C331-F331 -> 1750000 | H331: 71 | I331: 4
B333: Season 92/93
B334: Eddie McGoldrick | C334: 1000000 | E334: Nicky Rust | F334: Free
B335: Martin Keown | C335: 2000000 | E335: Jason Brissett | F335: Free
B336: John Jensen | C336: 1100000 | E336: Matt Joseph | F336: Free | H336: Prem
E337: David Rocastle | F337: 2000000 | H337: PTS | I337: POS
B338: Total | C338: =SUM(C334:C337) -> 4100000 | F338: =SUM(F334:F337) -> 2000000 | G338: =C338-F338 -> 2100000 | H338: 56 | I338: 10