H1: Check | I1: Balance
B2: Season 91/92 to date | C2: =C19 -> 327745000 | F2: =F19 -> 167080000 | G2: =C2-F2 -> 160665000 | H2: =SUM(G20:G351) -> 160665000 | I2: =G2-H2 -> 0
B3: Season 03/04 to date | C3: =C232+C205+C189+C176+C157+C141+C131+C116+C102+C90+C76+C61+C38 -> 256010000 | F3: =F232+F205+F189+F176+F157+F141+F131+F116+F102+F90+F76+F61+F38 -> 141500000 | G3: =C3-F3 -> 114510000 | H3: =SUM(G20:G232) -> 114510000 | I3: =G3-H3 -> 0
B4: last five seasons | C4: =C102+C90+C76+C61+C38 -> 121430000 | F4: =F102+F90+F76+F61+F38 -> 59550000 | G4: =C4-F4 -> 61880000 | H4: =SUM(G20:G102) -> 61880000 | I4: =G4-H4 -> 0
B5: Championship04/05 | C5: =C205+C189+C176+C157+C141+C131+C116+C102+C90+C76+C61+C38 -> 255560000 | F5: =F205+F189+F176+F157+F141+F131+F116+F102+F90+F76+F61+F38 -> 126250000 | G5: =C5-F5 -> 129310000 | H5: =SUM(G20:G205) -> 129310000 | I5: =G5-H5 -> 0
B6: Before Drumaville Buyout | C6: =SUM(C189+C205+C232+C242+C251+C266+C280+C286+C300+C315+C325+C334+C341+C350) -> 76615000 | F6: =SUM(F189+F205+F232+F242+F251+F266+F280+F286+F300+F315+F325+F334+F341+F350) -> 41805000 | G6: =C6-F6 -> 34810000 | H6: =SUM(G189:G351) -> 34810000 | I6: =G6-H6 -> 0
B7: After Drumaville Buyout | C7: =C176+C157+C141 -> 76500000 | F7: =F176+F157+F141 -> 10675000 | G7: =C7-F7 -> 65825000 | H7: =SUM(G141:G176) -> 65825000 | I7: =G7-H7 -> 0
B8: After Short Buyout | C8: =C131+C116+C102+C90+C76+C61+C38 -> 174630000 | F8: =F131+F116+F102+F90+F76+F61+F38 -> 114600000 | G8: =C8-F8 -> 60030000 | H8: =SUM(G20:G131) -> 60030000 | I8: =G8-H8 -> 0
B9: Mick Mc Carthy 3 | C9: =SUM(C232+C205+C189) -> 4880000 | F9: =SUM(F232+F205+F189) -> 16225000 | G9: =C9-F9 -> -11345000 | H9: =SUM(G189:G232) -> -11345000 | I9: =G9-H9 -> 0
B10: Roy Keane 3 | C10: =SUM(C176+C157+C141) -> 76500000 | F10: =SUM(F176+F157+F141) -> 10675000 | G10: =C10-F10 -> 65825000 | H10: =SUM(G141:G176) -> 65825000 | I10: =G10-H10 -> 0
B11: Steve Bruce | C11: =SUM(C131+C116+C102) -> 77250000 | F11: =SUM(F131+F116+F102) -> 73550000 | G11: =C11-F11 -> 3700000 | H11: =SUM(G102:G131) -> 3700000 | I11: =G11-H11 -> 0
B12: Martin O Neill | C12: =C90 -> 30000000 | F12: =F90 -> 11650000 | G12: =C12-F12 -> 18350000 | H12: =G90 -> 18350000 | I12: =G12-H12 -> 0
B13: Paolo Di Canio | C13: =C76-C74-C75 -> 21380000 | F13: =F76 -> 20000000 | G13: =C13-F13 -> 1380000 | H13: =SUM(G76-C75-C74) -> 1380000 | I13: =G13-H13 -> 0
B14: Gus Poyet | C14: =C74+C75+C61+C38 -> 46000000 | F14: =F61+F38 -> 9400000 | G14: =C14-F14 -> 36600000 | H14: =C74+C75+G61+G38 -> 36600000 | I14: =G14-H14 -> 0
B15: Dick Advocaat March 2015 to date | C15: =C38 -> 26000000 | F15: =F38 -> 7300000 | G15: =C15-F15 -> 18700000 | H15: =SUM(G20:G38) -> 18700000 | I15: =G15-H15 -> 0
B16: Sam Allerdyce | C16: =C29+C30+C31+C32+C33+C34+C35+C36++C37 -> #VALUE! | F16: =F30+F31+F32+F33+F34+F35+F36+F37 -> #VALUE! | G16: =C16-F16 -> #VALUE!
B18: Sunderland
B19: Combined Totals | C19: =SUM(C350+C341+C334+C325+C315+C300+C286+C280+C266+C251+C242+C232+C205+C189+C176+C157+C141+C131+C116+C102+C90+C76+C61+C38) -> 327745000 | F19: =SUM(F350+F341+F334+F325+F315+F300+F286+F280+F266+F251+F242+F232+F205+F189+F176+F157+F141+F131+F116+F102+F90+F76+F61+F38) -> 167080000 | G19: =SUM(G20:G351) -> 160665000 | H19: =SUM(H20:H351) -> 1263
B20: Players Purchased | C20: Fee | E20: Players Sold | F20: Fee | G20: Net Total | H20: Points | I20: Position
B21: Season 15/16
B22: Sebastian Coates | C22: 2000000 | E22: El-Hadji Ba | F22: Undisclosed
B23: Jeremain Lens | C23: 8000000 | E23: Anthony Reveillere | F23: Released
B24: Younès Kaboul | C24: 3000000 | E24: Lewis McGugan | F24: 300000
B25: Fabio Borini | C25: 10000000 | E25: Connor Wickham | F25: 7000000
B26: Adam Matthews | C26: 2000000
B28: New Manager
B29: Jan Kirchhoff | C29: 1000000
B30: New Manager | E30: New Manager
B31: Steve Harper | C31: Free | E31: Costel Pantilimon | F31: Free
B32: Lamine Koné | C32: 5000000
B33: Wahbi Khazri | C33: 9000000
H37: PTS | I37: POS
C38: =SUM(C22:C31) -> 26000000 | F38: =SUM(F22:F37) -> 7300000 | G38: =C38-F38 -> 18700000
B39: Season 14/15
B40: Billy Jones | C40: Free | E40: Billy Knott | F40: Free
B41: Jordi Gómez | C41: Free | E41: Jack Colback | F41: Free
B42: Costel Pantilimon | C42: Free | E42: Phil Bardsley | F42: Free
B43: Patrick van Aanholt | C43: 1500000 | E43: Craig Gardner | F43: Free
B44: Jack Rodwell | C44: 10000000 | E44: Carlos Cuellar | F44: Released
B45: Will Buckley | C45: 2500000 | E45: Andrea Dossena | F45: Released
B46: Anthony Réveillère | C46: Free | E46: Louise Laing | F46: Released
B47: Jermain Defoe | C47: Swap | E47: Oscar Ustari | F47: Released
E48: David Vaughan | F48: Released
E49: Keiran Westwood | F49: Released
E50: Ignacio Scocco | F50: 2100000
E51: John Egan | F51: Released
E52: Reece Noble | F52: Free
E53: Jordan Laidler | F53: Released
E54: Alejandro Rodriguez Gorrin | F54: Released
E55: Jordan Watson | F55: Released
E56: William Buckley | F56: 2500000
E57: David Ferguson | F57: Undisclosed
E58: Jozy Altidore | F58: Swap
E59: Scott Harrison | F59: Undisclosed
E60: Cabral | F60: Released | H60: PTS | I60: POS
C61: =SUM(C40:C50) -> 14000000 | F61: =SUM(F40:F50) -> 2100000 | G61: =C61-F61 -> 11900000 | H61: 38 | I61: 16
B62: Season 13/14
B63: El Hadji Ba | C63: 380000 | E63: Adam Reed, | F63: Released
B64: David Moberg Karlsson | C64: 1500000 | E64: Anthony Callaghan, | F64: Released
B65: Cabral | C65: Free | E65: Ben Wilson. | F65: Released
B66: Mobido Diakite | C66: Free | E66: Matt Kilgallon, | F66: Released
B67: Valentin Roberge | C67: Free | E67: Ryan Noble, | F67: Released
B68: Duncan Whatmore | C68: Undisclosed | E68: Titus Bramble, | F68: Released
B69: Jozy Altidore | C69: 8500000 | E69: Wade Joyce, | F69: Released
B70: Emanuele Giaccherini | C70: 6500000 | E70: Simon Mignoley | F70: 10000000
B71: Vito Mannone | C71: 2000000 | E71: Ahmed Elmohamady | F71: 2000000
B72: Charalampos Mavrias | C72: 2500000 | E72: James McClean | F72: 2000000
B73: Andrea Dossena | C73: Free | E73: Stephane Sessegnon | F73: 6000000
B74: Ignacio Scocco | C74: 3000000 | E74: Ji Dong-Won | F74: Undisclosed | H74: Prem
B75: Liam Bridcutt | C75: 3000000 | H75: PTS | I75: POS
B76: Total | C76: =SUM(C63:C75) -> 27380000 | F76: =SUM(F63:F75) -> 20000000 | G76: =C76-F76 -> 7380000 | H76: 38 | I76: 14
B77: Season 12/13
B78: Carlos Jimenez Cuellar | C78: Free | E78: George McCartney | F78: Undisclosed
B79: Louis Saha | C79: Unattached | E79: Trevor Carson | F79: Free
B80: Adam Johnson | C80: 10000000 | E80: Asamoah Gyan | F80: 6000000
B81: Steven Fletcher | C81: 12000000 | E81: Jordan Cook | F81: Free | H81: Prem
B82: Alfred N Diaye | C82: 3000000 | E82: Marcos Angeleri | F82: Undisclosed | H82: PTS | I82: POS
B83: Danny Graham | C83: 5000000 | E83: Michael Liddle | F83: Undisclosed
E84: Michael Turner | F84: 1500000
E85: Kieran Richardson | F85: 2000000
E86: Craig Gordon | F86: Released
E87: David Myler | F87: 1500000
E88: Fraizer Campbell | F88: 650000
E89: Blair Adams | F89: Free
B90: Total | C90: =SUM(C78:C89) -> 30000000 | F90: =SUM(F78:F88) -> 11650000 | G90: =C90-F90 -> 18350000 | H90: 39 | I90: 17
B91: Season 11/12
B92: Ahmed Elmohamady | C92: 2000000 | E92: Jordan Henderson | F92: 16000000
B93: David Vaughan | C93: Free | E93: Jean Mvoto Owono | F93: Free
B94: John O'Shea | C94: 4500000 | E94: Michael Kay | F94: Free
B95: Wes Brown | C95: 1200000 | E95: Robbie Weir | F95: Free
B96: Keiren Westwood | C96: Free | E96: Anton Ferdinand | F96: 1000000
B97: Sebastian Larsson | C97: Free | E97: Boudewijn Zenden | F97: Released
B98: Craig Gardner | C98: 6000000 | E98: Steed Malbranque | F98: 1500000
B99: Connor Wickham | C99: 8000000 | E99: Nyron Nosworthy | F99: Free
B100: Dong-Won Ji | C100: 2000000 | E100: Liam Noble | F100: Free | H100: Prem
B101: James McClean | C101: 350000 | E101: Cristian Riveros | F101: Free | H101: PTS | I101: POS
B102: Total | C102: =SUM(C92:C101) -> 24050000 | F102: =SUM(F92:F101) -> 18500000 | G102: =C102-F102 -> 5550000 | H102: 45 | I102: 13
B103: Season 10/11
B104: Simon Mignolet | C104: 2000000 | E104: Jamie Chandler | F104: Free
B105: Cristian Riveros | C105: Free | E105: Roy O Donovan | F105: Free
B106: Titus Bramble | C106: 1000000 | E106: Lorik Cana | F106: 5000000
B107: Marcos Angeleri | C107: Signed | E107: Conor Hourihane | F107: Undisclosed
B108: Asamoah Gyan | C108: 13200000 | E108: Daryl Murphy | F108: 1300000
B109: Stephane Sessegnon | C109: 6000000 | E109: Marton Fulop | F109: Undisclosed
E110: Kenwyne Jones | F110: 8000000
E111: Martin Waghorn | F111: 3000000
E112: David Healy | F112: Free
E113: Darren Bent | F113: 18000000
E114: Andy Reid | F114: 1000000 | H114: Prem
E115: Paulo Da Silva | F115: Undisclosed | H115: PTS | I115: POS
B116: Total | C116: =SUM(C104:C112) -> 22200000 | F116: =SUM(F104:F114) -> 36300000 | G116: =C116-F116 -> -14100000 | H116: 47 | I116: 10
B117: Season 09/10
B118: Fraizer Campbell | C118: 3500000 | E118: Rade Prica | F118: undisclosed
B119: Paulo Da Silva | C119: undisclosed | E119: Grant Leadbitter | F119: 2000000
B120: Lorik Cana | C120: 5000000 | E120: Greg Halford | F120: 2000000
B121: Darren Bent | C121: 16500000 | E121: Michael Chopra | F121: 4000000
B122: Lee Cattermole | C122: 6000000 | E122: Dean Whitehead | F122: 3000000
B123: Michael Turner | C123: Signed | E123: Nick Colgan | F123: Free
B124: Mather Kilgallon | C124: Undisclosed | E124: Peter Hartley | F124: Free
E125: Anthony Stokes | F125: 1000000
E126: Paul Mc Shane | F126: 2000000
E127: Danny Collins | F127: 2750000
E128: Carlos Edwards | F128: 2000000
E129: Liam Miller | F129: Free | H129: Prem
E130: Russel Anderson | F130: Free | H130: PTS | I130: POS
B131: Total | C131: =SUM(C118:C129) -> 31000000 | F131: =SUM(F118:F130) -> 18750000 | G131: =C131-F131 -> 12250000 | H131: 44 | I131: 13
B133: Season 08/09
B134: El Hadji Diouf | C134: 3000000 | E134: Danny Higginbotham | F134: 2500000
B135: Steed Malbranque | C135: 7000000 | E135: Dickson Ethu | F135: Undisclosed
B136: Anton Ferdinand | C136: 8000000 | E136: Graham Kavanagh | F136: Free
B137: George McCartney | C137: 4500000 | E137: Ross Wallace | F137: Signed
B138: David Healy | C138: 2000000 | E138: Pascal Chimbonda | F138: Signed
B139: David Meyler | C139: 500000 | E139: El Hadji Diouf | F139: 2000000 | H139: Prem
B140: Teemu Tainio | C140: Undisclosed | H140: PTS | I140: POS
B141: Total | C141: =SUM(C134:C140) -> 25000000 | F141: =SUM(F134:F140) -> 4500000 | G141: =C141-F141 -> 20500000 | H141: 36 | I141: 16
B143: Season 07/08
B144: Michael Chopra | C144: 5000000 | E144: Stephen Elliott | F144: Signed
B145: Kieran Richardson | C145: 5500000 | E145: Tommy Miller | F145: Free
B146: Dickson Etuhu | C146: 1500000 | E146: Stern John | F146: Signed
B147: Paul McShane | C147: 2500000
B148: Craig Gordon | C148: 9000000
B149: Andy Cole | C149: Free
B150: Kenwyne Jones | C150: 6000000
B151: Ian Harte | C151: Free
B152: Danny Higginbotham | C152: 2500000
B153: Jean-Yves Mvoto Mvoto | C153: 300000
B154: Phil Bardsley | C154: 2000000
B155: Rade Prica | C155: 2000000 | H155: Prem
B156: Andy Reid | C156: 4000000 | H156: PTS | I156: POS
B157: Total | C157: =SUM(C144:C156) -> 40300000 | F157: =SUM(F144:F146) -> 0 | G157: =C157-F157 -> 40300000 | H157: 39 | I157: 15
B159: Season 06/07
B160: Kenny Cunningham | C160: Free | E160: Gary Breen | F160: Free
B161: Robbie Elliott | C161: Monthly | E161: Kelvin Davis | F161: 1000000
B162: Clive Clarke | C162: Signed | E162: Julio Arca | F162: 1750000
B163: Tobias Hysen | C163: 1700000 | E163: Martin Woods | F163: Free
B164: Stanislav Varga | C164: Signed | E164: George McCartney | F164: Signed
B165: Ross Wallace | C165: Signed | E165: Kevin Kyle | F165: 600000
B166: Dwight Yorke | C166: 200000 | E166: Robbie Elliott | F166: Free
B167: Liam Miller | C167: Free | E167: Liam Lawrence | F167: 500000
B168: Graham Kavanagh | C168: 500000 | E168: Ben Alnwick | F168: 900000
B169: David Connolly | C169: 1400000 | E169: Neill Collins | F169: 150000
B170: Marton Fulop | C170: 500000 | E170: Kevin Smith | F170: Signed
B171: Carlos Edwards | C171: 1400000 | E171: Jon Stead | F171: 750000
B172: Anthony Stokes | C172: 2000000 | E172: Chris Brown | F172: 325000
B173: Stern John | C173: Signed | E173: Steven Caldwell | F173: 200000
B174: Greg Halford | C174: 2500000
B175: Russell Anderson | C175: 1000000 | H175: PTS | I175: POS
B176: Total | C176: =SUM(C160:C175) -> 11200000 | F176: =SUM(F160:F175) -> 6175000 | G176: =C176-F176 -> 5025000 | H176: 88 | I176: 1
B178: Season 05/06
B179: Tommy Miller | C179: Free | E179: Jeff Whitley | F179: Free
B180: Martin Woods | C180: Free | E180: Brian Deane | F180: Free
B181: Joe Murphy | C181: Signed | E181: Sean Thornton | F181: 175000
B182: Alan Stubbs | C182: Free | E182: Michael Bridges | F182: Free
B183: Andy Gray | C183: 1100000 | E183: Thomas Myhre | F183: Free
B184: Christian Bassila | C184: Free | E184: Carl Robinson | F184: 50000
B185: Kevin Smith | C185: Free | E185: Alan Stubbs | F185: Free
B186: Rory Delap | C186: Free | E186: Mart Poom | F186: Signed
B187: Darren Ward | C187: Free | E187: Joe Murphy | F187: Free | H187: Prem
B188: Arnau Riera | C188: Free | E188: Andy Gray | F188: 750000 | H188: PTS | I188: POS
B189: Total | C189: =SUM(C179:C188) -> 1100000 | F189: =SUM(F179:F188) -> 975000 | G189: =C189-F189 -> 125000 | H189: 15 | I189: 20
B191: Season 04/05
B192: Mark Lynch | C192: Signed | E192: Jason McAteer | F192: Free
B193: Neill Collins | C193: 25000 | E193: Michael Reddy | F193: Free
B194: Danny Collins | C194: 140000 | E194: Darren Byfield | F194: Free
B195: Andy Welsh | C195: 15000 | E195: Paul Thirlwell | F195: Free
B196: Michael Bridges | C196: Signed | E196: Joachim Bjorklund | F196: Free
B197: Brian Deane | C197: Free | E197: Thomas Butler | F197: Free
B198: Daryl Murphy | C198: 100000 | E198: Ben Clark | F198: Free
B199: Nyron Nosworthy | C199: Free | E199: Darren Williams | F199: Free
B200: Jon Stead | C200: 1800000 | E200: John Oster | F200: Free
B201: Kelvin Davis | C201: 1250000 | E201: Jonjo Dickman | F201: Free
E202: Richie Ryan | F202: Signed
E203: Marcus Stewart | F203: Free
E204: Mark Lynch | F204: Free | H204: PTS | I204: POS
B205: Total | C205: =SUM(C192:C204) -> 3330000 | F205: =SUM(F192:F204) -> 0 | G205: =C205-F205 -> 3330000 | H205: 94 | I205: 1
B207: Season 03/04
B208: Jeff Whitley | C208: Free | E208: David Bellion | F208: 2000000
B209: Gary Breen | C209: Free | E209: Baki Mercimek | F209: Free
B210: Colin Healy | C210: Free | E210: Lilian Laslandes | F210: Free
B211: Tommy Smith | C211: Free | E211: Bernt Haas | F211: 500000
B212: Darren Byfield | C212: Swap | E212: Ian Davidson | F212: Free
B213: Stephen Elliott | C213: 125000 | E213: Gavin McCann | F213: 2250000
B214: Carl Robinson | C214: Free | E214: Jody Craddock | F214: 1750000
B215: Dean Whitehead | C215: 150000 | E215: Jon Kennedy | F215: Free
B216: Liam Lawrence | C216: 175000 | E216: Stephen Capper | F216: Free
B217: Steven Caldwell | C217: Free | E217: Thomas Sorensen | F217: 2250000
E218: Kevin Phillips | F218: 3250000
E219: Tore-Andre Flo | F219: Signed
E220: Claudio Reyna | F220: 2500000
E221: Emerson Thome | F221: Free
E222: Kevin Kilbane | F222: 750000
E223: Michael Gray | F223: Free
E224: Michael Proctor | F224: Swap
E225: Craig James | F225: Free
E226: Chris Black | F226: Free
E227: Patrick Collins | F227: Free
E228: Simon Ramsden | F228: Free
E229: Tommy Smith | F229: Free
E230: Christopher Scott | F230: Free
E231: Nicolas Medina | F231: 0 | H231: PTS | I231: POS
B232: Total | C232: =SUM(C208:C231) -> 450000 | F232: =SUM(F208:F231) -> 15250000 | G232: =C232-F232 -> -14800000 | H232: 79 | I232: 3
B234: Season 02/03
B235: Phil Babb | C235: Free | E235: Brendan McGill | F235: Free
B236: Thomas Myhre | C236: Free | E236: Dene Shields | F236: Free
B237: Stephen Wright | C237: 3000000 | E237: Stanislav Varga | F237: Free
B238: Matt Piper | C238: 3500000 | E238: Jurgen Macho | F238: Free
B239: Tore-Andre Flo | C239: 6750000 | E239: Cliff Byrne | F239: Free
B240: Marcus Stewart | C240: 3250000 | H240: Prem
B241: Mart Poom | C241: 2500000 | H241: PTS | I241: POS
B242: Total | C242: =SUM(C235:C241) -> 19000000 | F242: =SUM(F235:F241) -> 0 | G242: =C242-F242 -> 19000000 | H242: 19 | I242: 20
B244: Season 01/02
B245: Lilian Laslandes | C245: 3600000 | E245: Carsten Fredgaard | F245: 500000
B246: David Bellion | C246: Free | E246: Neil Wainwright | F246: 50000
B247: Bernt Haas | C247: 750000 | E247: Don Hutchison | F247: 5000000
B248: Jason McAteer | C248: 1000000 | E248: Alex Rae | F248: 1200000
B249: Claudio Reyna | C249: 4000000 | E249: Danny Dichio | F249: 1250000 | H249: Prem
B250: Joachim Bjorklund | C250: 1500000 | E250: Chris Lumsdon | F250: 350000 | H250: PTS | I250: POS
B251: Total | C251: =SUM(C245:C250) -> 10850000 | F251: =SUM(F245:F250) -> 8350000 | G251: =C251-F251 -> 2500000 | H251: 40 | I251: 17
B253: Season 00/01
B254: Jurgen Macho | C254: Free | E254: Sam Aiston | F254: 50000
B255: Don Hutchison | C255: 2500000 | E255: Gregg Shannon | F255: Free
B256: Julio Arca | C256: 3500000 | E256: Gerry Harrison | F256: Signed
B257: Stanislav Varga | C257: 875000 | E257: Philip Naisbett | F257: Free
B258: Emerson Thome | C258: 4500000 | E258: Darren Holloway | F258: 1200000
B259: Dene Shields | C259: 60000 | E259: Nicky Summerbee | F259: Free
B260: Nicolas Medina | C260: 3500000 | E260: Mark Convery | F260: Free
B261: Baki Mercimek | C261: Free | E261: Paul Butler | F261: 1000000
E262: Eric Roy | F262: Free
E263: Chris Makin | F263: 1400000
E264: Andy Marriott | F264: Free | H264: Prem
E265: Milton Nunez | F265: Signed | H265: PTS | I265: POS
B266: Total | C266: =SUM(C254:C265) -> 14935000 | F266: =SUM(F254:F265) -> 3650000 | G266: =C266-F266 -> 11285000 | H266: 57 | I266: 7
B268: Season 99/00
B269: Michael Ingham | C269: 30000 | E269: Andy Melville | F269: Free
B270: Steve Bould | C270: 500000 | E270: Lee Clark | F270: 3000000
B271: Thomas Helmer | C271: Free | E271: John Mullin | F271: Free
B272: Stefan Schwarz | C272: 4000000 | E272: Matthew Pitts | F272: Free
B273: John Oster | C273: 1000000 | E273: Michael Bridges | F273: 5000000
B274: Eric Roy | C274: 200000 | E274: Martin Smith | F274: Free
B275: Kevin Kilbane | C275: 2200000 | E275: Paul Beavers | F275: Free
B276: Milton Nunez | C276: 1600000 | E276: Luke Weaver | F276: Free
B277: John Kennedy | C277: 90000 | E277: Kevin Ball | F277: 200000
B278: Tom Peeters | C278: 250000 | E278: Chris Porter | F278: Free | H278: Prem
E279: Allan Johnston | F279: Free | H279: PTS | I279: POS
B280: Total | C280: =SUM(C269:C279) -> 9870000 | F280: =SUM(F269:F279) -> 8200000 | G280: =C280-F280 -> 1670000 | H280: 58 | I280: 7
B282: Season 98/99
B283: Andy Marriott | C283: 200000 | E283: Richard Ord | F283: 675000
B284: Gavin McCann | C284: 500000
B285: Carsten Fredgaard | C285: 1500000 | H285: PTS | I285: POS
B286: Total | C286: =SUM(C283:C285) -> 2200000 | F286: =SUM(F283:F285) -> 675000 | G286: =C286-F286 -> 1525000 | H286: 105 | I286: 1
B288: Season 97/98
B289: Jody Craddock | C289: 300000 | E289: David Kelly | F289: 350000
B290: Chris Byrne | C290: Free | E290: David Conlon | F290: Free
B291: Chris Makin | C291: 500000 | E291: Paul Conlon | F291: Unknown
B292: Nicky Summerbee | C292: 1000000 | E292: Dariusz Kubicki | F292: Free
B293: Luke Weaver | C293: 250000 | E293: Lee Howey | F293: 200000
B294: Danny Dichio | C294: 750000 | E294: Paul Bracewell | F294: 75000
B295: Mike Pollitt | C295: 75000 | E295: Craig Russell | F295: 1000000
B296: Neil Wainwright | C296: 100000 | E296: Chris Byrne | F296: 200000
B297: Thomas Sorensen | C297: 500000 | E297: Edwin Zoetebier
B298: Gerry Harrison | C298: Free | E298: Gareth Hall | F298: Signed
B299: Paul Butler | C299: 1000000 | E299: Lionel Perez | F299: Free | H299: PTS | I299: POS
B300: Total | C300: =SUM(C289:C299) -> 4475000 | F300: =SUM(F289:F299) -> 1825000 | G300: =C300-F300 -> 2650000 | H300: 90 | I300: 3
B302: Season 96/97
B303: Chris Tate | C303: Signed | E303: Gordon Armstrong | F303: Free
B304: Lionel Perez | C304: 200000 | E304: Brian Atkinson | F304: Free
B305: Niall Quinn | C305: 1300000 | E305: Brett Angell | F305: 120000
B306: Darren Williams | C306: 50000 | E306: Steve Brodie | F306: Free
B307: Jan Eriksson | C307: 250000 | E307: Paul Stewart | F307: Free
B308: Chris Waddle | C308: 75000
B309: Kim Heiselberg | C309: 125000
B310: Chris Woods | C310: Signed
B311: Allan Johnston | C311: 550000
B312: Edwin Zoetebier | C312: 350000
B313: Lee Clark | C313: 2500000 | H313: Prem
B314: Kevin Phillips | C314: 325000 | H314: PTS | I314: POS
B315: Total | C315: =SUM(C303:C314) -> 5725000 | F315: =SUM(F303:F314) -> 120000 | G315: =C315-F315 -> 5605000 | H315: 40 | I315: 18
B317: Season 95/96
B318: John Mullin | C318: 40000 | E318: Mark Angel | F318: Free
B319: Paul Stewart | C319: Free | E319: Phil Brumwell | F319: Free
B320: Alex Rae | C320: 1000000 | E320: Shaun Cunnington | F320: 220000
B321: Paul Conlon | C321: Free | E321: Tony Smith
E322: Derek Ferguson | F322: 250000
E323: Martin Gray | F323: 100000
E324: Alec Chamberlain | F324: 40000 | H324: PTS | I324: POS
B325: Total | C325: =SUM(C318:C324) -> 1040000 | F325: =SUM(F318:F324) -> 610000 | G325: =C325-F325 -> 430000 | H325: 83 | I325: 1
B327: Season 94/95
B328: Martin Scott | C328: 750000 | E328: Ian Sampson | F328: Free
B329: Steve Agnew | C329: 250000 | E329: David Rush | F329: 100000
B330: Brett Angell | C330: 600000 | E330: Don Goodman | F330: 1100000
B331: Paul Bracewell | C331: 100000 | E331: Gary Owers | F331: 250000
B332: Sam Aiston | C332: Free | E332: Tony Norman | F332: Free
E333: Ian Rodgerson | F333: Free | H333: PTS | I333: POS
B334: Total | C334: =SUM(C328:C333) -> 1700000 | F334: =SUM(F328:F333) -> 1450000 | G334: =C334-F334 -> 250000 | H334: 54 | I334: 20
B336: Season 93/94
B337: Andy Melville | C337: Transfer | E337: Warren Hawke | F337: Signed
B338: Jamie Lawrence | C338: Signed | E338: Colin Pascoe | F338: 70000
B339: Mark Angel | C339: Signed | E339: Anton Rogan | F339: Signed
B340: Dariusz Kubicki | C340: Transfer | E340: Jamie Lawrence | F340: 20000 | H340: PTS | I340: POS
B341: Total | C341: =SUM(C337:C340) -> 0 | F341: =SUM(F337:F340) -> 90000 | G341: =C341-F341 -> -90000 | H341: 65 | I341: 12
B343: Season 92/93
B344: Mick Harford | C344: 250000 | E344: Tim Carter | F344: Free
B345: Lee Howey | C345: Free | E345: Paul Hardyman | F345: 160000
B346: Alec Chamberlain | C346: Free | E346: John Byrne | F346: 250000
B347: Phil Gray | C347: 800000 | E347: Mick Harford | F347: 200000
B348: Ian Rodgerson | C348: 140000 | E348: John Colquhoun | F348: Signed
B349: Derek Ferguson | C349: 750000 | H349: PTS | I349: POS
B350: Total | C350: =SUM(C344:C349) -> 1940000 | F350: =SUM(F344:F349) -> 610000 | G350: =C350-F350 -> 1330000 | H350: 50 | I350: 21