B1: Season 91/92 to date | C1: =C7 -> 131065000 | F1: =F7 -> 47630000 | G1: =G7 -> 104535000 | H1: =SUM(G8:G300) -> 104535000 | I1: =G1-H1 -> 0
B2: Season 03/04 to date | C2: =C176+C160+C148+C135+C125+C111+C97+C88+C79+C70+C58+C42+C26 -> 146120000 | F2: =F176+F160+F148+F135+F125+F111+F97+F88+F79+F70+F58+F42+F26 -> 37595000 | G2: =C2-F2 -> 108525000 | H2: =SUM(G8:G176) -> 108525000 | I2: =G2-H2 -> 0
B3: last five seasons | C3: =C79+C70+C58+C42+C26 -> 88550000 | F3: =F79+F70+F58+F42+F26 -> 24100000 | G3: =C3-F3 -> 64450000 | H3: =SUM(G8:G79) -> 64450000 | I3: =G3-H3 -> 0
B4: Championship | C4: =C160+C148+C135+C125+C111+C97+C88+C79+C70+C58+C42+C26 -> 145875000 | F4: =F160+F148+F135+F125+F111+F97+F88+F79+F70+F58+F42+F26 -> 37195000 | G4: =C4-F4 -> 108680000 | H4: =SUM(G8:G160) -> 108680000 | I4: =G4-H4 -> 0
B6: Stoke
B7: Combined Totals | C7: =C299+C289+C275+C262+C254+C242+C230+C221+C210+C198+C184+C176+C160+C148+C135+C125+C111+C97+C88+C79+C58+C42+C26 -> 131065000 | F7: =F299+F289+F275+F262+F254+F242+F230+F221+F210+F198+F184+F176+F160+F148+F135+F125+F111+F97+F88+F79+F58+F42+F26 -> 47630000 | G7: =SUM(G8:G299) -> 104535000 | H7: =SUM(H8:H300) -> 1029
B8: Players Purchased | C8: Fee | E8: Players Sold | F8: Fee | G8: Net Total | H8: Points | I8: Position
B9: Season 15/16
B10: Jakob Haugaard | C10: 600000 | E10: Robert Huth | F10: 3000000
B11: Philipp Wollscheid | C11: 2750000 | E11: Andy Wilkinson | F11: Released
B12: Joselu | C12: 5900000 | E12: Thomas Sorensen | F12: Released
B13: Glen Johnson | C13: Unattached | E13: Wilson Palacios | F13: Released
B14: Moha El Ouriachi | C14: Free | E14: Steven N'Zonzi | F14: 7000000
B15: Ibrahim Afellay | C15: Free | E15: Asmir Begović | F15: 8000000
B16: Xherdan Shaqiri | C16: 12000000 | E16: Jamie Ness | F16: Free
B17: Sergio Molina | C17: Free
B18: Shay Given | C18: Free
B19: Gianelli Imbula | C19: 18300000
H25: PTS | I25: POS
C26: =SUM(C10:C19) -> 39550000 | F26: =SUM(F10:F25) -> 18000000 | G26: =C26-F26 -> 21550000
B27: Season 14/15
B28: Steve Sidwell | C28: Free | E28: Michael Kightly | F28: 1500000
B29: Phil Bardsley | C29: Free | E29: Matthew Etherington | F29: Released
B30: Mame Biram Diouf | C30: Free | E30: Cameron Jerome | F30: 1500000
B31: Dionatan Teixeira | C31: 400000 | E31: Karim Rossi | F31: Free
B32: Bojan Krkić | C32: 3000000 | E32: Jordan Keane | F32: Released
E33: Ed Sanders | F33: Released
E34: Karim Rossi | F34: Free
E35: Kevin Gomez-Nieto | F35: Released
E36: Lucas Dawson | F36: Released
E37: Juan Agudelo | F37: Released
E38: Ben Heneghan | F38: Released
E39: Jordan Richardson | F39: Released
E40: Ryan Shotton | F40: 500000
E41: Maurice Edu | F41: Undisclosed | H41: PTS | I41: POS
C42: =SUM(C28:C39) -> 3400000 | F42: =SUM(F28:F41) -> 3500000 | G42: =C42-F42 -> -100000 | H42: 54 | I42: 9
B43: Season 13/14
B44: Erik Pieters | C44: £3,000,000 | E44: Andrew Musunga, | F44: Released
B45: Alex Grant | C45: Free | E45: Carlo Nash, | F45: Released
B46: Marc Muniesa | C46: Free | E46: Dean Whitehead | F46: Released
B47: Marko Arnautovic | C47: 2000000 | E47: George Rigg, | F47: Released
B48: Stephen Ireland | C48: Free | E48: Jadan Hall, | F48: Released
B49: Juan Agudelo | C49: Undisclosed | E49: Mamady Sidibe, | F49: Released
B50: Peter Odemwingie | C50: Swap | E50: Matthew Gledhill, | F50: Released
E51: Matthew Lund, | F51: Released
E52: Matthew Upson, | F52: Released
E53: Michael Clarkson, | F53: Released
E54: Rory Delap, | F54: Released
E55: Michael Owen | F55: Retired
E56: Florent Cuvelier | F56: Undisclosed | H56: Prem
E57: Kenwyne Jones | F57: Swap | H57: PTS | I57: POS
B58: Total | C58: =SUM(C44:C57) -> 2000000 | F58: =SUM(F44:F57) -> 0 | G58: =C58-F58 -> 2000000 | H58: 50 | I58: 9
B59: Season 12/13
B60: Jamie Ness | C60: Free | E60: Andrew Davies | F60: Free
B61: Michael Kightly | C61: 3000000 | E61: Jonathan Woodgate | F61: Free
B62: Maurice Edu | C62: 4000000 | E62: Danny Collins | F62: 500000
B63: Charlie Adam | C63: 4000000 | E63: Danny Higginbotham | F63: Released
B64: Geoff Cameron | C64: 1600000 | E64: Salif Diao | F64: Released
B65: Steven Nzonzi | C65: 3000000 | E65: Tom Soares | F65: Released
B66: Jack Butland | C66: 3500000 | E66: Louis Moult | F66: Free
B67: Brek Shea | C67: 2500000 | E67: Ricardo Fuller | F67: Free
E68: Michael Tonge | F68: Nominal | H68: Prem
H69: PTS | I69: POS
B70: Total | C70: =SUM(C60:C67) -> 21600000 | F70: =SUM(F60:F67) -> 500000 | G70: =C70-F70 -> 21100000 | H70: 42 | I70: 13
B71: Season 11/12
B72: Jonathan Woodgate | C72: Free | E72: Abdoulaye Faye | F72: Free
B73: Smajl Suljevic | C73: Undisclosed | E73: Carl Dickinson | F73: 600000
B74: David Jones | C74: Free | E74: Danny Pugh | F74: 500000
B75: Matthew Upson | C75: Free | E75: Ben Marshall | F75: 1000000
B76: Peter Crouch | C76: 10000000
B77: Wilson Palacios | C77: 8000000 | H77: Prem
B78: Cameron Jerome | C78: 4000000 | H78: PTS | I78: POS
B79: Total | C79: =SUM(C72:C78) -> 22000000 | F79: =SUM(F72:F77) -> 2100000 | G79: =C79-F79 -> 19900000 | H79: 45 | I79: 14
B80: Season 10/11
B81: Florent Cuvelier | C81: Undisclosed | E81: N Wedderburn | F81: Free
B82: Kenwyne Jones | C82: 8000000 | E82: Amdy Faye | F82: Released
B83: Jonathan Walters | C83: 2750000 | E83: Andy Griffin | F83: Nominal
B84: Jermaine Pennant | C84: 1725000 | E84: Steve Simnonsen | F84: Free
B85: Marc Wilson | C85: Signed | E85: James Beatie | F85: 1500000
B86: Carlo Nash | C86: Signed | E86: Liam Lawrence | F86: Undisclosed | H86: Prem
B87: Matthew Lund | C87: Signed | E87: Tuncay Sanli | F87: Undisclosed | H87: PTS | I87: POS
B88: Total | C88: =SUM(C81:C84) -> 12475000 | F88: =SUM(F81:F87) -> 1500000 | G88: =C88-F88 -> 10975000 | H88: 46 | I88: 13
B89: Season 09/10
B90: Dean Whitehead | C90: 3000000 | E90: Seyi Olofinjana | F90: 3000000
B91: Robert Huth | C91: 5000000 | E91: Richard Cresswell | F91: Undisclosed
B92: Tuncay Sanli | C92: 5000000 | E92: Leon Cort | F92: 1500000
B93: Diego Arismendi | C93: 2500000
B94: Danny Collins | C94: 2750000 | H94: Prem
B95: Asmir Begovic | C95: 3250000 | H95: PTS | I95: POS
B97: Total | C97: =SUM(C90:C95) -> 21500000 | F97: =SUM(F90:F94) -> 4500000 | G97: =C97-F97 -> 17000000 | H97: 47 | I97: 11
B98: Season 08/09
B99: Dave Kitson | C99: 5500000 | E99: Russell Hoult | F99: Free
B100: Seyi Olofinjana | C100: 3000000 | E100: Adam Rooney | F100: 50000
B101: Thomas Sorensen | C101: Free | E101: Anthony Pulis | F101: Free
B102: Abdoulaye Faye | C102: 2250000 | E102: Jon Parkin | F102: Signed
B103: Amdy Faye | C103: Signed | E103: Ritchie de Laet | F103: Signed
B104: Andrew Davies | C104: Signed | E104: Lewis Buxton | F104: Nominal
B105: Tom Soares | C105: Signed
B106: Michael Tonge | C106: 2500000
B107: Ibrahima Sonko | C107: Signed
B108: Danny Higginbotham | C108: Signed
B109: Matthew Etherington | C109: 2000000 | H109: Prem
B110: James Beattie | C110: 3500000 | H110: PTS | I110: POS
B111: Total | C111: =SUM(C99:C110) -> 18750000 | F111: =SUM(F99:F105) -> 50000 | G111: =C111-F111 -> 18700000 | H111: 45 | I111: 12
B113: Season 07/08
B114: Richard Cresswell | C114: Signed | E114: Ed de Goey | F114: Free
B115: Andy Griffin | C115: 300000 | E115: Darel Russell | F115: Signed
B116: Leon Cort | C116: 1200000 | E116: Carl Hoefkens | F116: 750000
B117: Danny Pugh | C117: 500000 | E117: Sanbegou Bangoura | F117: 270000
B118: Ryan Shawcross | C118: 1000000 | E118: Matthew Hazley | F118: Free
B119: Glenn Whelan | C119: 500000 | E119: Danny Higginbotham | F119: 2500000
B120: Rory Delap | C120: Signed | E120: Robert Garrett | F120: Signed
E121: Peter Sweeney | F121: Free
E122: Clint Hill | F122: Signed
E123: John Eustace | F123: 250000
E124: Marlon Broomes | F124: Free | H124: PTS | I124: POS
B125: Total | C125: =SUM(C114:C124) -> 3500000 | F125: =SUM(F114:F124) -> 3770000 | G125: =C125-F125 -> -270000 | H125: 79 | I125: 2
B127: Season 06/07
B128: Danny Higginbotham | C128: 225000 | E128: Karl Henry | F128: 100000
B129: Ricardo Fuller | C129: Signed | E129: Hannes Sigurdsson | F129: Signed
B130: Liam Lawrence | C130: 500000 | E130: Luke Chadwick | F130: 200000
B131: Dominic Matteo | C131: Free | E131: Dave Brammer | F131: Free
B132: Salif Diao | C132: Free | E132: Michael Duberry | F132: 800000
B133: Russell Hoult | C133: Free | E133: Adam Vass | F133: Free
B134: Jon Parkin | C134: 275000 | E134: Kevin Harper | F134: Signed | H134: PTS | I134: POS
B135: Total | C135: =SUM(C128:C134) -> 1000000 | F135: =SUM(F128:F134) -> 1100000 | G135: =C135-F135 -> -100000 | H135: 73 | I135: 8
B137: Season 05/06
B138: Mamady Sidibe | C138: Free | E138: Chris Greenacre | F138: Free
B139: Peter Sweeney | C139: Signed | E139: Richard Keogh | F139: Free
B140: Carl Hoefkens | C140: Signed | E140: Ben Foster | F140: 1000000
B141: Marlon Broomes | C141: Swap | E141: Clive Clarke | F141: 275000
B142: Bruce Dyer | C142: Free | E142: Lewis Neal | F142: Swap
B143: Hannes Sigurdsson | C143: Signed | E143: Carl Asaba | F143: Free
B144: Sanbegou Bangoura | C144: Signed | E144: John Halls | F144: 250000
B145: Peter Kopteff | C145: Free | E145: Bruce Dyer | F145: Free
B146: Luke Chadwick | C146: 100000
B147: Vincent Pericard | C147: Free | H147: PTS | I147: POS
B148: Total | C148: =SUM(C138:C147) -> 100000 | F148: =SUM(F138:F147) -> 1525000 | G148: =C148-F148 -> -1425000 | H148: 58 | I148: 13
B150: Season 04/05
B151: Dave Brammer | C151: Free | E151: Steve Guppy | F151: Free
B152: Steve Simonsen | C152: Free | E152: Marcus Hall | F152: Free
B153: Steve Guppy | C153: Free | E153: Ade Akinbiyi | F153: 600000
B154: Adam Vass | C154: Signed | E154: Gareth Owen | F154: 50000
B155: Anthony Pulis | C155: Free | E155: Jermaine Palmer | F155: Free
B156: Lewis Buxton | C156: Free | E156: Wayne Thomas | F156: Free
B157: Thordur Gudjonsson | C157: Free | E157: Jay Denny | F157: Free
B158: Kevin Harper | C158: Signed
B159: Michael Duberry | C159: Free | H159: PTS | I159: POS
B160: Total | C160: =SUM(C151:C159) -> 0 | F160: =SUM(F151:F159) -> 650000 | G160: =C160-F160 -> -650000 | H160: 61 | I160: 12
B162: Season 03/04
B163: Ade Akinbiyi | C163: Free | E163: Bjarni Gudjonsson | F163: Free
B164: Clint Hill | C164: 120000 | E164: Lee Mills | F164: Free
B165: John Eustace | C165: Free | E165: James O'Connor | F165: Signed
B166: Ed de Goey | C166: Free | E166: Andy Cooke | F166: Free
B167: Carl Asaba | C167: Free | E167: Brynjar Gunnarsson | F167: Free
B168: Darel Russell | C168: 125000 | E168: Steve Banks | F168: Non-contract
B169: Paul Williams | C169: Free | E169: Peter Handyside | F169: Free
B170: Richard Johnson | C170: Signed | E170: Jani Viander | F170: Free
B171: John Halls | C171: Nominal | E171: Marc Goodfellow | F171: 50000
B172: Gerry Taggart | C172: Free | E172: Richard Johnson | F172: Free
E173: Brian Wilson | F173: 50000
E174: Neil Cutler | F174: Free
E175: Kris Commons | F175: 300000 | H175: PTS | I175: POS
B176: Total | C176: =SUM(C163:C172) -> 245000 | F176: =SUM(F163:F175) -> 400000 | G176: =C176-F176 -> -155000 | H176: 66 | I176: 11
B178: Season 02/03
B179: Chris Greenacre | C179: Free | E179: Rikhardur Dadason | F179: Free
B180: Lee Mills | C180: Free | E180: Ian Brightwell | F180: Free
B181: Steve Banks | C181: Free | E181: Gavin Ward | F181: Free
B182: Gifton Noel-Williams | C182: Free | E182: John Miles | F182: Free
E183: David Rowson | F183: Free | H183: PTS | I183: POS
B184: Total | C184: =SUM(C179:C182) -> 0 | F184: =SUM(F179:F183) -> 0 | G184: =C184-F184 -> 0 | H184: 50 | I184: 21
B186: Season 01/02
B187: David Rowson | C187: Free | E187: Alex Gibson | F187: Free
B188: Peter Handyside | C188: Free | E188: Graham Kavanagh | F188: 1000000
B189: Sergei Shtanuk | C189: 200000 | E189: Chris Short | F189: Free
B190: Peter Hoekstra | C190: Free | E190: Ben Petty | F190: Free
B191: Neil Cutler | C191: Free | E191: Nicky Mohan | F191: Free
B192: Jurgen Vandeurzen | C192: Free | E192: Kyle Lightbourne | F192: Free
B193: Petur Marteinsson | C193: 0 | E193: Ashley Wooliscroft | F193: Signed
B194: Souleymane Oulare | C194: Free | E194: Peter Thorne | F194: 1700000
B195: Jani Viander | C195: 100000 | E195: Dean Crowe | F195: Free
B196: Ian Brightwell | C196: Free | E196: Robert Heath | F196: Signed
B197: John Miles | C197: Free | H197: PTS | I197: POS
B198: Total | C198: =SUM(C187:C197) -> 300000 | F198: =SUM(F187:F196) -> 2700000 | G198: =C198-F198 -> -2400000 | H198: - | I198: -
B200: Season 00/01
B201: Tony Dorigo | C201: Free | E201: Phil Robinson | F201: Free
B202: Henrik Risom | C202: 20000 | E202: Steve Melton | F202: Free
B203: Graham Fenton | C203: Monthly | E203: Jamie Cartwright | F203: Signed
B204: Rikhardur Dadason | C204: Free | E204: Anders Jacobsen | F204: Free
B205: Andy Cooke | C205: 300000 | E205: Kevin Keen | F205: Free
E206: Graham Fenton | F206: Signed
E207: Bryan Small | F207: Free
E208: Paul Connor | F208: 150000
E209: Carl Muggleton | F209: Free | H209: PTS | I209: POS
B210: Total | C210: =SUM(C201:C205) -> 320000 | F210: =SUM(F201:F209) -> 150000 | G210: =C210-F210 -> 170000 | H210: - | I210: -
B212: Season 99/00
B213: Anders Jacobsen | C213: Free | E213: Richard Forsyth | F213: Free
B214: Mikael Hansson | C214: Free | E214: Steve Woods | F214: Free
B215: Brynjar Gunnarsson | C215: 600000 | E215: Simon Sturridge | F215: Signed
B216: Steve Melton | C216: Free | E216: Larus Sigurdsson | F216: Signed
B217: Chris Iwelumo | C217: 25000 | E217: Neil MacKenzie | F217: 40000
B218: Bjarni Gudjonsson | C218: 250000 | E218: Jason Kavanagh | F218: Free
B219: Wayne Thomas | C219: 200000 | E219: David Oldfield | F219: Free
B220: Stefan Thordarson | C220: Free | E220: Stuart Fraser | F220: Free | H220: PTS | I220: POS
B221: Total | C221: =SUM(C213:C220) -> 1075000 | F221: =SUM(F213:F220) -> 40000 | G221: =C221-F221 -> 1035000 | H221: - | I221: -
B223: Season 98/99
B224: Ben Petty | C224: Free | E224: Mark Birch | F224: Free
B225: Lee Collins | C225: Free | E225: Justin Whittle | F225: 50000
B226: Gavin Ward | C226: Free | E226: Ally Pickering | F226: Free
B227: Nicky Mohan | C227: Signed | E227: Steven Tweed | F227: 150000
B228: Jason Kavanagh | C228: Free
B229: Paul Connor | C229: Free | H229: PTS | I229: POS
B230: Total | C230: =SUM(C224:C229) -> 0 | F230: =SUM(F224:F229) -> 200000 | G230: =C230-F230 -> -200000 | H230: - | I230: -
B232: Season 97/98
B233: Peter Thorne | C233: 500000 | E233: Mark Prudhoe | F233: 70000
B234: Steven Tweed | C234: Free | E234: Mark Devlin | F234: Signed
B235: Davide Xausa | C235: Trial | E235: Andy Griffin | F235: 1500000
B236: Kyle Lightbourne | C236: 500000 | E236: Gerry McMahon | F236: 85000
B237: Neville Southall | C237: Free | E237: Tony Scully | F237: 150000
B238: O'Neill Donaldson | C238: Free | E238: Phil Morgan | F238: Signed
B239: David Oldfield | C239: Free | E239: Marco Gabbiadini | F239: Free
B240: Chris Short | C240: Free | E240: Mark McNally | F240: Free
B241: Phil Robinson | C241: Free | H241: PTS | I241: POS
B242: Total | C242: =SUM(C233:C241) -> 1000000 | F242: =SUM(F233:F241) -> 1805000 | G242: =C242-F242 -> -805000 | H242: 46 | I242: 23
B244: Season 96/97
B245: Hugo Da Costa | C245: Non-contract | E245: Vince Overson | F245: Free
B246: Ally Pickering | C246: 280000 | E246: Ian Clarkson | F246: Free
B247: Graham Kavanagh | C247: 250000 | E247: Ronnie Sinclair | F247: Free
B248: Gerry McMahon | C248: 450000 | E248: Nigel Gleghorn | F248: Free
B249: Kofi Nyamah | C249: 25000 | E249: John Dreyer | F249: 25000
B250: Mark McNally | C250: 120000 | E250: Martin Carruthers | F250: 75000
B251: Paul Stewart | C251: Free | E251: Wesley Byrne | F251: Free
E252: John Gayle | F252: 25000
E253: Mike Sheron | F253: 2350000 | H253: PTS | I253: POS
B254: Total | C254: =SUM(C245:C251) -> 1125000 | F254: =SUM(F245:F253) -> 2475000 | G254: =C254-F254 -> -1350000 | H254: 64 | I254: 12
B256: Season 95/96
B257: Wesley Byrne | C257: Free | E257: Gary Holt | F257: Signed
B258: Richard Forsyth | C258: 200000 | E258: Keith Downing | F258: Free
E259: Keith Scott | F259: Signed
E260: Lee Sandford | F260: 500000
E261: Graham Potter | F261: 250000 | H261: PTS | I261: POS
B262: Total | C262: =SUM(C257:C261) -> 200000 | F262: =SUM(F257:F261) -> 750000 | G262: =C262-F262 -> -550000 | H262: 73 | I262: 4
B264: Season 94/95
B265: Paul Peschisolido | C265: 400000 | E265: Dave Regis | F265: 200000
B266: Keith Downing | C266: Free | E266: John Clark | F266: 100000
B267: Jason Beckford | C267: Free | E267: Paul Ware | F267: 10000
B268: Ray Wallace | C268: Free | E268: Jason Beckford | F268: Free
B269: Kevin Keen | C269: 300000 | E269: Graham Shaw | F269: Free
B270: Justin Whittle | C270: Free | E270: John Butler | F270: Free
B271: Larus Sigurdsson | C271: 150000 | E271: Wayne Biggins | F271: Free
B272: Keith Scott | C272: 300000
B273: John Gayle | C273: 70000
B274: Phil Morgan | C274: Free | H274: PTS | I274: POS
B275: Total | C275: =SUM(C265:C274) -> 1220000 | F275: =SUM(F265:F274) -> 310000 | G275: =C275-F275 -> 910000 | H275: 63 | I275: 11
B277: Season 93/94
B278: Toddy Orlygsson | C278: Free | E278: Gary Bannister | F278: undisclosed
B279: Kenny Lowe | C279: Free | E279: Tony Kelly | F279: 10000
B280: Ian Clarkson | C280: 40000 | E280: Ian Wright | F280: Signed
B281: Simon Sturridge | C281: 75000 | E281: Mark Stein | F281: 1500000
B282: Graham Potter | C282: 75000 | E282: Kenny Lowe | F282: 75000
B283: John Clark | C283: 150000 | E283: Gary Pick | F283: Free
B284: Micky Adams | C284: Free | E284: Jimmy Mulligan | F284: 15000
B285: Wayne Biggins | C285: 125000 | E285: Micky Adams | F285: Free
B286: Graham Stokoe | C286: Free | E286: Steve Foley | F286: Free
B287: John Dreyer | C287: Free
B288: Carl Muggleton | C288: 150000 | H288: PTS | I288: POS
B289: Total | C289: =SUM(C278:C288) -> 615000 | F289: =SUM(F278:F288) -> 1600000 | G289: =C289-F289 -> -985000 | H289: 67 | I289: 10
B291: Season 92/93
B292: Graham Shaw | C292: 70000 | E292: Tony Ellis | F292: 140000
B293: Gary Pick | C293: Signed | E293: Adrian Heath | F293: Free
B294: Dave Regis | C294: 100000 | E294: Wayne Biggins | F294: 200000
B295: Nigel Gleghorn | C295: 100000 | E295: Tony Parks | F295: Signed
B296: Gary Bannister | C296: Free | E296: Tony Gallimore | F296: 15000
B297: Mark Prudhoe | C297: 120000 | E297: Kevin Russell | F297: 150000
B298: Martin Carruthers | C298: 300000 | E298: Peter Fox | F298: Free | H298: PTS | I298: POS
B299: Total | C299: =SUM(C292:C298) -> 690000 | F299: =SUM(F292:F298) -> 505000 | G299: =C299-F299 -> 185000 | H299: - | I299: -