B1: Season 91/92 to date | C1: =C9 -> 340945500 | F1: =F9 -> 254586000 | G1: =C1-F1 -> 86359500 | H1: =SUM(G10:G282) -> 86359500 | I1: =G1-H1 -> 0
B2: Season 03/04 to date | C2: =C158+C148+C132+C121+C109+C100+C92+C83+C76+C65+C54+C41+C28 -> 228750500 | F2: =F158+F148+F132+F121+F109+F100+F92+F83+F76+F65+F54+F41+F28 -> 172416000 | G2: =C2-F2 -> 56334500 | H2: =SUM(G10:G158) -> 56334500 | I2: =G2-H2 -> 0
B3: Championship 04/05 | C3: =C148+C132+C121+C109+C100+C92+C83+C76+C65+C54+C41+C28 -> 226300500 | F3: =F148+F132+F121+F109+F100+F92+F83+F76+F65+F54+F41+F28 -> 171516000 | G3: =C3-F3 -> 54784500 | H3: =SUM(G10:G148) -> 54784500 | I3: =G3-H3 -> 0
B4: last five seasons | C4: =C76+C65+C54+C41+C28 -> 122700000 | F4: =F76+F65+F54+F41+F28 -> 89316000 | G4: =C4-F4 -> 33384000 | H4: =SUM(G10:G76) -> 33384000 | I4: =G4-H4 -> 0
B5: David Moyes | C5: =SUM(C158+C148+C132+C121+C109+C100+C92+C83+C76+C65) -> 131050500 | F5: =SUM(F158+F148+F132+F121+F109+F100+F92+F83+F76+F65) -> 122416000 | G5: =C5-F5 -> 8634500 | H5: =SUM(G55:G158) -> 8634500 | I5: =G5-H5 -> 0
B6: Roberto Martinez | C6: =C54+C41+C28 -> 97700000 | F6: =F54+F41+F28 -> 50000000 | G6: =C6-F6 -> 47700000 | H6: =SUM(G10:G54) -> 47700000 | I6: =G6-H6 -> 0
B8: Everton
B9: Combined Totals | C9: =C282+C277+C268+C259+C251+C239+C224+C211+C191+C180+C168+C158+C148+C132+C121+C109+C100+C92+C83+C76+C65+C54+C41+C28 -> 340945500 | F9: =F282+F277+F268+F259+F251+F239+F224+F211+F191+F180+F168+F158+F148+F132+F121+F109+F100+F92+F83+F76+F65+F54+F41+F28 -> 254586000 | G9: =SUM(G10:G283) -> 86359500 | H9: =SUM(H10:H283) -> 1216
B10: Players Purchased | C10: Fee | E10: Players Sold | F10: Fee | G10: Net Total | H10: Points | I10: Position
B11: Season 15/16
B12: Gerard Deulofeu | C12: 4300000 | E12: Antolin Alcaraz | F12: released
B13: Tom Cleverley | C13: Free | E13: Sylvain Distin | F13: Released
B14: Mason Holgate | C14: 500000 | E14: Chris Long | F14: Signed
B15: Leandro Rodríguez | C15: 500000 | E15: Steven Naismith | F15: 8500000
B16: Ramiro Funes Mori | C16: 9500000
B17: Aaron Lennon | C17: 4500000
B18: Matthew Foulds | C18: 400000
B19: Shani Tarashaj | C19: 3000000
B20: Oumar Niasse | C20: 13500000
H27: PTS | I27: POS
C28: =SUM(C12:C27) -> 36200000 | F28: =SUM(F12:F27) -> 8500000 | G28: =C28-F28 -> 27700000
B29: Season 14/15
B30: Gareth Barry | C30: 2000000 | E30: Apostolos Vellios | F30: Released
B31: Muhamed Beić | C31: 4000000 | E31: Shane Duffy | F31: 1500000
B32: Romelu Lukaku | C32: 28000000 | E32: Magaye Gueye | F32: Free
B33: Brendan Galloway | C33: 4000000 | E33: Mason Springthorpe | F33: Released
B34: Samuel Eto'o | C34: Free | E34: Ibou Touray | F34: Released
E35: Hallam Hope | F35: Undisclosed
E36: Samuel Eto'o | F36: Free
E37: Matthew Kennedy | F37: Undisclosed
H40: PTS | I40: POS
C41: =SUM(C30:C40) -> 38000000 | F41: =SUM(F30:F40) -> 1500000 | G41: =C41-F41 -> 36500000 | H41: 47 | I41: 11
B42: Season 13/14
B43: Arouna Koné | C43: 6000000 | E43: Jake Bidwell | F43: Undisclosed
B44: Joel Robles | C44: 2000000 | E44: Jan Mucha. | F44: Released
B45: Antolín Alcaraz | C45: Free | E45: Johan Hammer, | F45: Released
B46: James Mc Carthy | C46: 13000000 | E46: Sam Kelly, | F46: Released
B47: Aiden McGeady | C47: 2500000 | E47: Thomas Hitzlsperger, | F47: Released
B48: Jindrich Stanek | C48: Undisclosed | E48: Phil Neville | F48: Retired
E49: Marouane Fellaini | F49: 27500000
E50: Victor Anichbe | F50: 6000000
E51: Nikica Jelavic | F51: 6500000
E52: John Heitinga | F52: Free | H52: Prem
H53: PTS | I53: POS
B54: Total | C54: =SUM(C43:C53) -> 23500000 | F54: =SUM(F43:F51) -> 40000000 | G54: =C54-F54 -> -16500000 | H54: 72 | I54: 5
B55: Season 12/13
B56: Steven Naismith | C56: Free | E56: Adam Forshaw | F56: Free
B57: Steven Pienaar | C57: 4500000 | E57: James Wallace | F57: Undisclosed
B58: Kevin Mirallas | C58: 6000000 | E58: João Silva | F58: 316000
B59: Bryan Oviedo | C59: 3500000 | E59: Joseph Yobo | F59: 2500000
B60: Mathew Kennedy | C60: nominal | E60: Tim Cahill | F60: 1000000
B61: Francisco Junior | C61: Free | E61: Jack Rodwell | F61: 15000000
B62: Thomas Hitzlsperger | C62: Free | E62: Conor Roberts | F62: Free
B63: John Stones | C63: 3000000 | E63: Anton Forrester | F63: Free | H63: Prem
H64: PTS | I64: POS
C65: =SUM(C56:C63) -> 17000000 | F65: =SUM(F56:F61) -> 18816000 | G65: =C65-F65 -> -1816000 | H65: 63 | I65: 6
B66: Season 11/12
B67: Darron Gibson | C67: 2000000 | E67: Hope Akpan | F67: Free
B68: Nikica Jelavic | C68: 6000000 | E68: James Vaughan | F68: Free
E69: Luke Dobie | F69: Free
E70: Kieran Agard | F70: Free
E71: Jermaine Beckford | F71: 4000000
E72: Mikel Arteta | F72: 10000000
E73: Yakubu Aiyegbeni | F73: 1500000
E74: Dinyar Bilyaletdinov | F74: 5000000 | H74: Prem
H75: PTS | I75: POS
B76: Total | C76: =SUM(C67:C72) -> 8000000 | F76: =SUM(F67:F74) -> 20500000 | G76: =C76-F76 -> -12500000 | H76: 56 | I76: 7
B77: Season 10/11
B78: Joao Silva | C78: 500000 | E78: John Ruddy | F78: Undisclosed
B79: Jermaine Beckford | C79: Free | E79: Lucas Jutkiewicz | F79: 200000
B80: Jan Mucha | C80: Free | E80: Dan Gosling | F80: Free
B81: Magaye Guaye | C81: 1000000 | E81: Steven Pienaar | F81: 3000000 | H81: Prem
B82: Apostolos Vellios | C82: Nominal | H82: PTS | I82: POS
B83: Total | C83: =SUM(C77:C81) -> 1500000 | F83: =SUM(F77:F81) -> 3200000 | G83: =C83-F83 -> -1700000 | H83: 54 | I83: 7
B84: Season 09/10
B85: Shkodran Mustafi | C85: Free | E85: Lars Jacobsen | F85: Free
B86: Anton Peterlin | C86: Nominal | E86: John Paul Kissock | F86: Signed
B87: Diniyar Bilyaletdinov | C87: 10000000 | E87: Joleon Lescott | F87: 22000000
B88: Sylvain Distin | C88: 4000000 | E88: Lucas Neill | F88: 800000
B89: Johnny Heitinga | C89: 6000000
B90: Lucas Neill | C90: Free | H90: Prem
B91: Luke Garbutt | C91: 600000 | H91: PTS | I91: POS
B92: Total | C92: =SUM(C85:C89) -> 20000000 | F92: =SUM(F85:F90) -> 22800000 | G92: =C92-F92 -> -2800000 | H92: 61 | I92: 8
B93: Season 08/09
B94: Lars Jacobsen | C94: Free | E94: Jamie Jones | F94: Free
B95: Louis Saha | C95: Free | E95: Andy Johnson | F95: 10500000
B96: Carlo Nash | C96: Undisclosed | E96: Aidan Downes | F96: Signed
B97: Marouane Fellani | C97: 15000000 | E97: Stefan Wessels | F97: Free | H97: Prem
B98: Steven Pienaar | C98: 2000500 | E98: Lee Molyneux | F98: Free | H98: PTS | I98: POS
B99: Seamus Coleman | C99: 150000
B100: Total | C100: =SUM(C94:C98) -> 17000500 | F100: =SUM(F94:F98) -> 10500000 | G100: =C100-F100 -> 6500500 | H100: 63 | I100: 5
B102: Season 07/08
B103: Dan Gosling | C103: 2000000 | E103: Lee Carsley | F103: Free
B104: Yakubu | C104: 11250000 | E104: Anderson De Silva | F104: Signed
B105: Stefan Wessels | C105: Free | E105: Alan Stubbs | F105: Free
B106: Leighton Baines | C106: 6000000 | E106: James McFadden | F106: 4750000
E107: James Beattie | F107: 4000000 | H107: Prem
E108: Scott Phelan | F108: Free | H108: PTS | I108: POS
B109: Total | C109: =SUM(C103:C108) -> 19250000 | F109: =SUM(F103:F108) -> 8750000 | G109: =C109-F109 -> 10500000 | H109: 65 | I109: 5
B111: Season 06/07
B112: Phil Jagielka | C112: 4000000 | E112: Gary Naysmith | F112: 1000000
B113: Lucas Jutkiewicz | C113: Signed | E113: Richard Wright | F113: Free
B114: Tim Howard | C114: 3000000 | E114: Mark Hughes | F114: Signed
E115: Simon Davies | F115: Signed
E116: David Weir | F116: Free
E117: Kevin Kilbane | F117: 2000000
E118: Li Tie | F118: Free
E119: Jay Harris | F119: Free | H119: Prem
H120: PTS | I120: POS
B121: Total | C121: =SUM(C112:C119) -> 7000000 | F121: =SUM(F112:F119) -> 3000000 | G121: =C121-F121 -> 4000000 | H121: 58 | I121: 6
B123: Season 05/06
B124: Joleon Lescott | C124: 5000000 | E124: Laurence Wilson | F124: Free
B125: Andy Johnson | C125: 8600000 | E125: Per Kroldrup | F125: Signed
B126: Alan Stubbs | C126: Free | E126: Marcus Bent | F126: 2500000
B127: Andy Van der Meyde | C127: 2000000 | E127: Alan Stubbs | F127: Free
B128: Nuno Valente | C128: 1500000 | E128: Eddy Bosnar | F128: Free
B129: Phil Neville | C129: 3500000 | E129: Steve Watson | F129: Free
B130: Mikel Arteta | C130: 2000000 | H130: Prem
B131: Per Kroldrup | C131: 5000000 | H131: PTS | I131: POS
B132: Total | C132: =SUM(C124:C131) -> 27600000 | F132: =SUM(F124:F131) -> 2500000 | G132: =C132-F132 -> 25100000 | H132: 50 | I132: 11
B134: Season 04/05
B135: Simon Davies | C135: 3500000 | E135: Daniel Fox | F135: Free
B136: John Ruddy | C136: 250000 | E136: Anthony Gerrard | F136: Free
B137: Guillaume Plessis | C137: Free | E137: Nick Chadwick | F137: 250000
B138: James Beattie | C138: 6000000 | E138: Thomas Gravesen | F138: 2450000
B139: Tim Cahill | C139: 1500000 | E139: Kevin Campbell | F139: Free
E140: Peter Clarke | F140: Free
E141: Wayne Rooney | F141: 27000000
E142: Scot Gemmill | F142: Free
E143: Michael Symes | F143: Free
E144: Steven Schumacher | F144: Free
E145: Tomasz Radzinski | F145: 1750000
E146: David Unsworth | F146: Free | H146: Prem
E147: Steve Simonsen | F147: Free | H147: PTS | I147: POS
B148: Total | C148: =SUM(C135:C147) -> 11250000 | F148: =SUM(F135:F147) -> 31450000 | G148: =C148-F148 -> -20200000 | H148: 61 | I148: 4
B150: Season 03/04
B151: Marcus Bent | C151: 450000 | E151: Paul Gerrard | F151: Free
B152: Kevin Kilbane | C152: 750000 | E152: Niclas Alexandersson | F152: Free
B153: Nigel Martyn | C153: Nominal | E153: Joey Jones | F153: Free
B154: James McFadden | C154: 1250000 | E154: Sean O'Hanlon | F154: 150000
B155: Li Tie | C155: Signed | E155: Mark Pembridge | F155: 500000
B156: Iain Turner | C156: Nominal | E156: Kevin McLeod | F156: 250000 | H156: Prem
E157: David Carney | F157: Free | H157: PTS | I157: POS
B158: Total | C158: =SUM(C151:C157) -> 2450000 | F158: =SUM(F151:F157) -> 900000 | G158: =C158-F158 -> 1550000 | H158: 39 | I158: 17
B160: Season 02/03
B161: Joseph Yobo | C161: 3500000 | E161: George Pilkington | F161: Free
B162: Espen Baardsen | C162: Free | E162: Andrew Pettinger | F162: Free
B163: Rodrigo | C163: 1250000 | E163: Keith Southern | F163: Nominal
B164: Richard Wright | C164: 3500000 | E164: David Eaton | F164: Free
E165: Idan Tal | F165: Signed
E166: Jesper Blomqvist | F166: Free | H166: Prem
E167: Ryan Valentine | F167: Free | H167: PTS | I167: POS
B168: Total | C168: =SUM(C161:C167) -> 8250000 | F168: =SUM(F161:F167) -> 0 | G168: =C168-F168 -> 8250000 | H168: 59 | I168: 7
B170: Season 01/02
B171: Lee Carsley | C171: 1900000 | E171: Tom Kearney | F171: Free
B172: David Ginola | C172: Free | E172: Paul Gascoigne | F172: Free
B173: Tobias Linderoth | C173: 2500000 | E173: Danny Cadamarteri | F173: Free
B174: Jesper Blomqvist | C174: Free | E174: Abel Xavier | F174: 800000
B175: Tomasz Radzinski | C175: 4500000 | E175: Thomas Myhre | F175: 375000
B176: Alan Stubbs | C176: Free | E176: Michael Ball | F176: 6500000
E177: Peter Degn | F177: Signed
E178: Phil Jevons | F178: 250000 | H178: Prem
E179: Stephen Hughes | F179: Free | H179: PTS | I179: POS
B180: Total | C180: =SUM(C171:C179) -> 8900000 | F180: =SUM(F171:F179) -> 7925000 | G180: =C180-F180 -> 975000 | H180: 43 | I180: 15
B182: Season 00/01
B183: Idan Tal | C183: 700000 | E183: Francis Jeffers | F183: 8000000
B184: Gary Naysmith | C184: 1750000 | E184: Jamie Milligan | F184: Free
B185: Duncan Ferguson | C185: 3750000 | E185: Mark Hughes | F185: Free
B186: Thomas Gravesen | C186: 2500000 | E186: Richard Dunne | F186: 3000000
B187: Niclas Alexandersson | C187: 2000000 | E187: Nick Barmby | F187: 6000000
B188: Paul Gascoigne | C188: Free | E188: John Collins | F188: 2000000
B189: Alex Nyarko | C189: 4500000 | E189: Don Hutchison | F189: 2500000 | H189: Prem
B190: Steve Watson | C190: 2500000 | E190: Mitch Ward | F190: 200000 | H190: PTS | I190: POS
B191: Total | C191: =SUM(C183:C190) -> 17700000 | F191: =SUM(F183:F190) -> 21700000 | G191: =C191-F191 -> -4000000 | H191: 42 | I191: 16
B193: Season 99/00
B194: Andrew Pettinger | C194: 45000 | E194: Carl Regan | F194: Free
B195: Alessandro Pistone | C195: 3000000 | E195: Dean Delaney | F195: Free
B196: Mark Hughes | C196: Free | E196: Slaven Bilic | F196: Free
B197: Stephen Hughes | C197: 3000000 | E197: Terry Phelan | F197: Free
B198: Joe-Max Moore | C198: Free | E198: Michael Branch | F198: 500000
B199: Abel Xavier | C199: 1500000 | E199: Tony Grant | F199: 450000
B200: Mark Pembridge | C200: 800000 | E200: John O'Kane | F200: Free
B201: Kevin Campbell | C201: 3000000 | E201: Gareth Farrelly | F201: Free
E202: Wayne McDermott | F202: Non-contract
E203: John Oster | F203: 1000000
E204: David Poppleton | F204: Signed
E205: Mick O'Brien | F205: Free
E206: Craig Short | F206: 1700000
E207: Marco Materazzi | F207: 3000000
E208: Olivier Dacourt | F208: 6500000
E209: Adam Eaton | F209: 5000 | H209: Prem
E210: Ibrahim Bakayoko | F210: 4000000 | H210: PTS | I210: POS
B211: Total | C211: =SUM(C194:C210) -> 11345000 | F211: =SUM(F194:F210) -> 17155000 | G211: =C211-F211 -> -5810000 | H211: 50 | I211: 13
B213: Season 98/99
B214: Richard Gough | C214: Free | E214: John Spencer | F214: Unknown
B215: Scot Gemmill | C215: Nominal | E215: Michael Madar | F215: Signed
B216: Peter Degn | C216: Signed | E216: Tony Thomas | F216: 150000
B217: David Weir | C217: 200000 | E217: Gavin McCann | F217: 500000
B218: Ibrahim Bakayoko | C218: 4500000 | E218: Duncan Ferguson | F218: 7000000
B219: Steve Simonsen | C219: 3300000 | E219: Carl Tiler | F219: 700000
B220: David Unsworth | C220: 3000000 | E220: Graham Allen | F220: Free
B221: John Collins | C221: 2500000 | E221: Lars Christian Jacobsen | F221: Free
B222: Olivier Dacourt | C222: 4000000 | H222: Prem
B223: Marco Materazzi | C223: 2800000 | H223: PTS | I223: POS
B224: Total | C224: =SUM(C214:C223) -> 20300000 | F224: =SUM(F214:F223) -> 8350000 | G224: =C224-F224 -> 11950000 | H224: 43 | I224: 14
B226: Season 97/98
B227: Alex Cleland | C227: Free | E227: Chris Lane | F227: Free
B228: John Spencer | C228: 1500000 | E228: Neville Southall | F228: Free
B229: Matthew McKay | C229: Signed | E229: Claus Thomsen | F229: 500000
B230: Don Hutchison | C230: 1000000 | E230: Jon O'Connor | F230: Transfer
B231: John O'Kane | C231: 400000 | E231: Earl Barrett | F231: Free
B232: Michael Madar | C232: Free | E232: John Hills | F232: Signed
B233: Carl Tiler | C233: 750000 | E233: Gary Speed | F233: 5500000
B234: Mitch Ward | C234: 750000 | E234: Andy Hinchcliffe | F234: 3000000
B235: Thomas Myhre | C235: 800000 | E235: Graham Stuart | F235: 500000
B236: Danny Williamson | C236: Swap | E236: David Unsworth | F236: Swap
B237: Tony Thomas | C237: 400000 | H237: Prem
B238: John Oster | C238: 1500000 | H238: PTS | I238: POS
B239: Total | C239: =SUM(C227:C238) -> 7100000 | F239: =SUM(F227:F238) -> 9500000 | G239: =C239-F239 -> -2400000 | H239: 40 | I239: 17
B241: Season 96/97
B242: Gareth Farrelly | C242: Transfer | E242: James Speare | F242: Non-contract
B243: Slaven Bilic | C243: 4500000 | E243: John Ebbrell | F243: 1000000
B244: Claus Thomsen | C244: 900000 | E244: Andrei Kanchelskis | F244: 8000000
B245: Terry Phelan | C245: 850000 | E245: Anders Limpar | F245: 100000
B246: Nick Barmby | C246: 5750000 | E246: Neill Moore | F246: Free
E247: Matt Jackson | F247: 450000
E248: Peter Holcroft | F248: Free
E249: Jason Kearton | F249: Free | H249: Prem
E250: Mattie Woods | F250: Free | H250: PTS | I250: POS
B251: Total | C251: =SUM(C242:C250) -> 12000000 | F251: =SUM(F242:F250) -> 9550000 | G251: =C251-F251 -> 2450000 | H251: 42 | I251: 15
B253: Season 95/96
B254: Paul Gerrard | C254: 1000000 | E254: Gary Ablett | F254: 390000
B255: Gary Speed | C255: 3500000 | E255: Barry Horne | F255: 250000
B256: John Hills | C256: 0 | E256: Stuart Barlow | F256: 350000
B257: Andrei Kanchelskis | C257: 5000000 | H257: Prem
B258: Craig Short | C258: 2400000 | H258: PTS | I258: POS
B259: Total | C259: =SUM(C254:C258) -> 11900000 | F259: =SUM(F254:F258) -> 990000 | G259: =C259-F259 -> 10910000 | H259: 61 | I259: 6
B261: Season 94/95
B262: Earl Barrett | C262: 1700000 | E262: Gary Rowett | F262: 300000
B263: Duncan Ferguson | C263: 4000000 | E263: Brett Angell | F263: 600000
B264: David Burrows | C264: Transfer | E264: David Burrows | F264: 1100000
B265: Daniel Amokachi | C265: 3000000 | E265: Ian Snodin | F265: Free
B266: Vinny Samways | C266: 2200000 | E266: Tony Cottee | F266: Transfer | H266: Prem
E267: John Doolan | F267: Free | H267: PTS | I267: POS
B268: Total | C268: =SUM(C262:C267) -> 10900000 | F268: =SUM(F262:F267) -> 2000000 | G268: =C268-F268 -> 8900000 | H268: 50 | I268: 15
B270: Season 93/94
B271: Anders Limpar | C271: 1600000 | E271: Paul Tait | F271: Free
B272: Brett Angell | C272: 500000 | E272: Peter Beagrie | F272: 1100000
B273: Joe Parkinson | C273: 250000 | E273: Mark Ward | F273: 500000
B274: Graham Stuart | C274: 850000 | E274: Mo Johnston | F274: Signed
E275: Iain Jenkins | F275: Free | H275: Prem
E276: Kevin Ratcliffe | F276: Free | H276: PTS | I276: POS
B277: Total | C277: =SUM(C271:C276) -> 3200000 | F277: =SUM(F272:F276) -> 1600000 | G277: =C277-F277 -> 1600000 | H277: 44 | I277: 17
B279: Season 92/93
B280: Paul Holmes | C280: 100000 | E280: Peter Beardsley | F280: 1400000 | H280: Prem
B281: Paul Rideout | C281: 500000 | E281: Martin Keown | F281: 2000000 | H281: PTS | I281: POS
B282: Season Total | C282: =SUM(C280:C281) -> 600000 | F282: =SUM(F280:F281) -> 3400000 | G282: =C282-F282 -> -2800000 | H282: 53 | I282: 13