B2: Season 91/92 to date | C2: =C23 -> 487065000 | F2: =F23 -> 304875000 | G2: =C2-F2 -> 182190000 | H2: =SUM(G24:G329) -> 182190000 | I2: =G2-H2 -> 0
B3: Season 03/04 to date | C3: =C184+C167+C154+C143+C129+C118+C108+C100+C93+C83+C71+C58+C42 -> 301100000 | F3: =F184+F167+F154+F143+F129+F118+F108+F100+F93+F83+F71+F58+F42 -> 215550000 | G3: =C3-F3 -> 85550000 | H3: =SUM(G24:G184) -> 85550000 | I3: =G3-H3 -> 0
B4: last five seasons | C4: =C93+C83+C71+C58+C42 -> 164500000 | F4: =F93+F83+F71+F58+F42 -> 68150000 | G4: =C4-F4 -> 96350000 | H4: =SUM(G24:G93) -> 96350000 | I4: =G4-H4 -> 0
B5: Championship 04/05 | C5: =C167+C154+C143+C129+C118+C108+C100+C93+C83+C71+C58+C42 -> 297500000 | F5: =F167+F154+F143+F129+F118+F108+F100+F93+F83+F71+F58+F42 -> 212050000 | G5: =C5-F5 -> 85450000 | H5: =SUM(G24:G167) -> 85450000 | I5: =G5-H5 -> 0
B7: Before Ashley Buyout | C7: =SUM(C328+C317+C304+C290+C282+C273+C250+C238+C223+C208+C196+C184+C167+C154+C143) -> 262265000 | F7: =SUM(F328+F317+F304+F290+F282+F273+F250+F238+F223+F208+F196+F184+F167+F154+F143) -> 133075000 | G7: =C7-F7 -> 129190000 | H7: =SUM(G143:G329) -> 129190000 | I7: =G7-H7 -> 0
B8: After Ashley Buyout | C8: =C129+C118+C108+C100+C93+C83+C71+C58+C42 -> 224800000 | F8: =F129+F118+F108+F100+F93+F83+F71+F58+F42 -> 171800000 | G8: =C8-F8 -> 53000000 | H8: =SUM(G24:G129) -> 53000000 | I8: =G8-H8 -> 0
B9: Kevin Keegan (92 - jan 96/97) | C9: =C328+C317+C304+C290+C282 -> 59195000 | F9: =F328+F317+F304+F290+F282 -> 25275000 | G9: =C9-F9 -> 33920000 | H9: =SUM(G282:G329) -> 33920000 | I9: =G9-H9 -> 0
B10: Kenny Dalglish jan 97- 97/98 | C10: =C273 -> 22370000 | F10: =F273 -> 16600000 | G10: =C10-F10 -> 5770000 | H10: =G273 -> 5770000 | I10: =G10-H10 -> 0
B11: Ruud Gullit (98/99) | C11: =C250 -> 22550000 | F11: =F250 -> 14550000 | G11: =C11-F11 -> 8000000 | H11: =G250 -> 8000000 | I11: =G11-H11 -> 0
B12: Bobbby Robson (99/00 - 30 aug 03/04) | C12: =C238+C223+C208+C196+C184 -> 85450000 | F12: =F238+F223+F208+F196+F184 -> 36400000 | G12: =C12-F12 -> 49050000 | H12: =SUM(G184:G238) -> 49050000 | I12: =G12-H12 -> 0
B13: Graham Souness (sep 04 - 05/06) | C13: =C167+C154 -> 52800000 | F13: =F167+F154 -> 31250000 | G13: =C13-F13 -> 21550000 | H13: =SUM(G154:G167) -> 21550000 | I13: =G13-H13 -> 0
B14: Glen Roeder 06/07 | C14: =C143 -> 19900000 | F14: =F143 -> 9000000 | G14: =C14-F14 -> 10900000 | H14: =SUM(G132:G143) -> 10900000 | I14: =G14-H14 -> 0
B15: Sam Allerdyce (May 07 - jan 08) | C15: =SUM(C123:C127) -> 12500000 | F15: =SUM(F124:F127) -> 8000000 | G15: =C15-F15 -> 4500000 | H15: 4500000 | I15: =G15-H15 -> 0
B16: Kevin Keegan (jan 08 - sept 08) | C16: 26250000 | F16: 26250000 | G16: =C16-F16 -> 0 | H16: 0 | I16: =G16-H16 -> 0
B17: Joe Kinnear 08/09 | C17: 4000000 | F17: 14000000 | G17: =C17-F17 -> -10000000 | H17: -10000000 | I17: =G17-H17 -> 0
B18: Chris Hughton (may 09 - Dec 10) | C18: =C108+C100-C99 -> 6000000 | F18: =F108 -> 25500000 | G18: =C18-F18 -> -19500000 | H18: =G108+C100-C99 -> -19500000 | I18: =G18-H18 -> 0
B19: Alan Pardew (Dec 10 to Jan 15) | C19: =C83+C93+C99+C71+C58+C42 -> 170250000 | F19: =F83+F93+F95+F71+F58+F42 -> 103150000 | G19: =C19-F19 -> 67100000 | H19: =SUM(G24:G93)+C99-F95 -> 67100000 | I19: =G19-H19 -> 0
B20: Steve Mc Claren (Jan 2015 to Date) | C20: =C42 -> 75200000 | F20: =F42 -> 2050000 | G20: =C20-F20 -> 73150000 | H20: =G20/1 -> 73150000 | I20: =G20-H20 -> 0
B22: Newcastle United
B23: Combined Totals | C23: =C328+C317+C304+C290+C282+C273+C250+C238+C223+C208+C196+C184+C167+C154+C143+C129+C118+C108+C100+C93+C83+C71+C58+C42 -> 487065000 | F23: =F328+F317+F304+F290+F282+F273+F250+F238+F223+F208+F196+F184+F167+F154+F143+F129+F118+F108+F100+F93+F83+F71+F58+F42 -> 304875000 | G23: =SUM(G24:G329) -> 182190000 | H23: =SUM(H24:H329) -> 1302
B24: Players Purchased | C24: Fee | E24: Players Sold | F24: Fee | G24: Net Total | H24: Points | I24: Position
B25: Season 15/16
B26: Georginio Wijnaldum | C26: 14500000 | E26: Jak Alnwick | F26: Released
B27: Aleksandar Mitrović | C27: 13000000 | E27: Adam Campbell | F27: Released
B28: Chancel Mbemba | C28: 6900000 | E28: Jonas Gutierrez | F28: Released
B29: Ivan Toney | C29: 300000 | E29: Ryan Taylor | F29: Released
B30: Florian Thauvin | C30: 12000000 | E30: Remie Streete | F30: Free
B31: Henri Saivet | C31: 4500000 | E31: Mehdi Abeid | F31: 1500000
B32: Jonjo Shelvey | C32: 12000000 | E32: Oliver Kemen | F32: 550000
B33: Andros Townsend | C33: 12000000 | E33: Shane Ferguson | F33: Undisclosed
E34: Mike Williamson | F34: Nominal
H41: PTS | I41: POS
C42: =SUM(C26:C35) -> 75200000 | F42: =SUM(F26:F41) -> 2050000 | G42: =C42-F42 -> 73150000
B43: Season 14/15
B44: Jack Colback | C44: Free | E44: Dan Gosling | F44: Free
B45: Ayoze | C45: 1600000 | E45: Jonathan Mitchell | F45: Free
B46: Siem de Jong | C46: 6000000 | E46: Conor Newton | F46: Free
B47: Rémy Cabella | C47: 12000000 | E47: James Tavernier | F47: 900000
B48: Emmanuel Rivière | C48: 6300000 | E48: Shola Ameobi | F48: Released
B49: Daryl Janmaat | C49: 5000000 | E49: Mathieu Debuchy | F49: 12000000
B50: Karl Darlow | C50: 3500000 | E50: Romain Amalfitano | F50: Free
B51: Jamaal Lascelles | C51: 3500000 | E51: Steven Logan | F51: Undisclosed
E52: Brandon Miele | F52: Released
E53: Jonathan Mitchell | F53: Released
E54: Michael Richardson | F54: Released
E55: Mapou Yanga-Mbiwa | F55: 5000000
E56: Hatem Ben Arfa | F56: Released | H56: PTS | I56: POS
E57: Davide Santon | F57: 2800000
C58: =SUM(C44:C54) -> 37900000 | F58: =SUM(F44:F57) -> 20700000 | G58: =C58-F58 -> 17200000 | H58: 39 | I58: 15
B59: Season 13/14
B60: Olivier Kemen | C60: Undisclosed | E60: Danny Simpson | F60: Released
B61: Loïc Remy | C61: 2000000 | E61: Steve Harper | F61: Released
E62: Yven Moyo | F62: Released
E63: James Perch | F63: 1000000
E64: Brad Inman | F64: 100000
E65: Yohan Cabaye | F65: 20000000
H69: Prem
H70: PTS | I70: POS
B71: Total | C71: =SUM(C60:C70) -> 2000000 | F71: =SUM(F60:F70) -> 21100000 | G71: =C71-F71 -> -19100000 | H71: 49 | I71: 10
B72: Season 12/13
B73: Romain Amalfitano | C73: Free | E73: Daniel Taylor | F73: Free
B74: Gael Bigirimana | C74: 1000000 | E74: Leon Best | F74: 3000000
B75: Vurnon Anita | C75: 6700000 | E75: Danny Guthrie | F75: Free
B76: Curtis Good | C76: 400000 | E76: Fraser Forster | F76: 2000000
B77: Mathieu Debuchy | C77: 5500000 | E77: Peter Lövenkrands | F77: Free
B78: Mapou Yanga-Mbiwa | C78: 6700000 | E78: Alan Smith | F78: Free
B79: Massadio Haidara | C79: 2000000 | E79: Ryan Donaldson | F79: Released | H79: Prem
B80: Moussa Sissoko | C80: 2500000 | E80: Tamas Kadar | F80: Released | H80: PTS | I80: POS
B81: Kevin Mbabu | C81: Undisclosed | E81: Demba Ba | F81: 7500000
B82: Yoan Gouffran | C82: 1200000
B83: Total | C83: =SUM(C73:C82) -> 26000000 | F83: =SUM(F73:F81) -> 12500000 | G83: =C83-F83 -> 13500000
B84: Season 11/12
B85: Mehdi Abeid | C85: Free | E85: Kevin Nolan | F85: 3500000
B86: Sylvain Marveaux | C86: Free | E86: Patrick McLaughlin | F86: Free
B87: Yohan Cabaye | C87: 5000000 | E87: Daniel Leadbitter | F87: Free
B88: Demba Ba | C88: Free | E88: Ben Tozer | F88: Free
B89: Gabriel Obertan | C89: 3000000 | E89: Sanchez Jose Enrique | F89: 6300000
B90: Davide Santon | C90: 5300000 | E90: Joey Barton | F90: Free
B91: Robert Elliot | C91: 100000 | E91: Wayne Routledge | F91: 2000000 | H91: Prem
B92: Papiss Demba Cisse | C92: 10000000 | H92: PTS | I92: POS
B93: Total | C93: =SUM(C85:C92) -> 23400000 | F93: =SUM(F85:F91) -> 11800000 | G93: =C93-F93 -> 11600000 | H93: 65 | I93: 5
B94: Season 10/11
B95: James Perch | C95: 1000000 | E95: Andrew Carroll | F95: 35000000
B96: Dan Gosling | C96: Free
B97: Sol Campbell | C97: Free
B98: Ismael Tioté | C98: 3500000 | H98: Prem
B99: Hatem Ben Arfa | C99: 5750000 | H99: PTS | I99: POS
B100: Total | C100: =SUM(C95:C99) -> 10250000 | F100: =SUM(F94:F98) -> 35000000 | G100: =C100-F100 -> -24750000 | H100: 45 | I100: 12
B101: Season 09/10
B102: Francisco Tejada | C102: Signed | E102: David Edgar | F102: undisclosed
B103: Danny Simpson | C103: 500000 | E103: Michael Owen | F103: Free
B104: Mike Williamson | C104: 1000000 | E104: Sebastien Bassong | F104: 10000000
B105: Wayne Routledge | C105: Undisclosed | E105: Obafemi Martins | F105: 9000000
B106: Leon Best | C106: Undisclosed | E106: Habib Beye | F106: 2500000
E107: Damien Duff | F107: 4000000 | H107: PTS | I107: POS
B108: Total | C108: =SUM(C102:C107) -> 1500000 | F108: =SUM(F102:F107) -> 25500000 | G108: =C108-F108 -> -24000000 | H108: 102 | I108: 1
B109: Season 08/09
B110: Sebastian Bassong kk | C110: 500000 | E110: Emre kk | F110: 4000000
B111: Jonas Gutierrez kk | C111: 7000000 | E111: Abdoulaye Faye kk | F111: 2250000
B112: Danny Gutherie kk | C112: 2500000 | E112: James Milner kk | F112: 12000000
B113: Fabrizio Coloccini kk | C113: 10300000 | E113: Shay Given Jk | F113: 8000000
B114: Xisco kk | C114: 5700000 | E114: Charles N'ZogbiaJK | F114: 6000000
B115: Peter Lovenkrands jk | C115: Free | E115: Lamine Diatta Jk | F115: Free
B116: Kevin Nolan jk | C116: 4000000 | H116: Prem
B117: Ryan Taylor jk | C117: Free | H117: PTS | I117: POS
B118: Total | C118: =SUM(C110:C117) -> 30000000 | F118: =SUM(F110:F117) -> 32250000 | G118: =C118-F118 -> -2250000 | H118: 34 | I118: 18
B120: Season 07/08
B121: Lamine Diatta kk | C121: Free | E121: David Rozehnal | F121: 2900000
B122: Ben Tozer kk | C122: 250000 | E122: Peter Ramage | F122: Free
B123: Abdoulaye Faye | C123: Signed | E123: Matty Pattison | F123: Signed
B124: Habib Beye | C124: Signed | E124: Nolberto Solano kk | F124: Free
B125: Jose Enrique | C125: 6500000 | E125: Paul Huntington kk | F125: Signed
B126: Claudio Cacapa | C126: Free | E126: Alberto Luque kk | F126: 2000000
B127: Alan Smith | C127: 6000000 | E127: Kieron Dyer kk | F127: 6000000 | H127: Prem
B128: Joey Barton | C128: 5800000 | E128: Stephen Carr | F128: Free | H128: PTS | I128: POS
B129: Total | C129: =SUM(C121:C128) -> 18550000 | F129: =SUM(F121:F128) -> 10900000 | G129: =C129-F129 -> 7650000 | H129: 43 | I129: 12
B131: Season 06/07
B132: Geremi | C132: Free | E132: Alan O'Brien | F132: Signed
B133: David Rozehnal | C133: 2900000 | E133: Scott Parker | F133: 7000000
E134: Antoine Sibierski | F134: Free
B135: Mark Viduka | C135: Free | E135: Titus Bramble | F135: Free
B136: Olivier Bernard | C136: Free | E136: Liam Atkin | F136: Free
B137: Antoine Sibierski | C137: 2000000 | E137: Jean-Alain Boumsong | F137: Signed
B138: Obafemi Martins | C138: 10000000 | E138: Martin Brittain | F138: Free
B139: Damien Duff | C139: 5000000 | E139: Amdy Faye | F139: 2000000
E140: Robbie Elliott | F140: Monthly
E141: Daryl Smylie | F141: Signed | H141: Prem
E142: Allan Picken | F142: Free | H142: PTS | I142: POS
B143: Total | C143: =SUM(C132:C141) -> 19900000 | F143: =SUM(F132:F142) -> 9000000 | G143: =C143-F143 -> 10900000 | H143: 43 | I143: 13
B145: Season 05/06
B146: Nolberto Solano | C146: 1500000 | E146: Michael Chopra | F146: Free
B147: Michael Owen | C147: 16000000 | E147: Lee Bowyer | F147: Signed
B148: Alberto Luque | C148: 9500000 | E148: Laurent Robert | F148: Free
B149: Lee Clark | C149: Free | E149: Jermaine Jenas | F149: 7000000
B150: Emre | C150: 3800000 | E150: Jamie McClen | F150: Free
B151: Craig Moore | C151: Free | E151: Darren Ambrose | F151: Signed
E152: Craig Bellamy | F152: 5000000 | H152: Prem
E153: Marc Walton | F153: Free | H153: PTS | I153: POS
B154: Total | C154: =SUM(C146:C153) -> 30800000 | F154: =SUM(F146:F153) -> 12000000 | G154: =C154-F154 -> 18800000 | H154: 58 | I154: 7
B156: Season 04/05
B157: Scott Parker | C157: 6500000 | E157: Patrick Kluivert | F157: Free
B158: Amdy Faye | C158: 2000000 | E158: Andy O'Brien | F158: 2000000
B159: Jean-Alain Boumsong | C159: 8000000 | E159: Aaron Hughes | F159: 1000000
B160: Celestine Babayaro | C160: 1000000 | E160: Lewis Guy | F160: Free
B161: Ronny Johnsen | C161: Free | E161: Olivier Bernard | F161: 400000
B162: Stephen Carr | C162: 2000000 | E162: Jonathan Woodgate | F162: 13400000
B163: Charles N'Zogbia | C163: Signed | E163: Gary Speed | F163: 750000
B164: Nicky Butt | C164: 2500000 | E164: Lomano LuaLua | F164: 1700000
B165: Patrick Kluivert | C165: Free | E165: Andy Ferrell | F165: Free | H165: Prem
E166: Bradley Orr | F166: Free | H166: PTS | I166: POS
B167: Total | C167: =SUM(C157:C166) -> 22000000 | F167: =SUM(F157:F166) -> 19250000 | G167: =C167-F167 -> 2750000 | H167: 44 | I167: 14
B169: Season 03/04
B170: James Milner | C170: 3600000 | E170: Adam Collin | F170: Signed
B171: Lee Bowyer | C171: Free | E171: Brian Kerr | F171: Free
E172: Stephen Caldwell | F172: Free
E173: Calvin Zola | F173: Free
E174: Andy Griffin | F174: Free
E175: Chris Carr | F175: Free
E176: Gary Caldwell | F176: Free
E177: Nolberto Solano | F177: 1500000
E178: Carl Cort | F178: 2000000
E179: Nikos Dabizas | F179: Free
E180: Jonny Brain | F180: Free
E181: James Beaumont | F181: Signed
E182: Ross Gardner | F182: Signed | H182: Prem
E183: Joe Kendrick | F183: Free | H183: PTS | I183: POS
B184: Total | C184: =SUM(C170:C183) -> 3600000 | F184: =SUM(F170:F183) -> 3500000 | G184: =C184-F184 -> 100000 | H184: 56 | I184: 5
B186: Season 02/03
B187: Darren Ambrose | C187: 1000000 | E187: Aaron Labonte | F187: Free
B188: Tony Caig | C188: Free | E188: Christian Bassedas | F188: Free
B189: Jonathan Woodgate | C189: 9000000 | E189: Stuart Green | F189: 150000
B190: Titus Bramble | C190: 5000000 | E190: Steven Istead | F190: Free
E191: Colin McMenamin | F191: Free
E192: David Cowan | F192: Free
E193: Ryan McGuffie | F193: Free
E194: Karl Colley | F194: Signed | H194: Prem
E195: James Coppinger | F195: Signed | H195: PTS | I195: POS
B196: Total | C196: =SUM(C187:C195) -> 15000000 | F196: =SUM(F187:F195) -> 150000 | G196: =C196-F196 -> 14850000 | H196: 69 | I196: 3
B198: Season 01/02
B199: Hugo Viana | C199: 8500000 | E199: Mark Boyd | F199: Free
B200: Jermaine Jenas | C200: 5000000 | E200: David Beharall | F200: 150000
B201: Laurent Robert | C201: 9500000 | E201: Rob Lee | F201: 250000
B202: Robbie Elliott | C202: Free | E202: Warren Barton | F202: Nominal
B203: Craig Bellamy | C203: 6000000 | E203: Steve Grindlay | F203: Free
E204: Kevin Gallacher | F204: Free
E205: Peter Wright | F205: Free
E206: Des Hamilton | F206: Free | H206: Prem
E207: Stephen Glass | F207: Free | H207: PTS | I207: POS
B208: Total | C208: =SUM(C199:C207) -> 29000000 | F208: =SUM(F199:F207) -> 400000 | G208: =C208-F208 -> 28600000 | H208: 71 | I208: 4
B210: Season 00/01
B211: Andy O'Brien | C211: 2000000 | E211: Kevin Gall | F211: Free
B212: Wayne Quinn | C212: 800000 | E212: Alain Goma | F212: 4000000
B213: Clarence Acuna | C213: 1000000 | E213: Garry Brady | F213: Free
B214: Pedro Dimas | C214: Free | E214: Didier Domi | F214: 4000000
B215: Lomano LuaLua | C215: 2250000 | E215: Laurent Charvet | F215: 1000000
B216: Olivier Bernard | C216: Free | E216: Duncan Ferguson | F216: 3750000
B217: Carl Cort | C217: 7000000 | E217: Steve Howey | F217: 2000000
E218: Temuri Ketsbaia | F218: 900000
E219: Lionel Perez | F219: Free
E220: Silvio Maric | F220: Signed
E221: Paul Robinson | F221: 1500000 | H221: Prem
E222: Stuart Elliott | F222: Free | H222: PTS | I222: POS
B223: Total | C223: =SUM(C211:C222) -> 13050000 | F223: =SUM(F211:F222) -> 17150000 | G223: =C223-F223 -> -4100000 | H223: 51 | I223: 11
B225: Season 99/00
B226: Daniel Cordone | C226: 500000 | E226: Alessandro Pistone | F226: 3000000
B227: Christian Bassedas | C227: 3500000 | E227: David Cunningham | F227: Free
B228: Diego Gavilan | C228: 2000000 | E228: Paul Arnison | F228: Free
B229: Kevin Gallacher | C229: 500000 | E229: Paul Talbot | F229: Free
B230: Fumaca | C230: Signed | E230: Franck Dumas | F230: 1100000
B231: John Karelse | C231: 800000 | E231: Jordan Tait | F231: Free
B232: Jonny Brain | C232: Signed | E232: Andreas Andersson | F232: 2000000
B233: Kieron Dyer | C233: 6500000 | E233: Stuart Pearce | F233: Free
B234: Franck Dumas | C234: 500000 | E234: Philippe Albert | F234: 600000
B235: Elena Marcelino | C235: 5800000 | E235: Dietmar Hamann | F235: 8000000
B236: Alain Goma | C236: 4700000 | E236: George Georgiadis | F236: 500000 | H236: Prem
E237: Peter Keen | F237: Free | H237: PTS | I237: POS
B238: Total | C238: =SUM(C226:C237) -> 24800000 | F238: =SUM(F226:F237) -> 15200000 | G238: =C238-F238 -> 9600000 | H238: 52 | I238: 11
B240: Season 98/99
B241: Silvio Maric | C241: 3300000 | E241: Paddy Kelly | F241: Free
B242: Didier Domi | C242: 4000000 | E242: Paul Dalglish | F242: 300000
B243: Duncan Ferguson | C243: 7000000 | E243: David Terrier | F243: Free
B244: Nolberto Solano | C244: 2480000 | E244: Paul Barrett | F244: Free
B245: Dietmar Hamann | C245: 5250000 | E245: John Barnes | F245: Free
B246: Laurent Charvet | C246: 520000 | E246: Keith Gillespie | F246: 2350000
E247: David Batty | F247: 4400000
E248: Stephane Guivarc'h | F248: 3500000 | H248: Prem
E249: Steve Watson | F249: 4000000 | H249: PTS | I249: POS
B250: Total | C250: =SUM(C241:C249) -> 22550000 | F250: =SUM(F241:F249) -> 14550000 | G250: =C250-F250 -> 8000000 | H250: 46 | I250: 13
B252: Season 97/98
B253: Carl Serrant | C253: 500000 | E253: Shaka Hislop | F253: Free
B254: Garry Brady | C254: Free | E254: Darren Peacock | F254: Free
B255: Stephen Glass | C255: 650000 | E255: Jon Dahl Tomasson | F255: 2500000
B256: Lionel Perez | C256: Free | E256: Jimmy Crawford | F256: 50000
B257: Stephane Guivarc'h | C257: 3500000 | E257: Paul Brayson | F257: 100000
B258: George Georgiadis | C258: 420000 | E258: John Beresford | F258: 1500000
B259: James Coppinger | C259: 250000 | E259: Faustino Asprilla | F259: 6000000
B260: Paul Robinson | C260: 250000 | E260: Peter Beardsley | F260: 450000
B261: Nikos Dabizas | C261: 2000000 | E261: Les Ferdinand | F261: 6000000
B262: Gary Speed | C262: 5500000
B263: Andy Griffin | C263: 1500000
B264: Andreas Andersson | C264: 3000000
B265: Paul Dalglish | C265: Free
B266: Ian Rush | C266: Free
B267: John Barnes | C267: Free
B268: Paddy Kelly | C268: Signed
B269: Bjarni Gudjonsson | C269: 500000
B270: Brian Pinas | C270: Free
B271: Stuart Pearce | C271: Free | H271: Prem
B272: Alessandro Pistone | C272: 4300000 | H272: PTS | I272: POS
B273: Total | C273: =SUM(C253:C272) -> 22370000 | F273: =SUM(F253:F272) -> 16600000 | G273: =C273-F273 -> 5770000 | H273: 44 | I273: 13
B275: Season 96/97
B276: Temuri Ketsbaia | C276: Free | E276: David Ginola | F276: 2000000
B277: Jon Dahl Tomasson | C277: 2200000 | E277: Robbie Elliott | F277: 2500000
B278: Shay Given | C278: 1500000 | E278: Lee Clark | F278: 2500000
B279: Des Hamilton | C279: 1500000 | E279: Paul Kitson | F279: 2300000
E280: Darren Huckerby | F280: 1000000 | H280: Prem
E281: Jimmy Garrity | F281: Free | H281: PTS | I281: POS
B282: Total | C282: =SUM(C276:C281) -> 5200000 | F282: =SUM(F276:F281) -> 10300000 | G282: =C282-F282 -> -5100000 | H282: 68 | I282: 2
B284: Season 95/96
B285: Alan Shearer | C285: 15000000 | E285: Steven Paris | F285: Signed
B286: Faustino Asprilla | C286: 6700000 | E286: Scott Sellars | F286: 750000
B287: Shaka Hislop | C287: 1580000
B288: Jimmy Garrity | C288: Trainee | H288: Prem
B289: Les Ferdinand | C289: 6000000 | H289: PTS | I289: POS
B290: Total | C290: =SUM(C285:C289) -> 29280000 | F290: =SUM(F285:F288) -> 750000 | G290: =C290-F290 -> 28530000 | H290: 78 | I290: 2
B292: Season 94/95
B293: David Ginola | C293: 2500000 | E293: Sam Aiston | F293: Free
B294: Warren Barton | C294: 4000000 | E294: Gareth McAlindon | F294: Free
B295: Jimmy Crawford | C295: 75000 | E295: Mike Jeffrey | F295: 100000
B296: Keith Gillespie | C296: 1000000 | E296: Alan Neilson | F296: 750000
B297: Paul Kitson | C297: 2250000 | E297: Barry Venison | F297: 750000
B298: Philippe Albert | C298: 2650000 | E298: Paul Bracewell | F298: 100000
B299: Jason Drysdale | C299: 425000 | E299: Jason Drysdale | F299: 340000
B300: Steve Guppy | C300: 150000 | E300: Alex Mathie | F300: 500000
B301: Marc Hottiger | C301: 600000 | E301: Andy Cole | F301: 7000000
E302: Steve Guppy | F302: 225000 | H302: Prem
E303: Peter Cormack | F303: Signed | H303: PTS | I303: POS
B304: Total | C304: =SUM(C293:C303) -> 13650000 | F304: =SUM(F293:F303) -> 9765000 | G304: =C304-F304 -> 3885000 | H304: 72 | I304: 6
B306: Season 93/94
B307: Darren Peacock | C307: 2700000 | E307: Mark Robinson | F307: 600000
B308: Ruel Fox | C308: 2250000 | E308: Graham Stokoe | F308: Free
B309: Chris Holland | C309: 100000 | E309: Alun Armstrong | F309: 50000
B310: Mike Jeffrey | C310: 60000 | E310: Tony Dinning | F310: Free
B311: Mike Hooper | C311: 550000 | E311: Matty Appleby | F311: Free
B312: John Burridge | C312: Free | E312: Kevin Scott | F312: 850000
B313: Nikodimos Papavasiliou | C313: 120000 | E313: Liam O'Brien | F313: 300000
E314: Brian Kilcline | F314: 90000
E315: John Burridge | F315: Free | H315: Prem
E316: Gavin Peacock | F316: 1250000 | H316: PTS | I316: POS
B317: Total | C317: =SUM(C307:C316) -> 5780000 | F317: =SUM(F307:F316) -> 3140000 | G317: =C317-F317 -> 2640000 | H317: 77 | I317: 3
B319: Season 92/93
B320: Alex Mathie | C320: 285000 | E320: Mark Stimson | F320: 100000
B321: Peter Beardsley | C321: 1400000 | E321: Alan Thompson | F321: 250000
B322: Steve Harper | C322: Free | E322: David Kelly | F322: 750000
B323: Andy Cole | C323: 1750000 | E323: Andy Hunt | F323: 100000
B324: Scott Sellars | C324: 700000 | E324: Franz Carr | F324: 120000
B325: Mark Robinson | C325: 450000 | E325: Peter Garland | F325: Transfer
B326: Rob Lee | C326: 700000 | E326: Mick Quinn
E327: Darren Bradshaw | F327: Free | H327: PTS | I327: POS
B328: Total | C328: =SUM(C320:C327) -> 5285000 | F328: =SUM(F320:F327) -> 1320000 | G328: =C328-F328 -> 3965000 | H328: 96 | I328: 1