B1: Season 91/92 to date | C1: =C7 -> 122900000 | F1: =F7 -> 55475000 | G1: =C1-F1 -> 67425000 | H1: =SUM(G8:G307) -> 67425000 | I1: =G1-H1 -> 0
B2: Season 03/04 to date | C2: =C203+C184+C162+C146+C137+C120+C110+C98+C84+C70+C59+C46+C26 -> 76570000 | F2: =F203+F184+F162+F146+F137+F120+F110+F98+F84+F70+F59+F46+F26 -> 16965000 | G2: =C2-F2 -> 59605000 | H2: =SUM(G8:G203) -> 59605000 | I2: =G2-H2 -> 0
B3: championship 04/05 | C3: =C184+C162+C146+C137+C120+C110+C98+C84+C70+C59+C46+C26 -> 76200000 | F3: =F184+F162+F146+F137+F120+F110+F98+F84+F70+F59+F46+F26 -> 16965000 | G3: =C3-F3 -> 59235000 | H3: =SUM(G8:G184) -> 59235000 | I3: =G3-H3 -> 0
B4: Last five seasons | C4: =C84+C70+C59+C46+C26 -> 64000000 | F4: =F84+F70+F59+F46+F26 -> 8650000 | G4: =C4-F4 -> 55350000 | H4: =SUM(G8:G84) -> 55350000 | I4: =G4-H4 -> 0
B6: Leicester City
B7: Combined Totals | C7: =C307+C300+C294+C284+C273+C261+C253+C248+C240+C224+C214+C203++C184+C162+C146+C137+C120+C110+C98+C84+C70+C59+C46+C26 -> 122900000 | F7: =F307+F300+F294+F284+F273+F261+F253+F248+F240+F224+F214+F203+F184+F162+F146+F137+F120+F110+F98+F84+F70+F59+F46+F26 -> 55475000 | G7: =SUM(G60:G307) -> 18575000 | H7: =SUM(H8:H308) -> 1287
B8: Players Purchased | C8: Fee | E8: Players Sold | F8: Fee | G8: Net Total | H8: Points | I8: Position
B9: Season 15/16
B10: Shinji Okazaki | C10: 7000000 | E10: Chris Wood | F10: 2000000
B11: Robert Huth | C11: 3000000 | E11: Zoumana Bakayogo | F11: Released
B12: Christian Fuchs | C12: Free | E12: Paul Gallagher | F12: Released
B13: Yohan Benalouane | C13: 5600000 | E13: Conrad Logan | F13: Released
B14: N'Golo Kanté | C14: 5600000 | E14: Gary Taylor-Fletcher | F14: Released
B15: Gökhan Inler | C15: 5000000 | E15: Matthew Upson | F15: Released
B16: Demarai Gray | C16: 3700000 | E16: David Nugent | F16: 4000000
B17: Daniel Amartey | C17: 5000000 | E17: Esteban Cambiasso | F17: Free
B18: Daniel Iversen | C18: 200000 | E18: Joe Davis | F18: Undisclosed
E19: Alie Sesay | F19: Undisclosed
H25: PTS | I25: POS
C26: =SUM(C10:C25) -> 35100000 | F26: =SUM(F10:F25) -> 6000000 | G26: =C26-F26 -> 29100000
B27: Season 14/15
B28: Ben Hamer | C28: Free | E28: Neil Danns | F28: Free
B29: Jack Barmby | C29: Free | E29: George Taft | F29: Free
B30: Marc Albrighton | C30: Free | E30: Lloyd Dyer | F30: Free
B31: Matthew Upson | C31: Free | E31: Martyn Waghorn | F31: Free
B32: Louis Rowley | C32: Free | E32: Zak Whitbread | F32: Free
B33: Leonardo Ulloa | C33: 8000000 | E33: Sean St Ledger | F33: Released
B34: Esteban Cambiasso | C34: Free | E34: Ben Frempah | F34: Undisclosed
B35: Danny Simpson | C35: 2000000 | E35: Kieran Kennedy | F35: Released
B36: Kris Scott | C36: Free | E36: Adam Dawson | F36: Released
B37: Tom Lawrence | C37: 1000000 | E37: Jak Mc Court | F37: Released
B38: Mark Schwarzer | C38: Free | E38: Marcel Barrington | F38: Released
B39: Andrej Kramarić | C39: 9000000 | E39: Jacob Blyth | F39: Released
E40: Michael Caine | F40: Released
E41: Harry Panayiotou | F41: Released
E42: James Pearson | F42: Released
E43: Alie Sesay | F43: Released
E44: Adam Smith | F44: Released
H45: PTS | I45: POS
C46: =SUM(C28:C45) -> 20000000 | F46: =SUM(F28:F44) -> 0 | G46: =C46-F46 -> 20000000 | H46: 41 | I46: 14
B47: Season 13/14
B48: Zoumana Bakayogo | C48: Free | E48: Jermaine Beckford | F48: 1000000
B49: Dean Hammond | C49: Undisclosed
B50: Riyad Mahrez | C50: 750000
B51: Gary Taylor-Fletcher | C51: Free
B52: Marcin Wasilewski | C52: Free
B53: Kevin Phillips | C53: Free
H57: Champ
H58: PTS | I58: POS
B59: Total | C59: =SUM(C48:C58) -> 750000 | F59: =SUM(F48:F58) -> 1000000 | G59: =C59-F59 -> -250000 | H59: 102 | I59: 1
B60: Season 12/13
B61: Matthew James | C61: 1000000 | E61: Oliver Norburn | F61: Free
B62: Ritchie De Laet | C62: 1000000 | E62: Chris Weale | F62: Free
B63: Souleymane Bamba | C63: 750000 | E63: Matthew Mills | F63: 200000
B64: Marko Futacs | C64: Free | E64: Steve Howard | F64: Free
B65: Zak Whitbread | C65: Free | E65: Matt Robinson | F65: Free
B66: Chris Wood | C66: 1500000 | E66: Lee Peltier | F66: 600000
B67: Cian Bolger | C67: Undisclosed | E67: Tom Parkes | F67: Free
B68: Anthony Knockaert | C68: 900000 | E68: Neil Danns | F68: Free | H68: PTS | I68: PO
B70: Total | C70: =SUM(C61:C68) -> 5150000 | F70: =SUM(F61:F68) -> 800000 | G70: =C70-F70 -> 4350000 | H70: 68 | I70: 6
B71: Season 2011/12
B72: Neil Danns | C72: Signed | E72: Jack Hobbs | F72: 850000
B73: Kasper Schmeichel | C73: Signed | E73: Luke O'Neill | F73: Free
B74: Sean St. Ledger | C74: Signed | E74: Dany N'Guessan | F74: Signed
B75: Dave Nugent | C75: Free | E75: Ashley Chambers | F75: Signed
B76: Matthew Mills | C76: Signed | E76: Craig King | F76: Free
B77: Paul Konchesky | C77: Signed
B78: John Paintsil | C78: Free
B79: Jermaine Beckford | C79: 3000000
B80: Daniel Drinkwater | C80: Signed
B81: Wes Morgan | C81: Signed
B82: Ben Marshall | C82: Signed
B83: Lee Peltier | C83: Signed | H83: PTS | I83: PO
B84: Total | C84: =SUM(C72:C83) -> 3000000 | F84: =SUM(F72:F83) -> 850000 | G84: =C84-F84 -> 2150000 | H84: 66 | I84: 9
B85: Season 2010/11
B86: Julio Moreno | C86: Signed | E86: Nolberto Solano | F86: Free
B87: Franck Moussa | C87: Free | E87: Harry Worley | F87: Free
B88: Yuki Abe | C88: Signed | E88: Carl Pentney | F88: Free
B89: Martyn Waghorn | C89: 3000000 | E89: Nicky Adams | F89: Signed
B90: Souleymane Bamba | C90: Signed | E90: DJ Campbell | F90: Signed
B91: Ricardo | C91: Free | E91: Matty Fryatt | F91: 1200000
B92: Tom Kennedy | C92: Free | E92: Michael Morrison | F92: Signed
B93: Jamie Vardy | C93: 1000000 | E93: James Wesolowski | F93: Signed
E94: Lathaniel Rowe-Turner | F94: Free
E95: Billy Kee | F95: Free
E96: Yann Kermorgant | F96: Signed
E97: Wayne Brown | F97: Free | H97: PTS | I97: PO
B98: Total | C98: =SUM(C86:C97) -> 4000000 | F98: =SUM(F86:F97) -> 1200000 | G98: =C98-F98 -> 2800000 | H98: 67 | I98: 10
B99: Season 2009/10
B100: Dany N'Guessan | C100: Signed | E100: Joe Cobb | F100: Free
B101: Jack Hobbs | C101: Free | E101: Jonathan Hayes | F101: Free
B102: Wayne Brown | C102: Free | E102: Marc Edworthy | F102: Free
B103: Chris Weale | C103: Free | E103: Ryan Beswick | F103: Free
B104: Astrit Ajdarevic | C104: Free | E104: Lee Cox | F104: Free
B105: Robbie Neilson | C105: Free | E105: Barry Hayles | F105: Free
B106: Ritchie Wellens | C106: 1000000 | E106: Billy McKay | F106: Free
B107: Paul Gallagher | C107: Signed | E107: Joe Mattock | F107: 1200000
B108: Yann Kermorgant | C108: Free | E108: Max Gradel | F108: Signed
E109: Ricky Sappleton | F109: Free | H109: PTS | I109: PO
B110: Total | C110: =SUM(C100:C109) -> 1000000 | F110: =SUM(F100:F109) -> 1200000 | G110: =C110-F110 -> -200000 | H110: 76 | I110: 5
B111: Season 2008/09
B112: Lloyd Dyer | C112: Free | E112: Rab Douglas | F112: Free
B113: Nicky Adams | C113: 100000 | E113: Alan Sheehan | F113: Signed
B114: Michael Morrison | C114: Signed | E114: Louis Dodds | F114: Signed
B115: Aleksander Tunchev | C115: 375000 | E115: James Chambers | F115: Free
B116: Chris Powell | C116: Free | E116: Eric Odhiambo | F116: Free
B117: Paul Dickov | C117: Free | E117: Gareth McAuley | F117: Free
B118: Harry Worley | C118: Free | E118: Iain Hume | F118: 1200000
E119: Richard Stearman | F119: Signed | H119: PTS | I119: PO
B120: Total | C120: =SUM(C112:C119) -> 475000 | F120: =SUM(F112:F119) -> 1200000 | G120: =C120-F120 -> -725000 | H120: - | I120: -
B121: Season 2007/08
B122: Stephen Clemence | C122: 1000000 | E122: Stephen Hughes | F122: Signed
B123: DJ Campbell | C123: 1600000 | E123: Steve Howard | F123: 1500000
B124: Barry Hayles | C124: Signed | E124: Mark De Vries | F124: Signed
B125: Steve Howard | C125: 1500000 | E125: Darren Kenton | F125: Signed
B126: Matt Oakley | C126: 500000 | E126: Patrick McCarthy | F126: 650000
B127: Jamie Clapham | C127: Free | E127: Andy Johnson | F127: Free
B128: Bruno N'Gotty | C128: Free | E128: Danny Cadamarteri | F128: Free
B129: Jimmy Nielsen | C129: Free
B130: Carl Cort | C130: Free
B131: Sergio Hellings | C131: Free
B132: Radostin Kishishev | C132: Signed
B133: James Chambers | C133: Free
B134: Jonathan Hayes | C134: Signed
B135: Hossein Kaebi | C135: Signed
B136: Shaun Newton | C136: Free | H136: PTS | I136: PO
B137: Total | C137: =SUM(C122:C136) -> 4600000 | F137: =SUM(F122:F136) -> 2150000 | G137: =C137-F137 -> 2450000 | H137: 52 | I137: 22
B138: Season 2006/07
B139: Danny Cadamarteri | C139: Signed | E139: Joe Hamill | F139: Signed
B140: Gareth McAuley | C140: Free | E140: Lee Morris | F140: Free
B141: Andy Johnson | C141: Free | E141: Josh Low | F141: Nominal
B142: Josh Low | C142: Free | E142: Momo Sylla | F142: Free
B143: Darren Kenton | C143: Free | E143: Chris O'Grady | F143: 65000
E144: Gareth Williams | F144: Signed
E145: Joey Gudjonsson | F145: Free | H145: PTS | I145: PO
B146: Total | C146: =SUM(C139:C145) -> 0 | F146: =SUM(F139:F145) -> 65000 | G146: =C146-F146 -> -65000 | H146: 53 | I146: 19
B147: Season 2005/06
B148: Nils-Eric Johansson | C148: Free | E148: Jordan Stewart | F148: 125000
B149: Peter Gilbert | C149: 200000 | E149: Matt Heath | F149: Signed
B150: Joe Hamill | C150: Signed | E150: Ian Walker | F150: Free
B151: Elvis Hammond | C151: 225000 | E151: Stephen Dawson | F151: Free
B152: Iain Hume | C152: 500000 | E152: Chris Makin | F152: Free
B153: Matty Fryatt | C153: Signed | E153: Keith Gillespie | F153: Free
B154: Paul Henderson | C154: Free | E154: David Connolly | F154: 2000000
B155: Momo Sylla | C155: Free | E155: Peter Canero | F155: Signed
B156: Rab Douglas | C156: Free | E156: Tommy Wright | F156: Signed
E157: Peter Gilbert | F157: Free
E158: Jason Wilcox | F158: Free
E159: Dion Dublin | F159: Free
E160: Scot Gemmill | F160: Free
E161: Lilian Nalis | F161: Free | H161: PTS | I161: PO
B162: Total | C162: =SUM(C148:C161) -> 925000 | F162: =SUM(F148:F161) -> 2125000 | G162: =C162-F162 -> -1200000 | H162: 54 | I162: 16
B163: Season 2004/05
B164: Kevin Pressman | C164: Free | E164: Junior Lewis | F164: Free
B165: David Connolly | C165: 500000 | E165: Les Ferdinand | F165: Free
B166: Martin Keown | C166: Free | E166: Callum Davidson | F166: Free
B167: Nathan Blake | C167: Free | E167: Danny Coyne | F167: 25000
B168: Joey Gudjonsson | C168: Free | E168: Nicolas Priet | F168: Free
B169: Chris Makin | C169: Free | E169: Frank Sinclair | F169: Free
B170: Scot Gemmill | C170: Free | E170: Craig Hignett | F170: Free
B171: Alan Maybury | C171: Nominal | E171: Tommy Williamson | F171: Free
B172: Mark De Vries | C172: Nominal | E172: Trevor Benjamin | F172: Free
B173: Lars Hirschfeld | C173: Free | E173: Martin Keown | F173: Free
B174: Stephen Hughes | C174: 100000 | E174: Kevin Pressman | F174: Free
B175: Patrick McCarthy | C175: 100000 | E175: Muzzy Izzet | F175: Free
B176: Patrick Kisnorbo | C176: Free | E176: Paul Dickov | F176: 150000
B177: Dion Dublin | C177: Free | E177: Ben Thatcher | F177: 100000
B178: Jason Wilcox | C178: Free | E178: Steve Guppy | F178: Free
B179: Gareth Williams | C179: 500000 | E179: Billy McKinlay | F179: Free
B180: Danny Tiatto | C180: Free | E180: Paul Brooker | F180: Free
E181: Alan Rogers | F181: Free
E182: Andy Impey | F182: Free
E183: Riccy Scimeca | F183: 100000 | H183: PTS | I183: PO
B184: Total | C184: =SUM(C164:C183) -> 1200000 | F184: =SUM(F164:F183) -> 375000 | G184: =C184-F184 -> 825000 | H184: 57 | I184: 15
B185: Season 2003/04
B186: Danny Coyne | C186: Free | E186: Stefan Oakes | F186: Free
B187: Keith Gillespie | C187: Free | E187: Mike Price | F187: Free
B188: Les Ferdinand | C188: Free | E188: Nicky Summerbee | F188: Free
B189: Lilian Nalis | C189: Free | E189: John Ashton | F189: Free
B190: Ben Thatcher | C190: Free | E190: Leon McSweeney | F190: Free
B191: Nicolas Priet | C191: Free | E191: Brian Deane | F191: Free
B192: Craig Hignett | C192: Free | E192: Steve Howey | F192: Free
B193: John Curtis | C193: Free | E193: John Curtis | F193: Free
B194: Nikos Dabizas | C194: Free | E194: Gerry Taggart | F194: Free
B195: Steve Guppy | C195: Free | E195: Martin Reeves | F195: Free
B196: Peter Canero | C196: 250000 | E196: Jon Stevenson | F196: Free
B197: Steffen Freund | C197: Free | E197: Simon Royce | F197: Free
B198: Lee Morris | C198: 120000
B199: Alan Sheehan | C199: Free
B200: Steve Howey | C200: Signed
B201: Riccy Scimeca | C201: Free | H201: Prem
B202: Paul Brooker | C202: Free | H202: PTS | I202: PO
B203: Total | C203: =SUM(C186:C202) -> 370000 | F203: =SUM(F186:F202) -> 0 | G203: =C203-F203 -> 370000 | H203: 33 | I203: 18
B204: Season 2002/03
B205: Nicky Summerbee | C205: Free | E205: Arnar Gunnlaugsson | F205: Free
B206: Billy McKinlay | C206: Free | E206: Lee Marshall | F206: 700000
E207: Geraint Frowen | F207: Free
E208: Matt Piper | F208: 3500000
E209: Dennis Wise | F209: Free
E210: Alex Mortimer | F210: Free
E211: Damien Delaney | F211: 50000
E212: Gary Rowett | F212: 2500000
E213: Robbie Savage | F213: 1250000 | H213: PTS | I213: PO
B214: Total | C214: =SUM(C205:C213) -> 0 | F214: =SUM(F205:F213) -> 8000000 | G214: =C214-F214 -> -8000000 | H214: 92 | I214: 2
B215: Season 2001/02
B216: Dennis Wise | C216: 1600000 | E216: Lawrie Dudfield | F216: 250000
B217: Ian Walker | C217: 2500000 | E217: Richard Cresswell | F217: 500000
B218: Alan Rogers | C218: 300000 | E218: Steve Guppy | F218: 350000
B219: Brian Deane | C219: 150000 | E219: Kevin Ellison | F219: 55000
B220: Jacob Laursen | C220: 400000 | E220: Dean Sturridge | F220: 350000
B221: Paul Dickov | C221: Nominal | E221: Ade Akinbiyi | F221: 2200000
E222: Danny Thomas | F222: Signed | H222: Prem
E223: Stuart Campbell | F223: 200000 | H223: PTS | I223: PO
B224: Total | C224: =SUM(C216:C223) -> 4950000 | F224: =SUM(F216:F223) -> 3905000 | G224: =C224-F224 -> 1045000 | H224: 25 | I224: 20
B225: Season 2000/01
B226: Gary Rowett | C226: 3000000 | E226: Ian Marshall | F226: Free
B227: Callum Davidson | C227: 1750000 | E227: Graham Fenton | F227: Monthly
B228: Simon Royce | C228: Free | E228: Tony Cottee | F228: Free
B229: Trevor Benjamin | C229: 1500000 | E229: Steve Walsh | F229: Signed
B230: Ade Akinbiyi | C230: 5000000 | E230: Stan Collymore | F230: Free
B231: Richard Cresswell | C231: 750000 | E231: Neil Lennon | F231: 5750000
B232: Damien Delaney | C232: 50000 | E232: Stuart Wilson | F232: Free
B233: Matt Jones | C233: 3000000 | E233: Phil Gilchrist | F233: 500000
B234: Roberto Mancini | C234: Free | E234: John Hodges | F234: Free
B235: Dean Sturridge | C235: 350000 | E235: Fernando Pasquinelli | F235: Free
B236: Kevin Ellison | C236: 50000 | E236: Theo Zagorakis | F236: Free
B237: Junior Lewis | C237: 150000 | E237: Pegguy Arphexad | F237: Free
B238: Lee Marshall | C238: 650000 | H238: Prem
B239: Ashly Lyth | C239: 100000 | H239: PTS | I239: PO
B240: Total | C240: =SUM(C226:C239) -> 16350000 | F240: =SUM(F226:F239) -> 6250000 | G240: =C240-F240 -> 10100000 | H240: 48 | I240: 13
B241: Season 1999/00
B242: Tim Flowers | C242: 1100000 | E242: Gary Neil | F242: Free
B243: Phil Gilchrist | C243: 500000 | E243: Pontus Kaamark | F243: Free
B244: Darren Eadie | C244: 3000000 | E244: Kasey Keller | F244: Free
B245: Stan Collymore | C245: Free | E245: Scott Taylor | F245: Free
B246: Fernando Pasquinelli | C246: Unknown | E246: Guy Branston | F246: 50000 | H246: Prem
E247: Emile Heskey | F247: 11000000 | H247: PTS | I247: PO
B248: Total | C248: =SUM(C242:C247) -> 4600000 | F248: =SUM(F242:F247) -> 11050000 | G248: =C248-F248 -> -6450000 | H248: 55 | I248: 8
B249: Season 1998/99
B250: Frank Sinclair | C250: 2000000 | E250: Spencer Prior | F250: 700000
B251: Andy Impey | C251: 1600000 | E251: Julian Watts | F251: Free | H251: Prem
B252: Arnar Gunnlaugsson | C252: 2000000 | E252: Graeme Jaffa | F252: Signed | H252: PTS | I252: PO
B253: Total | C253: =SUM(C250:C252) -> 5600000 | F253: =SUM(F250:F252) -> 700000 | G253: =C253-F253 -> 4900000 | H253: 49 | I253: 10
B254: Season 1997/98
B255: Graham Fenton | C255: 1100000 | E255: Mike Whitlow | F255: 500000
B256: Robbie Savage | C256: 400000 | E256: Mark Robins | F256: Signed
B257: Tony Cottee | C257: 500000 | E257: Steve Claridge | F257: 350000
B258: Pegguy Arphexad | C258: Free | E258: Jamie Lawrence | F258: 50000
B259: Theo Zagorakis | C259: 750000 | E259: Neil Lewis | F259: 75000 | H259: Prem
E260: Simon Grayson | F260: 1300000 | H260: PTS | I260: PO
B261: Total | C261: =SUM(C255:C259) -> 2750000 | F261: =SUM(F255:F260) -> 2275000 | G261: =C261-F261 -> 475000 | H261: 53 | I261: 10
B262: Season 1996/97
B263: Spencer Prior | C263: 600000 | E263: Mark Blake | F263: Free
B264: Kasey Keller | C264: 900000 | E264: Stuart Slater | F264: Free
B265: Ian Marshall | C265: 800000 | E265: Paul Hyde | F265: Non-contract
B266: Sascha Lenhart | C266: Free | E266: Paul Hyde | F266: Free
B267: Stuart Slater | C267: Trial | E267: Iwan Roberts | F267: 1300000
B268: Matt Elliott | C268: 1600000 | E268: Brian Carey | F268: 100000
B269: Rob Ullathorne | C269: 600000
B270: Steve Guppy | C270: 850000
B271: Paul Hyde | C271: Non-contract | H271: Prem
B272: Muzzy Izzet | C272: 650000 | H272: PTS | I272: PO
B273: Total | C273: =SUM(C263:C272) -> 6000000 | F273: =SUM(F263:F272) -> 1400000 | G273: =C273-F273 -> 4600000 | H273: 47 | I273: 9
B274: Season 1995/96
B275: Steve Corica | C275: 100000 | E275: Lee Ellison | F275: Free
B276: Pontus Kaamark | C276: 840000 | E276: Richard Smith | F276: 50000
E277: Scott Eustace | F277: Free
E278: Mark Draper | F278: 3250000
E279: Gavin Ward
E280: Nicky Mohan | F280: 225000
E281: Russell Hoult | F281: 200000
E282: Ian Ormondroyd | F282: 75000
E283: David Oldfield | F283: 150000 | H283: PTS | I283: PO
B284: Total | C284: =SUM(C275:C283) -> 940000 | F284: =SUM(F275:F283) -> 3950000 | G284: =C284-F284 -> -3010000 | H284: 71 | I284: 5
B285: Season 1994/95
B286: Lee Ellison | C286: Free | E286: Colin Gibson | F286: Free
B287: Franz Carr | C287: 100000 | E287: Gary Mills | F287: 50000
B288: Jamie Lawrence | C288: 125000 | E288: Steve Agnew | F288: 250000
B289: Mark Robins | C289: 1000000 | E289: Franz Carr | F289: 250000
B290: Garry Parker | C290: 300000 | E290: Steve Thompson | F290: 200000
B291: Scott Taylor | C291: 500000 | E291: Tony James | F291: Free
B292: Nicky Mohan | C292: 330000 | H292: Prem
B293: Mark Draper | C293: 1250000 | H293: PTS | I293: PO
B294: Total | C294: =SUM(C286:C293) -> 3605000 | F294: =SUM(F286:F293) -> 750000 | G294: =C294-F294 -> 2855000 | H294: 29 | I294: 21
B295: Season 1993/94
B296: Iwan Roberts | C296: 100000 | E296: Bobby Davison | F296: Free
B297: Mark Blake | C297: 360000 | E297: Carl Muggleton | F297: 150000
B298: Brian Carey | C298: 250000
B299: Gavin Ward | C299: 175000 | H299: PTS | I299: PO
B300: Total | C300: =SUM(C296:C299) -> 885000 | F300: =SUM(F296:F299) -> 150000 | G300: =C300-F300 -> 735000 | H300: 73 | I300: 4
B301: Season 1992/93
B302: Bobby Davison | C302: 50000 | E302: Andy Jeffrey | F302: Undisclosed
B303: Lee Philpott | C303: 350000 | E303: Tony Thorpe | F303: Free
B304: Steve Agnew | C304: 250000 | E304: Jason Peake | F304: Free
E305: Ashley Ward | F305: 80000
E306: Nicky Platnauer | F306: Free | H306: PTS | I306: PO
B307: Total | C307: =SUM(C302:C306) -> 650000 | F307: =SUM(F302:F306) -> 80000 | G307: =C307-F307 -> 570000 | H307: 76 | I307: 6