H1: Checks
B2: Season 91/92 to date | C2: =C21 -> 849905000 | F2: =F21 -> 495690000 | G2: =C2-F2 -> 354215000 | H2: =G21 -> 354215000 | I2: =G2-H2 -> 0
B3: Season 03/04 to date | C3: =C213+C204+C193+C175+C156+C143+C133+C117+C102+C89+C72+C59+C40 -> 690780000 | F3: =F213+F204+F193+F175+F156+F143+F133+F117+F102+F89+F72+F59+F40 -> 426300000 | G3: =C3-F3 -> 264480000 | H3: =SUM(G22:G213) -> 264480000 | I3: =G3-H3 -> 0
B4: Championship 04/05 | C4: =C204+C193+C175+C156+C143+C133+C117+C102+C89+C72+C59+C40 -> 682280000 | F4: =F204+F193+F175+F156+F143+F133+F117+F102+F89+F72+F59+F40 -> 420050000 | G4: =C4-F4 -> 262230000 | H4: =SUM(G22:G204) -> 262230000 | I4: =G4-H4 -> 0
B5: Last five seasons | C5: =C102+C89+C72+C59+C40 -> 354100000 | F5: =F102+F89+F72+F59+F40 -> 190770000 | G5: =C5-F5 -> 163330000 | H5: =SUM(G22:G102) -> 163330000 | I5: =G5-H5 -> 0
I6: =G6-H6 -> 0
B7: Before Buyout | C7: =SUM(C328+C322+C313+C304+C295+C284+C276+C267+C251+C237+C224+C213+C204+C193+C175) -> 270605000 | F7: =SUM(F328+F322+F313+F304+F295+F284+F276+F267+F251+F237+F224+F213+F204+F193+F175) -> 112020000 | G7: =C7-F7 -> 158585000 | H7: =SUM(G175:G328) -> 158585000 | I7: =G7-H7 -> 0
B8: Hicks/Gillette Buyout | C8: =C156+C143+C133+C117-C115-C114-C116 -> 166750000 | F8: =F156+F143+F133+F117-F115-F116 -> 137100000 | G8: =C8-F8 -> 29650000 | H8: =G117+G143+G133+G156-C116-C115-C114+F115+F116 -> 29650000 | I8: =G8-H8 -> 0
B9: After Henry Buyout | C9: =C116+C115+C114+C102+C89+C72+C59+C40 -> 412550000 | F9: =F102+F89+F72+F59+F40+F116+F115 -> 246570000 | G9: =C9-F9 -> 165980000 | H9: =C116+C115+C114-F116-F115+G102+G89+G72+G59+G40 -> 165980000 | I9: =+G9-H9 -> 0
I10: =G10-H10 -> 0
B12: Gerrard Houlier 6 | C12: =SUM(C276+C267+C251+C237+C224+C213) -> 119450000 | F12: =SUM(F276+F267+F251+F237+F224+F213) -> 57090000 | G12: =C12-F12 -> 62360000 | H12: =SUM(G213:G276) -> 62360000 | I12: =G12-H12 -> 0
B13: Rafa Benitez 6 | C13: =SUM(C204+C193+C175+C156+C143+C133) -> 247730000 | F13: =SUM(F204+F193+F175+F156+F143+F133) -> 143680000 | G13: =C13-F13 -> 104050000 | H13: =SUM(G133:G204) -> 104050000 | I13: =G13-H13 -> 0
B14: Roy Hodgson 1 | C14: =C117 -> 80450000 | F14: =F117 -> 85600000 | G14: =C14-F14 -> -5150000 | H14: =G117 -> -5150000 | I14: =G14-H14 -> 0
B15: Kenny Dalglish | C15: =C116+C115+C114+C102 -> 114850000 | F15: =F116+F115+F102 -> 76850000 | G15: =C15-F15 -> 38000000 | H15: =G102+C114+C115+C116-F115-F116 -> 38000000 | I15: =G15-H15 -> 0
B16: Roy Evans 1994 - 97/98 | C16: =SUM(C284+C295+C304+C313) -> 40900000 | F16: =F284+F295+F304+F313 -> 15450000 | G16: =C16-F16 -> 25450000 | H16: =SUM(G284:G313) -> 25450000 | I16: =G16-H16 -> 0
B17: Brendan Rogers 2012/13 to dec 2015 | C17: =C89+C72+C59+C40 -> 297700000 | F17: =F89+F72+F59+F40 -> 169720000 | G17: =C17-F17 -> 127980000 | H17: =SUM(G22:G89) -> 127980000 | I17: =G17-H17 -> 0
B18: Jurgen Klopp dec 2015 to date | C18: =C34+C35+C36+C37+C38+C39 -> 5100000 | F18: =F34+F35+F36+F37+F38+F39 -> 0 | G18: =C18-F18 -> 5100000
B20: Liverpool
B21: Combined Totals | C21: =C328+C322+C313+C304+C295+C284+C276+C267+C251+C237+C224+C213+C204+C193+C175+C156+C143+C133+C117+C102+C89+C72+C59+C40 -> 849905000 | F21: =F328+F322+F313+F304+F295+F284+F276+F267+F251+F237+F224+F213+F204+F193+F175+F156+F143+F133+F117+F102+F89+F72+F59+F40 -> 495690000 | G21: =SUM(G22:G329) -> 354215000 | H21: =SUM(H22:H330) -> 1487
B22: Players Purchased | C22: Fee | E22: Players Sold | F22: Fee | G22: Net Total | H22: Points | I22: Position
B23: Season 15/16
B24: Roberto Firmino | C24: 29000000 | E24: Sebastian Coates | F24: 2000000
B25: Joe Gomez | C25: 3500000 | E25: Steven Gerrard | F25: Free
B26: Ádám Bogdán | C26: Free | E26: Glen Johnson | F26: Released
B27: Danny Ings | C27: Tribunal | E27: Brad Jones | F27: Released
B28: James Milner | C28: Free | E28: Raheem Sterling | F28: 35200000
B29: Nathaniel Clyne | C29: 12500000 | E29: Rickie Lambert | F29: 3000000
B30: Christian Benteke | C30: 32500000 | E30: Rafael Páez | F30: Undisclosed
E31: Fabio Borini | F31: 10000000
E32: Iago Aspas | F32: 4400000
B33: Manager Change | E33: Manager Change
B34: Marko Grujić | C34: 5100000
H39: PTS | I39: POS
C40: =SUM(C24:C39) -> 82600000 | F40: =SUM(F24:F39) -> 54600000 | G40: =C40-F40 -> 28000000
B41: Season 14/15
B42: Emre Can | C42: 10000000 | E42: Armin Hodzic | F42: Free
B43: Rickie Lambert | C43: 4000000 | E43: Jakub Sokolík | F43: Free
B44: Adam Lallana | C44: 25000000 | E44: Luis Saurez | F44: 65000000
B45: Lazar Marković | C45: 20000000 | E45: Conor Coady | F45: 370000
B46: Dejan Lovren | C46: 20000000 | E46: Pepe Reina | F46: 2000000
B47: Divock Origi | C47: 10000000 | E47: Martin Kelly | F47: 1500000
B48: Alberto Moreno | C48: 12000000 | E48: Jack Robinson | F48: 1000000
B49: Mario Balotelli | C49: 16000000 | E49: Daniel Agger | F49: 3000000
B50: Lawrence Vigouroux | C50: Signed | E50: Krisztián Adorján | F50: Undisclosed
B51: Kevin Stewart | C51: Signed | E51: Villyan Bijev | F51: Released
E52: Michael Ngoo | F52: Released
E53: Yalany Baio | F53: Released
E54: Yusuf Mersin | F54: Released
E55: Craig Roddan | F55: Released
E56: Stephen Sama | F56: Released
E57: Morocco Oussama Assaidi | F57: 4750000
E58: Suso | F58: 1000000 | H58: PTS | I58: POS
C59: =SUM(C42:C52) -> 117000000 | F59: =SUM(F42:F58) -> 78620000 | G59: =C59-F59 -> 38380000 | H59: 62 | I59: 6
B60: Season 13/14
B61: Luis Alberto | C61: 6800000 | E61: Danny Wilson | F61: Free
B62: Iago Aspas | C62: 7000000 | E62: Peter Gulasci | F62: Free
B63: Kolo Toure | C63: Free | E63: Andrew Carrol | F63: 15500000
B64: Simon Mignolet | C64: 10000000 | E64: Jamie Stephens | F64: Released
B65: Tiago Ilori | C65: 7000000 | E65: Tyrell Belford | F65: Released
B66: Mamadou Sakho | C66: 18000000 | E66: Jamie Carragher | F66: Retired
E67: Jonjo Shelvey | F67: 5000000
E68: Stewart Downing | F68: 6000000
E69: Jay Spearing | F69: 2000000
E70: Dani Pacheco | F70: Free | H70: Prem
E71: Adam Morgan | F71: Free | H71: PTS | I71: POS
B72: Total | C72: =SUM(C61:C71) -> 48800000 | F72: =SUM(F61:F71) -> 28500000 | G72: =C72-F72 -> 20300000 | H72: 84 | I72: 2
B73: Season 12/13
B74: Fabio Borini | C74: 10000000 | E74: Dirk Kuyt | F74: 1000000
B75: Joe Allen | C75: 15000000 | E75: Lewis Hatch | F75: Free
B76: Oussama Assaidi | C76: 2300000 | E76: David Amoo | F76: Free
B77: Samed Yesil | C77: 1000000 | E77: Joe Rafferty | F77: Free
B78: Daniel Sturridge | C78: 12000000 | E78: Stephen Darby | F78: Free
B79: Philippe Coutinho | C79: 8500000 | E79: Fabiano Aurelio | F79: Free
B80: Jordan Ibe | C80: 500000 | E80: Maxi Rodríguez | F80: Undisclosed
E81: Toni Brito Silva | F81: Free
E82: Alberto Aquilani | F82: 3000000
E83: Craig Bellamy | F83: Free
E84: Kirk Broadfoot | F84: Free
E85: Charlie Adam | F85: 4000000
E86: Nathan Ecclestone | F86: Free
E87: Joe Cole | F87: Free | H87: Prem
E88: Doni | F88: Free | H88: Pts | I88: Pos
B89: Total | C89: =SUM(C73:C80) -> 49300000 | F89: =SUM(F74:F88) -> 8000000 | G89: =C89-F89 -> 41300000 | H89: 7 | I89: 61
B90: Season 11/12
B91: Jordan Henderson | C91: 16000000 | E91: Paul Konchesky | F91: 1500000
B92: Charlie Adam | C92: 7000000 | E92: Chris Mavinga | F92: 1000000
B93: Doni | C93: Free | E93: Gerardo Bruna | F93: 750000
B94: Stewart Downing | C94: 20000000 | E94: Milan Jovanovic | F94: Free
B95: Sanchez Jose Enrique | C95: 6300000 | E95: Daniel Ayala | F95: 800000
B96: Sebastian Coates | C96: 7000000 | E96: Emiliano Insua | F96: Free
B97: Craig Bellamy | C97: Free | E97: Sotirios Kyrgiakos | F97: Free
B98: Villyan Bijev | C98: Signed | E98: Christian Poulsen | F98: 1000000
B99: Danny Ward | C99: 100000 | E99: David Ngog | F99: 4000000
E100: Raul Meireles | F100: 12000000 | H100: Prem
E101: Tom Ince | F101: Free | H101: Pts | I101: Pos
B102: Total | C102: =SUM(C91:C101) -> 56400000 | F102: =SUM(F91:F101) -> 21050000 | G102: =C102-F102 -> 35350000 | H102: 52 | I102: 8
B103: Season 10/11
B104: Jonjo Shelvey | C104: 1700000 | E104: David Martin | F104: Free
B105: Milan Jovanović | C105: Free | E105: Robbie Threlfall | F105: Free
B106: Danny Wilson | C106: 2000000 | E106: Christopher Oldfield | F106: Released
B107: Joe Cole | C107: Free | E107: Mikel San Jose | F107: Undisclosed
B108: Fabio Aureilo | C108: Free | E108: Yossi Benayoun | F108: 5000000
B109: Christian Poulson | C109: 4500000 | E109: Albert Riera | F109: 5000000
B110: Brad Jones | C110: 2300000 | E110: Diego Cavalieri | F110: 1000000
B111: Raul Meireles | C111: 11500000 | E111: Kristian Nemeth | F111: 1500000
B112: Paul Konchesky | C112: Swap | E112: Alexander Kacaniklic | F112: Swap
B113: Suso | C113: Signed | E113: Lauri Dalla Valle | F113: Swap
B114: Yusuf Mersin | C114: 450000 | E114: Javier Macherano | F114: 17300000
B115: Luis Suarez | C115: 23000000 | E115: Ryan Babel | F115: 5800000 | H115: Prem
B116: Andrew Carroll | C116: 35000000 | E116: Fernando Torres | F116: 50000000 | H116: Pts | I116: Pos
B117: Total | C117: =SUM(C104:C116) -> 80450000 | F117: =SUM(F104:F116) -> 85600000 | G117: =C117-F117 -> -5150000 | H117: 58 | I117: 6
B118: Season 09/10
B119: Glen Johnson | C119: 17500000 | E119: Sami Hyypiä | F119: Free
B120: Chris Mavinga | C120: Signed[3] | E120: Jack Hobbs | F120: Signed
B121: Stephen Sama | C121: Free | E121: Paul Anderson | F121: 250000
B122: Alberto Aquilani | C122: 17000000 | E122: Sebastian Leto | F122: 3000000
B123: Sotirios Kyrgiakos | C123: 1500000 | E123: Astrit Ajdarevic | F123: Free
B124: Maxi Rodriguez | C124: Free | E124: Jermaine Pennant | F124: Free
E125: Alvaro Arbeloa | F125: 3500000
E126: Xabi Alonso | F126: 30000000
E127: Shane O Connor | F127: Free
E128: Adam Hammill | F128: Signed
E129: Andrea Dossena | F129: 4500000
E130: Andriy Voronin | F130: 1800000
E131: Chris Buchtmann | F131: 100000 | H131: Prem
E132: Nikolay Mihaylov | F132: 1500000 | H132: Pts | I132: Pos
B133: Total | C133: =SUM(C119:C130) -> 36000000 | F133: =SUM(F119:F132) -> 44650000 | G133: =C133-F133 -> -8650000 | H133: 63 | I133: 7
B134: Season 08/09
B135: Philipp Degen | C135: Free | E135: Anthony Le Tallec | F135: Undisclosed
B136: Andrea Dossena | C136: 7000000 | E136: Harry Kewell | F136: Free
B137: Diego Cavalieri | C137: 3500000 | E137: Peter Crouch | F137: 10000000
B138: Robbie Keane | C138: 19000000 | E138: Danny Gutherie | F138: 2500000
B139: Vitor Flora | C139: Signed | E139: John Arne Riise | F139: 4000000
B140: Alberto Riera | C140: 8000000 | E140: Scott Carson | F140: 3250000
B141: David Ngog | C141: 1500000 | E141: Steve Finnan | F141: 1000000 | H141: Prem
E142: Robbie Keane | F142: 12000000 | H142: Pts | I142: Pos
B143: Total | C143: =SUM(C135:C141) -> 39000000 | F143: =SUM(F135:F142) -> 32750000 | G143: =C143-F143 -> 6250000 | H143: 86 | I143: 2
B145: Season 07/08
B146: Javier Mascherano | C146: 17100000 | E146: Lee Peltier | F146: Signed
B147: Martin Skrtel | C147: 6500000 | E147: Mohamed Sissoko | F147: 8200000
B148: Damien Plessis | C148: Signed | E148: Gabriel Paletta | F148: Signed
B149: Emiliano Insua | C149: 1300000 | E149: Robbie Fowler | F149: Free
B150: Ryan Babel | C150: 11500000 | E150: Jerzy Dudek | F150: Free
B151: Yossi Benayoun | C151: 5000000 | E151: Mark Gonzalez | F151: 4200000
B152: Sebastian Leto | C152: 1850000 | E152: Craig Bellamy | F152: 7500000
B153: Fernando Torres | C153: 26500000 | E153: Djibril Cisse | F153: 6000000
B154: Charles-Hubert Itandje | C154: Signed | E154: Boudewijn Zenden | F154: Free | H154: Prem
B155: Andrei Voronin | C155: Free | E155: Luis Garcia | F155: 4000000 | H155: Pts | I155: Pos
B156: Total | C156: =SUM(C146:C155) -> 69750000 | F156: =SUM(F146:F155) -> 29900000 | G156: =C156-F156 -> 39850000 | H156: 76 | I156: 4
B158: Season 06/07
B159: Lucas Pezzini Leiva | C159: 6000000 | E159: Danny O'Donnell | F159: 100000
B160: Francisco Manuel Duran | C160: Signed | E160: Florent Sinama Pongolle | F160: 2700000
B161: Javier Mascherano | C161: 1500000 | E161: Salif Diao | F161: Free
B162: Alvaro Arbeloa | C162: 2640000 | E162: Stephen Warnock | F162: 1500000
B163: Nabil El Zhar | C163: 200000 | E163: Darren Potter | F163: 250000
B164: Dirk Kuyt | C164: 9000000 | E164: David Mannix | F164: Signed
B165: Jermaine Pennant | C165: 6700000 | E165: Chris Kirkland | F165: 3000000
B166: Fabiano Aurelio | C166: Free | E166: Jan Kromkamp | F166: 1500000
B167: Gabriel Paletta | C167: 2000000 | E167: Neil Mellor | F167: 250000
E168: Djimi Traore | F168: 2000000
E169: Antonio Barragan | F169: 680000
E170: Robbie Foy | F170: Free
E171: Carl Medjani | F171: Signed
E172: Dietmar Hamann | F172: 400000
E173: Ramon Calliste | F173: Free | H173: Prem
E174: David Raven | F174: Free | H174: Pts | I174: Pos
B175: Total | C175: =SUM(C159:C174) -> 28040000 | F175: =SUM(F159:F174) -> 12380000 | G175: =C175-F175 -> 15660000 | H175: 68 | I175: 3
B177: Season 05/06
B178: Craig Bellamy | C178: 6000000 | E178: Calum Woods | F178: Signed
B179: Robbie Fowler | C179: Free | E179: Bruno Cheyrou | F179: Signed
B180: Daniel Agger | C180: 5800000 | E180: Zak Whitbread | F180: Free
B181: David Martin | C181: Signed | E181: Conal Platt | F181: Free
B182: Jose Reina | C182: 6000000 | E182: Fernando Morientes | F182: 3000000
B183: Jan Kromkamp | C183: Swap | E183: John Welsh | F183: Swap
B184: Paul Anderson | C184: Signed | E184: Josemi | F184: Swap
B185: Jack Hobbs | C185: Signed | E185: Mark Smyth | F185: Free
B186: Godwin Antwi | C186: Signed | E186: Paul Harrison | F186: Free
B187: Peter Crouch | C187: 7000000 | E187: Milan Baros | F187: 6500000
B188: Mohamed Sissoko | C188: 5600000 | E188: Ritchie Partridge | F188: Signed
B189: Antonio Barragan | C189: 240000 | E189: Antonio Nunez | F189: Signed
B190: Boudewijn Zenden | C190: Free | E190: Gregory Vignal | F190: Free
B191: Mark Gonzalez | C191: 4500000 | E191: Jon Otsemobor | F191: Free | H191: Prem
E192: Mauricio Pellegrino | F192: Free | H192: Pts | I192: Pos
B193: Total | C193: =SUM(C178:C192) -> 35140000 | F193: =SUM(F178:F192) -> 9500000 | G193: =C193-F193 -> 25640000 | H193: 82 | I193: 3
B195: Season 04/05
B196: Scott Carson | C196: 1000000 | E196: El Hadji Diouf | F196: 4000000
B197: Fernando Morientes | C197: 6300000 | E197: Vladimir Smicer | F197: Free
B198: Mauricio Pellegrino | C198: Free | E198: Stephane Henchoz | F198: Free
B199: Antonio Nunez | C199: Swap | E199: Chris Butler | F199: Free
B200: Xabi Alonso | C200: 10500000 | E200: Michael Owen | F200: 8000000
B201: Luis Garcia | C201: 6000000 | E201: Danny Murphy | F201: 2500000
B202: Josemi | C202: 2000000 | E202: Markus Babbel | F202: Free | H202: Prem
B203: Djibril Cisse | C203: 14000000 | H203: Pts | I203: Pos
B204: Total | C204: =SUM(C196:C203) -> 39800000 | F204: =SUM(F196:F203) -> 14500000 | G204: =C204-F204 -> 25300000 | H204: 58 | I204: 5
B206: Season 03/04
B207: Patrice Luzi Bernardi | C207: Signed | E207: Steven Gillespie | F207: Free
B208: Harry Kewell | C208: 5000000 | E208: Stephen Vaughan | F208: Free
B209: Steve Finnan | C209: 3500000 | E209: Emile Heskey | F209: 6250000
B210: Patrice Luzi Bernardi | C210: 0 | E210: Daniel Sjolund | F210: Free
E211: Pegguy Arphexad | F211: Free | H211: Prem
E212: Andrew Nicholas | F212: Free | H212: Pts | I212: Pos
B213: Total | C213: =SUM(C207:C212) -> 8500000 | F213: =SUM(F207:F212) -> 6250000 | G213: =C213-F213 -> 2250000 | H213: 60 | I213: 4
B215: Season 02/03
B216: Salif Diao | C216: 5000000 | E216: Mark Peers | F216: Free
B217: Alou Diarra | C217: free | E217: Patrik Berger | F217: Free
B218: Florent Sinama Pongolle | C218: 2000000 | E218: Jari Litmanen | F218: Free
B219: Anthony Le Tallec | C219: 3000000 | E219: Stephen Wright | F219: 3000000
B220: Bruno Cheyrou | C220: 3700000 | E220: Neil Prince | F220: Free
E221: Nick Barmby | F221: 2750000
E222: Jorgen Nielsen | F222: Signed | H222: Prem
E223: Jamie Redknapp | F223: Free | H223: Pts | I223: Pos
B224: Total | C224: =SUM(C216:C223) -> 13700000 | F224: =SUM(F216:F223) -> 5750000 | G224: =C224-F224 -> 7950000 | H224: 64 | I224: 5
B226: Season 01/02
B227: El Hadji Diouf | C227: 11000000 | E227: Gary McAllister | F227: Free
B228: Abel Xavier | C228: 800000 | E228: John Miles | F228: Free
B229: Milan Baros | C229: 3600000 | E229: Frode Kippe | F229: Signed
B230: Nicolas Anelka | C230: loan | E230: Alan Navarro | F230: Contract Expired
B231: Jerzy Dudek | C231: 4850000 | E231: Chris O'Brien | F231: Free
B232: Chris Kirkland | C232: 6000000 | E232: Sander Westerveld | F232: 3490000
B233: John Arne Riise | C233: 4600000 | E233: Robbie Fowler | F233: 11000000
E234: Christian Ziege | F234: 4000000
E235: Leyton Maxwell | F235: Free | H235: Prem
E236: Ian Armstrong | F236: Free | H236: Pts | I236: Pos
B237: Total | C237: =SUM(C227:C236) -> 30850000 | F237: =SUM(F227:F236) -> 18490000 | G237: =C237-F237 -> 12360000 | H237: 80 | I237: 2
B239: Season 00/01
B240: Jari Litmanen | C240: Free | E240: Jon Newby | F240: 100000
B241: Igor Biscan | C241: 5500000 | E241: Titi Camara | F241: 2200000
B242: Daniel Sjolund | C242: 1000000 | E242: Haukur I. Gudnason | F242: Contract expired
B243: Gregory Vignal | C243: 500000 | E243: Erik Meijer | F243: Free
B244: Christian Ziege | C244: 5500000 | E244: Steve Staunton | F244: Free
B245: Nick Barmby | C245: 6000000 | E245: Rigobert Song | F245: 2500000
E246: Brad Friedel | F246: Free
E247: Dominic Matteo | F247: 4750000
E248: David Thompson | F248: 2750000
E249: John Boardman | F249: Free | H249: Prem
E250: Phil Babb | F250: Free | H250: Pts | I250: Pos
B251: Total | C251: =SUM(C240:C250) -> 18500000 | F251: =SUM(F240:F250) -> 12300000 | G251: =C251-F251 -> 6200000 | H251: 69 | I251: 3
B253: Season 99/00
B254: Gary McAllister | C254: Free | E254: Stig-Inge Bjornebye | F254: 300000
B255: Pegguy Arphexad | C255: Free | E255: Eifion Jones | F255: Free
B256: Bernard Diomede | C256: 3000000 | E256: Ian Dunbavin | F256: Free
B257: Markus Babbel | C257: Signed | E257: Karlheinz Riedle | F257: 200000
B258: Emile Heskey | C258: 11000000 | E258: Bjorn Kvarme | F258: 750000
B259: Dietmar Hamann | C259: 8000000 | E259: Oyvind Leonhardsen | F259: 2800000
B260: Erik Meijer | C260: Free | E260: Sean Dundee | F260: 1000000
B261: Vladimir Smicer | C261: 3750000 | E261: Paul Ince | F261: 1000000
B262: Sander Westerveld | C262: 4000000 | E262: Jamie Cassidy | F262: Free
B263: Stephane Henchoz | C263: 3500000 | E263: Tony Warner | F263: Free
B264: Titi Camara | C264: 2600000 | E264: Jean-Michel Ferri | F264: 1500000
E265: Steve McManaman | F265: Free | H265: Prem
E266: David James | F266: 1700000 | H266: Pts | I266: Pos
B267: Total | C267: =SUM(C254:C266) -> 35850000 | F267: =SUM(F254:F266) -> 9250000 | G267: =C267-F267 -> 26600000 | H267: 67 | I267: 4
B269: Season 98/99
B270: Sami Hyypia | C270: 3000000 | E270: Danny Williams | F270: Free
B271: Djimi Traore | C271: 550000 | E271: Steve Harkness | F271: 350000
B272: Rigobert Song | C272: 2600000 | E272: Jason McAteer | F272: 4000000
B273: Jean-Michel Ferri | C273: 1700000 | E273: Michael Thomas | F273: Free
B274: Frode Kippe | C274: 700000 | E274: Neil Ruddock | F274: 400000 | H274: Prem
B275: Vegard Heggem | C275: 3500000 | E275: Nicky Rizzo | F275: 300000 | H275: Pts | I275: Pos
B276: Total | C276: =SUM(C270:C275) -> 12050000 | F276: =SUM(F270:F275) -> 5050000 | G276: =C276-F276 -> 7000000 | H276: 54 | I276: 7
B278: Season 97/98
B279: Steve Staunton | C279: Free | E279: Mark Kennedy | F279: 1750000
B280: Sean Dundee | C280: 2000000 | E280: Jason Jones | F280: Free
B281: Brad Friedel | C281: 1000000 | E281: Paul Dalglish | F281: Free
B282: Haukur Gudnason | C282: 150000 | E282: John Barnes | F282: Free | H282: Prem
B283: Karlheinz Riedle | C283: 1800000 | H283: Pts | I283: Pos
B284: Total | C284: =SUM(C279:C283) -> 4950000 | F284: =SUM(F279:F283) -> 1750000 | G284: =C284-F284 -> 3200000 | H284: 65 | I284: 3
B286: Season 96/97
B287: Danny Murphy | C287: 3000000 | E287: Lee Jones | F287: 100000
B288: Paul Ince | C288: 4200000 | E288: Stan Collymore | F288: 7000000
B289: Nicky Rizzo | C289: signed | E289: Ashley Neal | F289: Free
B290: Oyvind Leonhardsen | C290: 3500000 | E290: John Scales | F290: 2600000
B291: Bjorn Kvarme | C291: Free | E291: Phil Charnock | F291: Free
B292: Jorgen Neilson | C292: 400000 | E292: Lee Brydon | F292: Free
B293: Patrik Berger | C293: 3250000 | E293: David Larmour | F293: Free | H293: Prem
B294: Paul Dalglish | C294: Trainee | H294: Pts | I294: Pos
B295: Total | C295: =SUM(C287:C294) -> 14350000 | F295: =SUM(F287:F294) -> 9700000 | G295: =C295-F295 -> 4650000 | H295: 68 | I295: 4
B297: Season 95/96
B298: Jason Mcateer | C298: 4500000 | E298: Ian Foster | F298: Free
B299: Stephen Pears | C299: free | E299: Andy Harris | F299: Free
E300: Ian Rush | F300: Free
E301: Paul Stewart | F301: Free
E302: Nigel Clough | F302: 1500000 | H302: Prem
E303: Scott Brenchley | H303: Pts | I303: Pos
B304: Total | C304: =SUM(C298:C303) -> 4500000 | F304: =SUM(F298:F303) -> 1500000 | G304: =C304-F304 -> 3000000 | H304: 71 | I304: 3
B306: Season 94/95
B307: Stan Collymore | C307: 8500000 | E307: Steve Nicol | F307: Free
B308: Mark Kennedy | C308: 1500000 | E308: Ronnie Whelan | F308: Free
B309: John Scales | C309: 3500000 | E309: Steve Morris | F309: Free
B310: Phil Babb | C310: 3600000 | E310: Julian Dicks | F310: 1000000
E311: Don Hutchison | F311: 1500000 | H311: Prem
E312: Bruce Grobbelaar | F312: Free | H312: Pts | I312: Pos
B313: Total | C313: =SUM(C307:C312) -> 17100000 | F313: =SUM(F307:F312) -> 2500000 | G313: =C313-F313 -> 14600000 | H313: 74 | I313: 4
B315: Season 93/94
B316: Michael Stensgaard | C316: 400000 | E316: Rod McAree | F316: Free
B317: Mark Gayle | C317: free | E317: Scott Paterson | F317: Free
B318: Julian Dicks | C318: 1500000 | E318: Ronny Rosenthal | F318: 250000
E319: Mike Hooper | F319: 550000
E320: Mike Marsh | F320: Swap | H320: Prem
E321: David Burrows | F321: Transfer | H321: Pts | I321: Pos
B322: Total | C322: =SUM(C316:C321) -> 1900000 | F322: =SUM(F316:F321) -> 800000 | G322: =C322-F322 -> 1100000 | H322: 60 | I322: 8
B324: Season 92/93
B325: Neil Ruddock | C325: 2500000 | E325: Stuart Whittaker | F325: Free
B326: Nigel Clough | C326: 2275000 | E326: Dean Saunders | F326: 2300000 | H326: Prem
B327: Stig-Inge Bjornebye | C327: 600000 | H327: Pts | I327: Pos
B328: Season Total | C328: =SUM(C325:C327) -> 5375000 | F328: =SUM(F325:F327) -> 2300000 | G328: =C328-F328 -> 3075000 | H328: 59 | I328: 6